id,date,tweet
1241873545002487808,2020-03-22 23:45:00+00:00,"As time passes and theres more cases I think two things are important:

1) there should be no shame around people who have covid, since no one knows who passed it to who, so that

2) anyone who tests + or thinks they might have it can announce, so contacts can prepare/isolate"
1241873543031173120,2020-03-22 23:45:00+00:00,"#Opinion: China is going to be very important in handling health questions around the world, and it has a very good record itself on improvements in health facilities and healthcare. #Covid_19 #coronavirus"
1241873542985080833,2020-03-22 23:45:00+00:00,"Its day 9 of Quarantine

hoping we all survive covid-19, and this boredom y'all."
1241873530431496193,2020-03-22 23:44:57+00:00,"Business as usual for Power Mornings tomorrow! #SocialDistancing is easy for Kirby when surrounded by Philly &amp; Joe! If anything pertinent happens with COVID-19, you’ll hear about it on Power Mornings. And of course, the Cash Tower at 7:10."
1241873527935991816,2020-03-22 23:44:56+00:00,"They will 100% try and use Weinstein having COVID-19 as an excuse to pull him out of prison. Probably doesn't even have it... but he's got money. Money can get you tested in prison, but the average citizen is still fucked. Money can buy you any result you need.

Disgusting."
1241873527889854464,2020-03-22 23:44:56+00:00,"Covid 19 update from the Pardy home:

Pretty sure we're only a few days away from me attempting TikTok dance challenges"
1241873515701309442,2020-03-22 23:44:53+00:00,"TMS COVID: Should be 2.5 at most spots now. Adding one more..

SOCCER 8:00 EST
NICARAGUA - PREMIER LEAGUE

MANAGUA ML
JUVENTUS/MANAGUA over 2.5"
1241873511641210882,2020-03-22 23:44:52+00:00,"We could have learn from Italy but no we value our jobs,religion and social activity more than our wellbeing. Everything can be place on hold till we get rid of COVID-19 but no we are looking at the figures for the future that’s not guaranteed."
1241873509179146241,2020-03-22 23:44:52+00:00,"Please we should be extra careful about #COVID-19, it's actually real and the number of victims are rising. We should take all measures in advance to prevent ourselves. Let's try as much we can not be victims. May ALLAH swt protect us"
1241873508717801474,2020-03-22 23:44:52+00:00,"COVID-19 is likely going to leave great economic hardship in its wake.  But Jesus-followers, we belong to an unshakable eternal kingdom. Seek first his kingdom &amp; his righteousness &amp; all of these other basic needs will be provided.  Sink deep kingdom roots!"
1241873506142388224,2020-03-22 23:44:51+00:00,"COVID-19 
Let’s See Just How Much Control We (Government) Have 🙄"
1241873502086578176,2020-03-22 23:44:50+00:00,"Hello All, tomorrow at 11 am Sen. Vickie Sawyer and myself will be on WSIC 1400. We will be giving updates on Covid-19. Also Beth Jones, County manager, will be with us. US Representative Patrick McHenry is suppose to call in too. Important information. Tune in please."
1241873491894435843,2020-03-22 23:44:48+00:00,Harvey got covid lolllll
1241873487041421312,2020-03-22 23:44:46+00:00,"On a different note, if you are an introvert and finding challenging breaking the ice and getting a chit chat started, #covid-19 has just solved your problems. #humor #staypositive #staystrong"
1241873486278246405,2020-03-22 23:44:46+00:00,"Sen. Rand Paul, who claims to be a physician, got tested for COVID-19, and then, selfishly and stupidly, failed to quarantine himself until he got the results. Instead, he went to the Senate gym and infected staff there and his fellow Senators. #coronavirus"
1241873477084340224,2020-03-22 23:44:44+00:00,"Tales from the front line Part 1. First weekend on call as consultant covering Covid admissions. It’s getting busy and physically and emotionally exhausting. People of all ages, with a fever, cough and I have seen a lot of diarrhoea. The CXR have bilateral infiltrates #COVID19"
1241873477046546439,2020-03-22 23:44:44+00:00,"Atiku's Son now confirm

God Please Don't Watch us on Covid-19 Please"
1241873473414127616,2020-03-22 23:44:43+00:00,"Covid-19 is real, the New Zealand government is useless.

It has to become so much more worse before it goes to level 4"
1241873472386670593,2020-03-22 23:44:43+00:00,Where does “STRESS THE FUCK OUT” go on my timesheet for last week? #WorkFromHome #Covid_19
1241873457740210176,2020-03-22 23:44:39+00:00,"GOLDMAN: “We think Boeing will remain a going concern. We think travel by
flight will be as popular as ever once COVID-19 is resolved. We therefore think shares of BA should be procured at the current price that is down 70% YTD, 80% from 2019 highs ..”

Upgrades to buy. $BA"
1241873453499781122,2020-03-22 23:44:38+00:00,I only wish Jeffrey Epstein were still alive so he could get Covid-19 too.
1241873448336609280,2020-03-22 23:44:37+00:00,"Coronavirus: Covid-19 has killed more people than SARS and MERS combined, despite lower case fatality rate.

Perhaps that's why #NarendraModi redefined Stupidity in light of #Covid_19india with the circus called #ThaliBajao, so the fatality rate gets increased for #COVIDIOTS."
1241873443307618307,2020-03-22 23:44:36+00:00,"Take this time out to switch up your hygiene grade... you don't wanna be caught unaware, #COVID-19 isn't tolerant of a dirty entity."
1241873437007556609,2020-03-22 23:44:34+00:00,"Sleep early, wake up and read about a hundred-plus messages on each chat group (about 5 for Covid updates)... and then feel bad. WTF."
1241873417344880641,2020-03-22 23:44:30+00:00,"I became crazy because of the world. Because of the coronavirus. 

•I screamed 
•I threw up plates 
•I'm hating on everyone
•Suicide came back 

Thank you #Covid_19 for my #mentalhealth"
1241873415939796996,2020-03-22 23:44:29+00:00,9/11-The recession-Covid 19: These incidents made Americans (including media) demand Washington work together and yield results.....We should make this the STANDRD! 24/7 365
1241873412085219328,2020-03-22 23:44:28+00:00,"Is there anyone that has tested positive for covid-19 and just had a dry cough, headaches and extreme fatigue, but no fever? #coronavirus #covid19 #covid19symptoms #curious"
1241873410273284104,2020-03-22 23:44:28+00:00,COVID-19 is equivalent to winter break/summer vacation but you’re grounded
1241873410080284672,2020-03-22 23:44:28+00:00,"Don’t stay silent when people, even your parents, call COVID-19 the “Chinese Virus”. Correct them. You’re part of the problem if you don’t."
1241873407672832003,2020-03-22 23:44:27+00:00,"Covid got me like movie, music, eat, sleep, repeat"
1241873406687141890,2020-03-22 23:44:27+00:00,"Pioneers:  During this ever evolving situation with COVID-19, please take time to remember and support all of our local City of Dearborn small businesses that have been so generous to high school athletics over the years."
1241873406485659648,2020-03-22 23:44:27+00:00,"Monday Thoughts; Deliberate planning. 
1. 8A &amp; MPD should deliberately plan manifest and and movement once ORDERS are push from HRC. (ALL PCS SOLDIERS within the next 60 days) 
3.  Start planning reverse COVID-19 
and Retrograde to daily operations. What does that look like?"
1241873393571360768,2020-03-22 23:44:24+00:00,I support a major stimulus to counter the economic hit from COVID-19 that
1241873393437343749,2020-03-22 23:44:24+00:00,I think people must understand that CoronaVirus and covid 19 are different things ? People even dont know the basic difference between Covid 19 and Corona virus. I shall really tell them that what Covid19 and Corona virus are.
1241873385858220033,2020-03-22 23:44:22+00:00,"Rand clearly couldnt have cared less about covid 19. 
Votes against it
Gets tested
Stays around everyone."
1241873385304571904,2020-03-22 23:44:22+00:00,"In a press conference today, COVID-19 outlined a hawkish policy towards the Syrian regime, stating that “Assad must go.”"
1241873380275630083,2020-03-22 23:44:21+00:00,"Self isolation due to COVID-19 has turned me into something else you should see how i lick Agbalumo, strawberry🍓 and watermelon 🍉 these days. 🙆‍♂️🙆‍♂️"
1241873377381560323,2020-03-22 23:44:20+00:00,"To all those who want to turn the world into one vast military dictatorship because of Covid-19 I have to say, what is the point of life when there is nothing left worth living for. The prospect of indefinite incarceration is worse than a small risk of death."
1241873375431024642,2020-03-22 23:44:20+00:00,"Seriously, it appears the greatest nation on earth is pretty much led by the stupidest people on earth. #covid-19 #trump #TrumpVirusCoverup #Congress"
1241873364874117120,2020-03-22 23:44:17+00:00,Lectures should easily be replaced by pre-recorded presentations even after COVID-19. My mental health has never been better.
1241873361128443905,2020-03-22 23:44:16+00:00,I really think COVID-19 has been here in America for awhile. Do you guys remember how sick everyone was during the holidays/early January? And how everyone was saying they had the “flu” and the flu shot “didn’t work”?
1241873360046432257,2020-03-22 23:44:16+00:00,"Based on the most recent COVID-19 update from our Officer of Health, the NLESD is further limiting access to schools, effective immediately.  Personal items will be held at the school until future notice. See the school website for more info. @NLESDCA @RogersMPSH @HUSKIES_MPSH"
1241873358133710849,2020-03-22 23:44:16+00:00,"10 years from now, I hope my child, then a beautiful 22yr old woman, will look back at this year and have heaps of stories to tell about how we survived Covid-19 in another country..."
1241873356787453952,2020-03-22 23:44:15+00:00,"I'm sorry but I understand teachers want the kids to succeed and all. They have lost their fucking minds with all of these assignments.  I understand what we're all going through but Got damn!! I'm more worried about living than some god damn school assignments!!
#Covid_19"
1241873355856363526,2020-03-22 23:44:15+00:00,"I am so angry, saddened, and DISAPPOINTED in how Donald Trump is handling COVID. He is a pathetic excuse of a leader in such a time of need! I'm so so happy I will be able to get my voice HEARD and get him out of the office. We need a leader who CARES about the people."
1241873355348652033,2020-03-22 23:44:15+00:00,"Covid 19 won’t make a dent in most people’s willing suicide cult slave mindset, long rammed through by the evil elite.

Covid 19 is not widespread destructive enough to break the programming and booj selfish cowardice."
1241873350378622979,2020-03-22 23:44:14+00:00,"The Folding@Home network, with a combined computing capacity of 470 quadrillion (470,000,000,000,000,000) calculations per second, is currently working towards tackling the COVID-19 coronavirus by protein folding to find a vaccine."
1241873347857637376,2020-03-22 23:44:13+00:00,I can just imagine American documentaries on social distancing like. COVID-19 CAN FLING OUT OF YOUR FACE AT THE SPEED OF A JET FIGHTER. TO STOP THE SPREAD YOU NEED TO STAND 0.021 STATUES OF LIBERTY APART. THAT'S MORE THAN 0.001 GRAND CANYONS DEEP.
1241873345190211585,2020-03-22 23:44:13+00:00,There’s this aspect of COVID-19 management that’s unclear to me. We’re telling people to both stay home AND to get tested. A point that makes no sense. Hospital staff are as vulnerable as anyone but we’re telling people to step right into that fire to test. Why?
1241873335211954176,2020-03-22 23:44:10+00:00,"Scientist can surely learn a lot from the antibodies in patients who are asymptomatic yet tested positive for COVID-19. With that in mind, I'd like to suggest that Rand Paul donate his body to science. Who's with me???"
1241873331990564866,2020-03-22 23:44:09+00:00,"It really bothers me that every day they announce the #Covid_19australia case numbers but reassure us that all the cases are from overseas or from people who have had close contact with a case.

Like..those are the requirements to get tested. Of course that’s what the results are"
1241873326462689282,2020-03-22 23:44:08+00:00,bacteria are destroyed by UV light - how are they viruses? can one light the lungs from the inside? Just a thought? @WHO @WHO_Europe @CoronaVid19 @SSTSundhed
1241873320351424514,2020-03-22 23:44:07+00:00,these ig nominations be spreading faster than covid-19
1241873319382503424,2020-03-22 23:44:06+00:00,"In Wake of COVID-19, State Officials Ban Greeting Cards with Touching Messages."
1241873316043878400,2020-03-22 23:44:06+00:00,I really hope someone names their newborn Covid or Corona.
1241873307944787968,2020-03-22 23:44:04+00:00,"Fuck MSNBC, CNN, Fox and every other network that allowed that lying fucking scumbag Trump to go on TV and LIE about how he's helping us and our health care. Fuck Trump and the GOP whose using COVID-19 as an excuse for giving more money to their donors! #TrumpLiesPeopleDie"
1241873305088524293,2020-03-22 23:44:03+00:00,"So, how about that covid 19?"
1241873302152458246,2020-03-22 23:44:02+00:00,My Covid jokes aren't contagious or viral
1241873294661423109,2020-03-22 23:44:00+00:00,"Despite being in great physical shape, I’m in an at risk category due to 50% kidney function. My roommate is a nurse. Due to a lack of adequate PPE, it’s just a matter of time before I get COVID-19 from my roommate. Watching this administration fail to invoke the National Defense"
1241873291515768837,2020-03-22 23:44:00+00:00,My mum is working shitty hours at the hospital practically risking herself with a high possibility of catching COVID-19 and u fuckers can’t stay in ur house or close stores. Yall have been given a choice go self isolate and keeep yourselves and other ppl safe from passing it
1241873289015775232,2020-03-22 23:43:59+00:00,"I think my workmate thought kidney failure is just normal illness and dialysis procedure just fix it to make me healthy. Thats why its hard to green light my emergency leave.

No shit. If I contract Covid-19, I'm gone."
1241873287040434176,2020-03-22 23:43:59+00:00,Did someone tell Nigerians that covid 19 spreads through shaking hands alone? My uncle had guests at home and proudly told my sister they hand hand sanitizers 😭 she’s been boiling since 10pm.
1241873285887021063,2020-03-22 23:43:58+00:00,Did anyone catch who Portman said died from Covid-19 that he personally knew?
1241873281633959936,2020-03-22 23:43:57+00:00,Bro remember when we were all sick at the beginning year and we said “how is everyone sick at the same time?” That was the Covid-19. We all survived. This lockdown ain’t doing shit. If you get it then you get it.
1241873277636808710,2020-03-22 23:43:56+00:00,"Fitness people are soon gonna start planning their ""Lose your COVID 19lbs"" diet and exercise plans, lol"
1241873275564642304,2020-03-22 23:43:56+00:00,Still waiting on anitwitter to anthromorphise covid-19 into Corona-chan or covid-chan
1241873272075059202,2020-03-22 23:43:55+00:00,my bank account needed covid-19
1241873271617916928,2020-03-22 23:43:55+00:00,Every gym in the country was required to close (even apartment building gym) which is really smart considering #Covid_19 can be transmitted via surface contact followed by touching one’s face so why was the @USSenate gym still open?
1241873263342415872,2020-03-22 23:43:53+00:00,"...I feel like after watching today's Trump Covid-19 presser that I've truly earned the right to say:

I've seen some shit."
1241873258154246146,2020-03-22 23:43:52+00:00,Just donated US $20 to the Covid-19 response fund. Normally I would never talk about being charitable; but I just wanted people to know I gave a higher percentage of my income away then Michael Bloomberg @MikeBloomberg
1241873256438775808,2020-03-22 23:43:51+00:00,"Day 11 of the 2020 Covid-19 Grocery Panic: much calmer day today, calmest since March 11th. Which means I’m much calmer too, I was just a bit riled up yesterday but who can blame me? I won’t have to drink a half a bottle of rum tonight like I did last night!"
1241873253565526017,2020-03-22 23:43:51+00:00,"This sucks, I’ve reached the 6 month mark after surgery and was able to play football again... and then this whole thing happened with Covid-19. I think it’s time to hang my boots up 😔 time to focus on finishing and commissioning as an officer in the Air Force"
1241873246515073025,2020-03-22 23:43:49+00:00,COVID-19 is the human version of 2319 from Monsters Inc.
1241873237035925506,2020-03-22 23:43:47+00:00,Why can't we all just follow the government's instructions so we can reduce the spread of COVID 19 and knock it out? I feel like a kindergarten that keeps losing more recess time because one or two kids can't follow simple instructions.
1241873226390634497,2020-03-22 23:43:44+00:00,thou shall not COVID-19 thy neighbors wife
1241873223421054977,2020-03-22 23:43:44+00:00,"Someone I follow on Facebook just posted an article by Ad*lstein ""exposing"" the Japanese government's cover-up of Covid.
Time to start pruning the ol' friends list."
1241873220388696066,2020-03-22 23:43:43+00:00,"Trump talks about this ""invisible enemy"" as though it is greater than the VISIBLE enemy we have in him.  Together, Covid-19 AND Trump will cost tens of thousands of lives that DIDN'T need to be lost in this country."
1241873217628844035,2020-03-22 23:43:42+00:00,Intense 3v3 wiffle ball game in the yard. Corona 2021 South Showcase take a late inning lead with  @kaeden_taylor  2 HR’s against the Covid 2019 Elite Prime. Tomorrow’s matchup at 5oclock ish. Looking for prospects.
1241873216030662657,2020-03-22 23:43:42+00:00,Covid
1241873215636615168,2020-03-22 23:43:42+00:00,Resist the hysteria and panic over #COVID-19.  Reacting to a public health issue does NOT = trashing the Constitution and destroying the economy. Getting back to normal or USA will collapse outright. Dem's want collapse-resist their march to totalitarianism.
1241873209554690048,2020-03-22 23:43:40+00:00,Small business owners and commercial landlords.  The business interruption coverage in your insurance policy may cover losses due to Covid 19 shutdown.
1241873206467801094,2020-03-22 23:43:39+00:00,"around 15% of COVID-19 patients suffer from severe disease and hospitals being overwhelmed!

Time has run out"
1241873200327184384,2020-03-22 23:43:38+00:00,"Hey @GOP and @TheDemocrats :

Our poor, jobless, homeless &amp; seniors need checks NOW. Their 2018 taxpayer status matters not. Bailing out their employers should not be at the top of the list. You’ve already f**ked around so long that Rand Paul has exposed you all to COVID-19. 🙏🏼"
1241873195331997702,2020-03-22 23:43:37+00:00,"Dear @CDCemergency @CDC_NCEZID, how does any small company that has a potential therapeutic solution to the drama of COVID-19 do so that the effectiveness of its therapy is tested on the virus strain?  Where should you go?

Thank you"
1241873190554685440,2020-03-22 23:43:36+00:00,It’s funny how a month ago the media was “blowing it out of proportion” regarding COVID-19 but now everyone wants to shutdown their state 🙄
1241873181549395972,2020-03-22 23:43:34+00:00,#Covid_19SA #lockDownSouthAfrica #CoronavirusInSA #Italy #Chivia is the cure found or not?
1241873178902724608,2020-03-22 23:43:33+00:00,"If Harvey Weinstein has COVID-19, so too must other inmates.

Weinstein is a loathsome human.

But if prisons are unable to keep prisoners safe from this virus, we are subjecting humans to an experimental extrajudicial death sentence lucky dip.

And that's morally indefensible."
1241873173680971777,2020-03-22 23:43:32+00:00,#BREAKING: News outlets reporting that Sen. Rand Paul mingled with numerous colleagues for a week while waiting for his COVID-19 test results and was spotted at the gym this morning. Sen. Paul discovered this afternoon that he is POSITIVE for coronavirus.  #COVID_19 #coronavirus
1241873165674053633,2020-03-22 23:43:30+00:00,"I'm trying to keep out of partisan politics at the moment, but there's one serious question I have to ask : latest figures for Scotland are 519 diagnosed covid cases, and 10 deaths. Why did we need military support already?

Genuine answers please."
1241873164423970817,2020-03-22 23:43:29+00:00,On ny way to catch covid. I’m gonna sue my company if ever I really catch it 😌
1241873146921259014,2020-03-22 23:43:25+00:00,Trump says he spent a billion dollars to be president...who tf cares I’m trying to find out if the person next to me has COVID
1241873128831234049,2020-03-22 23:43:21+00:00,"The #world_must_lift_hands for #Italy!!!
#Italy is suffering from, almost half of the global burden of COVID-19 lonely!
#37.5% of the total deaths are in Italy.
#excluding deaths from China,
#48% of the #total_deaths are from Italy."
1241873121063456771,2020-03-22 23:43:19+00:00,Well I’m about to transport a COVID patient... Nice knowing you all! ✌🏼
1241873120786632705,2020-03-22 23:43:19+00:00,"116 New cases in USA. Total cases in USA: 32580
21 New cases in Germany. Total cases in Germany: 24873
1 New death in USA. Total deaths in USA: 415

#Covid_19 #COVID2019"
1241873112108535808,2020-03-22 23:43:17+00:00,"Remember last year when the worst thing was #GameofThrones  finale?
😂😂
I miss these old days 
#Covid_19"
1241873100565692418,2020-03-22 23:43:14+00:00,there is 102 cases of covid 19 in new zealand i hope everyone is safe 🥺💗
1241873094987460608,2020-03-22 23:43:13+00:00,During COVID press conference President Trump said a US woman was freed from hostiles in a foreign country in a military operation. He mentioned General Milly
1241873093892747265,2020-03-22 23:43:13+00:00,Retweet; DEMOCRATS kill relief act. 47-47: Senate fails to advance Phase 3 COVID-19 economic stimulus bill process. 60 votes were needed. All Democrats voted No. McConnell switched his vote to No allowing for 2nd vote. 5 republicans are in self-quarantine &amp; missed the vote.
1241873090784583680,2020-03-22 23:43:12+00:00,"In this crisis, I learned how to organize my goals. At this point of time, my priority is to build my spiritual health. I know and He knows I love Him, but I think it is not enough. Somehow I should thank COVID-19 because of the time it gave me."
1241873089337663491,2020-03-22 23:43:12+00:00,Reading scary covid reports but Peruzzi's colonal vilus video keeps replaying in my head😂😂😂
1241873082140078080,2020-03-22 23:43:10+00:00,"don’t have it in me to try to tell people why social distancing is lifesaving/COVID is bad and will kill so many people, so am prob just gonna use this as an opportunity to clean up my social media"
1241873081817317376,2020-03-22 23:43:10+00:00,Hi @ShaneLowryGolf fireman/paramedic home after a covid 19 day. Sky sports lifted the spirits showing your Open win ⛳🏌️‍♂️great day for Ireland......could you please spread the word ... social distancing is imperative if we have these days in the future 🏆
1241873078625415172,2020-03-22 23:43:09+00:00,"Man, Covid all over Harvey Weinstein without his permission or consent? Damn!"
1241873076565856256,2020-03-22 23:43:08+00:00,"36 new cases of Covid-19 in New Zealand, bringing our current total to 102.

#COVID19nz #coronavirusnz #covidupdate"
1241873073957027840,2020-03-22 23:43:08+00:00,"the best we can hope for is that most of the ‘political class’ get covid-19, because otherwise they’ll feel zero effect from this pandemic. Completely secure in $200k jobs that require zero fucking work at all now they can isolate themselves from the public."
1241873066344329216,2020-03-22 23:43:06+00:00,"I hope #Coronavid19 #covid_19mexico  doesn’t last long, it is ruining our lives"
1241873064180228098,2020-03-22 23:43:06+00:00,"I think the hardest economic principle to grasp is that human lives have an economic value. At some point, we can no longer justify the economic impact of prolonged shutdowns vs the risk of contracting COVID. Is that point today? No. But I would guess it’s relatively soon."
1241873062271881216,2020-03-22 23:43:05+00:00,"COVID-19 A Call For Pray Movement. We Are Requesting A Moment Of Silence Prayer MARCH 28, 2020 @ 9a.m. For COVID-19 To Flee Off The Face Of This Earth In Jesus Name. Alan"
1241873059289731072,2020-03-22 23:43:04+00:00,"Hey Twitter, I get that Harvey Weinstein is a terrible person, but maybe we SHOULDN'T be celebrating the spread of a very dangerous disease. I'm just saying. Every new case of COVID-19 is another chance for it to spread."
1241873054634041352,2020-03-22 23:43:03+00:00,"In the middle of this COVID-19, How these girls are older than their mums despite being “happier”, “freer” is baffling."
1241873053652365312,2020-03-22 23:43:03+00:00,How selfish and paranoid these politicians who took COVID-19 test and they are asymptomatic!
1241873039354212353,2020-03-22 23:43:00+00:00,"On 22nd March at 5pm #SocialDistancing in India got humiliated
#5baje5minute #COVIDIOT #Covid_19india #clapforourcarers #IndiaFightsCorona #ThaliBajao"
1241873036166356992,2020-03-22 23:42:59+00:00,you can't tell me that the Federal govt won't want to turn over IDs and locations from testing for COVID-19 to ICE.
1241873035902111744,2020-03-22 23:42:59+00:00,"Jim Murren, who led @MGMResortsIntl through unprecedented growth and later, unforgivable PR blunders during Southern Nevada’s darkest days, is leading COVID-19 task force for @GovSisolak, who MGM helped elect, then staffed his administration. Ok. Not all of it."
1241873034849538050,2020-03-22 23:42:59+00:00,My dad anxiety level is at an all time high because of COVID
