id,date,tweet
1241874623236464640,2020-03-22 23:49:17+00:00,"Well geez New York, I didn’t know you wanted to win the COVID popularity contest that bad #secondplace #ifyourenotfirstyourelast"
1241874616395509761,2020-03-22 23:49:16+00:00,"I dont remember falling asleep, but I just woke up and COVID-19 is real an happening"
1241874609164578816,2020-03-22 23:49:14+00:00,"My Dom side has really begun to blossom since TFF.

Maybe it’s all the new subs who’re interested in trying out BDSM asking me for advice lately. I’ve enjoyed being a good role model/teacher for them all.

Wish I could do more practical teaching tho, damn Covid-19 😂"
1241874605062701057,2020-03-22 23:49:13+00:00,Nigeria brought koboko to a gun fight. COVID-19 ‘bout to rape us. Oluwa intervene. 👏🏿👏🏿😢
1241874599710568448,2020-03-22 23:49:12+00:00,This is dangerous because in the Bible it says not to covid your neighbour's wife
1241874599224147969,2020-03-22 23:49:12+00:00,This is the Covid Mask Project. Dedicated to crowdsourcing ideas for DIY and small-scale (and rapid) manufacture of virus-suppressing masks. We can go back to school and work tomorrow if we could all just wear a mask (and goggles). #covid19 #covidmask
1241874590764335105,2020-03-22 23:49:10+00:00,"So my bio prof decided at 6:57am to not have our zoom lecture at 7am, my clothes are being held hostage at my now shut-down campus, my dog is dying, and my trig prof left me on read 9 days ago after I told her I couldn't access our online textbook. How's your covid-cation going?"
1241874587140276225,2020-03-22 23:49:09+00:00,"i’ve been referring to life post covid as the new world.
¯\_(ツ)_/¯         x"
1241874586146349057,2020-03-22 23:49:08+00:00,"a lot of people are (rightfully) asking, ""how did Harvey Weinstein, a jailed rapist, get a COVID-19 test done when I can't?"" 

simple: the click revenue on the story, where every headline is now on thousands of bullshit ""news"" sites, willed it so."
1241874582753153030,2020-03-22 23:49:08+00:00,"All these ""it can survive in Nigeria"" mentality has to stop IMMEDIATELY. Covid-19 is real...stop deceiving yourself.

May Allah Heals your son and every other patients of this outbreak sir. @atiku"
1241874580911697920,2020-03-22 23:49:07+00:00,"the first COVID-19 death in utah confirmed today
big F"
1241874575689801729,2020-03-22 23:49:06+00:00,How many rappers do you think are gonna have bars about being sicker than covid/corona when this all blows over 😂
1241874574905454592,2020-03-22 23:49:06+00:00,"Worth remembering that a lot of the frustrations and obstacles many of us are experiencing this week are par for the course for unemployed people, people with disability etc. 

A lot of structural problems right now are being illuminated by COVID-19, not necessary caused by it"
1241874574385405952,2020-03-22 23:49:06+00:00,"Hey Siri, what are we doing today?
#Covid_19australia #ShutAustraliaDown"
1241874570535145472,2020-03-22 23:49:05+00:00,"Just chatted with an old grad school chum who said that he is ""relishing in the spectacle"" of
Covid-19. That's my dawg."
1241874570015096841,2020-03-22 23:49:05+00:00,"To keep my mind off of this COVID-19 issue...

I think about how the Titans traded away a 5x Pro Bowler, 6 Time Captain, in the franchise top 10 in sacks...

Let me go back to watching CNN and Wolf...."
1241874565925613569,2020-03-22 23:49:04+00:00,Just as a precaution can we remove the brains and sever the spinal cords of the deceased persons from COVID-19. Just a precaution...
1241874564772175872,2020-03-22 23:49:03+00:00,"Thank God Trump started to breathe heavily and had to end his propaganda rally. I guess it’s time for another fix or maybe its the COVID-19, he won’t admit. Why? Why?"
1241874557075628034,2020-03-22 23:49:01+00:00,Know your COVID-19 status
1241874553237680128,2020-03-22 23:49:01+00:00,"#IndiaFightsCorona
Leaving no stone unturned, the Modi Govt has launched a WhatsApp helpline under MyGov India to spread awareness on COVID-19. Through this, the citizens can get in touch regarding any query or clarification about the Coronavirus."
1241874545277120512,2020-03-22 23:48:59+00:00,"Why isn’t anyone scared??? The UK gets a little bit of sun during a pandemic &amp; you all run to the beach for a tan. The youngest victim who has died due to COVID-19 is 18 yrs old. If this doesn’t scare you, then i dont know what will. PLEASE stay indoors! #UKLockdownNow #COVIDー19"
1241874540831129606,2020-03-22 23:48:58+00:00,"I wanna see covid-19 specials on TV programmes like they do at Christmas, imagine the Derry Girls and Friday Night Dinner dealing with a lockdown😂"
1241874538486349825,2020-03-22 23:48:57+00:00,We can’t think of the Covid-19 in a binary way in terms of cases only. There have been only 2 cases so far in New Zealand which are unknown and the rest have been from overseas peoole returning home. The number of cases is going to increase but we must not panic.
1241874535433023490,2020-03-22 23:48:56+00:00,"This is no time for Politicking, we are faced with a Global threat. Let us all follow the WHO regulations and stay safe. COVID-19 is real"
1241874532094410753,2020-03-22 23:48:56+00:00,If Covid-19 ruins my birthday i’m going to kms. NO LIE
1241874523139346432,2020-03-22 23:48:53+00:00,"#IndiaFightsCorona
India is responding early and effectively to contain outbreaks with its well-developed plans in place. It has also called for technical and collaborative partnerships of Indian scientists to find ways to combat Covid-19."
1241874520987877377,2020-03-22 23:48:53+00:00,Every day I go to work not not knowing even I’ve come in contact with Covid-19
1241874516877275136,2020-03-22 23:48:52+00:00,"Still accepting cash payments, not even glass barriers! @CaltexAustralia, do you not care about your staff? Do better #Covid_19australia"
1241874515266883586,2020-03-22 23:48:52+00:00,there's a risk of severe weather in the next few days on top of this covid stuff like can we please slow this apocalypse down a little bit
1241874500507049985,2020-03-22 23:48:48+00:00,"After about a week of studying data and reports on covid-19, I have come up with the below conclusions. We should mandate quarantine for 14 days. In the 11th day or so we should see the surge come down. Building up testing the whole time. After that you quarantine the sick and 2"
1241874493993295872,2020-03-22 23:48:46+00:00,"My brother just called COVID-19 the ""kung-flu"" and then proceeded to call it the ""chinese virus"". I called him out on it and my parents defended him. Good thing I don't live there anymore and was able to walk out. I was literally about to fucking fight my whole goddamn family."
1241874490403041282,2020-03-22 23:48:46+00:00,Everyone thought young people were gonna be fine until we realized Covid-19 is a respiratory disease and our whole generation is addicted to vaping and physically can’t stay away from each other :)
1241874487844495366,2020-03-22 23:48:45+00:00,I remember when Frozen first released and there was that like national snow storm that just forced things to shut down for awhile and everyone was like o haha gr8 marketing lol jk. What if that’s what Tom Nook from animal crossing did with COVID-19
1241874481041162242,2020-03-22 23:48:43+00:00,Harvey Weinstein tested POSITIVE for Covid-19!
1241874478503788547,2020-03-22 23:48:43+00:00,"Me: I can't take this anymore, it's gross incompetency.
Joe: Yeah, I know but we only have a few months left.
Me: Yeah, ya mean in general or for this election?
#coronavirus #Covid_19 #CoronaVirusUpdate #CoronavirusPandemic #lockdown #pandemic #TrumpVirusCoverup #TrumpPandemic"
1241874478323269632,2020-03-22 23:48:43+00:00,"No one from the Houston Astros has tested positive for COVID-19, they saw the signs early.
#CoronaVirus"
1241874477308358657,2020-03-22 23:48:42+00:00,"At the 3/21 press conference, @GovPritzker said Illinois was going to allow physicians licensed in border states to assist with response to Covid-19.  But, there are no waivers or guidance on @IDFPR or @IDPH websites."
1241874470140145665,2020-03-22 23:48:41+00:00,"if i die of covid-19 then WHO to blame?

I've been very careful but things are not here.

My parents gotta go to Their jobs meet a lot of people,  people who never care about it.  Then how my home quarantine will effect?"
1241874467522883585,2020-03-22 23:48:40+00:00,"Time for level 3 lock down I think..

102 cases now.
66 yesterday
52 Saturday.
41 Friday ?

Exponential growth.
I expect 185 ish tomorrow.

#Covid_19nz"
1241874467405643778,2020-03-22 23:48:40+00:00,"The president of the United states just mocked a sitting senator who has self quarantined due to possible exposure to covid-19. ""Oh, that's too bad"" in an extremely sarcastic voice.  What an absolutely horrible human."
1241874465371369473,2020-03-22 23:48:40+00:00,"For the idiots out there, and sadly, it appears there are many....

Covid-19 is NOT a terrorist organisation. 

Altering your behaviour is NOT giving in to terrorists. 

It will likely save your life and maybe someone close to you...... Don’t make the problem worse....please"
1241874453241487361,2020-03-22 23:48:37+00:00,If the COVID-19 “knocked out” for 2 months about 20 @GOP senators @SenateGOP - could we re-do IMPEACHMENT and throw @realDonaldTrump out of office and then work to regain our ground as a moral nation again?
1241874452465549315,2020-03-22 23:48:37+00:00,"Tbf, COVID-19 isn't as serious as the world powers have reacted to it, but you can't see projections and not act."
1241874449835520001,2020-03-22 23:48:36+00:00,"Mass media or arse media DZMM SAID WE ARE FOR A SURPRISE THE COVID-19 victim are going up ,instead of helping this radio was fanning hysteria"
1241874447038132224,2020-03-22 23:48:35+00:00,"Question for those of you so intent on calling this the “Chinese Virus” because “that’s where it came from”; SARS, which is in the same Coronavirus family as Covid-19, also broke out first in China. 

Should we be calling SARS the Chinese virus as well?"
1241874440927039488,2020-03-22 23:48:34+00:00,"I think that COVID-19: Travellers stranded at Katuna as Uganda, Rwanda close borders"
1241874435482636288,2020-03-22 23:48:32+00:00,"#IndiaFightsCorona
Bringing citizen awareness, the Modi Govt is ensuring that all State Govts issue directions asking all- from children to senior citizens to stay indoors to curb the spread of COVID-19."
1241874435008860165,2020-03-22 23:48:32+00:00,in the air Covid-19: Uganda closes border with Kenya
1241874434232913921,2020-03-22 23:48:32+00:00,"The fact that they moved me over to Children’s Hospital dur to me being high risk for Covid-19 and still have me doing 12+ hr shifts daily, is insane 🤯😭"
1241874429719830528,2020-03-22 23:48:31+00:00,"COVID-19 Update as of : 03/22/2020 4:48 PM

Cases: 335,865
Deaths: 14,612
Recoveries: 97,636"
1241874429388472322,2020-03-22 23:48:31+00:00,Further update: New Haven COVID-19 patient that slipped quarantine wasn’t actually located at 4:30. He was found at 7 p.m.  in Milford. They had the wrong guy earlier. I will be asking more questions about this tomorrow.
1241874426808983554,2020-03-22 23:48:30+00:00,Nigeria should assemble the likes of @Orange_Nigeria emzor and other Nigeria pharma and discuss a licensing arrangement with the US or S.korea to allow us manufacture Covid test kits and ramp up testing in Nigeria. If security vote is good for anything this is it. @NCDCgov
1241874424053153792,2020-03-22 23:48:30+00:00,"The stimulus pkgs won’t work. Il considered &amp; misdirected. Sitting on our arses watching TV won’t save the economy. Build things - a VFT, desalination plants, houses, solar farms. Test workers prior to work. Use the time &amp; money building things we’ve been putting off. #Covid_19au"
1241874407276101632,2020-03-22 23:48:26+00:00,"So everyone in congress definitely has covid, right?"
1241874404553838593,2020-03-22 23:48:25+00:00,"I’m not very political. But after watching two press conferences concerning the Covid-19 pandemic, I am beyond blessed and so proud to be an American. We are innovative, smart and compassionate. This will all be a great story to tell our grandkids one day! #MissOptimistic"
1241874396899414022,2020-03-22 23:48:23+00:00,why is youtube demonetizing people who mention covid by name
1241874396119097344,2020-03-22 23:48:23+00:00,"#IndiaFightsCorona
The Modi Govt has been enforcing effective measures to flatten the COVID-19 curve. The Indian Railways has suspended concessional ticket bookings and is reimbursing those travellers whose tickets have been cancelled."
1241874391434031105,2020-03-22 23:48:22+00:00,I heard they’re cancelling orders for that COVID 19 home test kits 👀👀🤭 @DRESINATRA
1241874372111077377,2020-03-22 23:48:17+00:00,"Contracting the covid 19 would be too good for a person of such small stature as tiny-hand Trump, syphilis would be more appropriate for the Dumpster..."
1241874365387550721,2020-03-22 23:48:16+00:00,"It’s really upsetting to see people wear gloves and masks just to step out of their house. Meanwhile, I work at a hospital and we are running out of supplies because people think just by wearing gloves or a mask they won’t be susceptible to COVID-19."
1241874364389351425,2020-03-22 23:48:16+00:00,"how quickly the emails from businesses and stores changed from ""here's how we're dealing with covid-19"" to ""stuck at home in quarantine?? here's 20% storewide!!!!"""
1241874362099093507,2020-03-22 23:48:15+00:00,"#IndiaFightsCorona
The Modi  Govt has been putting in place stringent measures to curb the spread of COVID-19. As the latest addition to the advisory, no scheduled international commercial passenger aircraft will be allowed to land in India for a week from March 22nd, 2020."
1241874352930463746,2020-03-22 23:48:13+00:00,What if the covid-19 already in your system how the fuck hand sanatizer gonna clean your insides😷 just drink bleach it’ll clean your insides 🤪
1241874348861947905,2020-03-22 23:48:12+00:00,"if it wasn’t for COVID-19, i would be in nashville watching @bri_sharp makeout with every hot cowboy rn :/"
1241874348815810564,2020-03-22 23:48:12+00:00,"In an effort to not use alcohol to numb COVID anxiety, I'm trying to burn away my anxiety with sriracha.

So far the anxiety persists and I now have 35 new ulcers."
1241874347729522688,2020-03-22 23:48:12+00:00,The covid spread is going to get very bad in Nigeria this new week.
1241874346949435393,2020-03-22 23:48:11+00:00,"The @senategop @housegop Covid-19 fund has $500 billion controlled by Mnuchin with no strings attached.  What could go wrong? Everything. The @gop @realDonaldTrump corruption never ends. 

#VoteMcConnellOut 
#VoteBlue 
#VoteGopOut 
#coronavirus 
#TrumpVirus2020 
#VoteBlue2020"
1241874333653442567,2020-03-22 23:48:08+00:00,Why is there still news about We*nste*n? I don’t care if he has covid. I’m sure there are a ton of prisoners who have it. He shouldn’t still be in the news.
1241874322379202561,2020-03-22 23:48:06+00:00,I think it will be a market for the livestream after the COVID-19. The introverts love this social distancing vibe! We the extroverts need to be in the mix!!
1241874318084186112,2020-03-22 23:48:04+00:00,Facts whats good tn someone without covid invite me over
1241874309250838528,2020-03-22 23:48:02+00:00,Covid content is the absolute worst
1241874306465857536,2020-03-22 23:48:02+00:00,Bet gender neutral and left leaning ads disappear from TV soon. #Covid_19australia
1241874304792506369,2020-03-22 23:48:01+00:00,I’m glad my daughter isn’t with my right now. I kinda been exposed to COVID because of my job (of course I take the proper precautions) but I would be paranoid if my daughter was with me. But she hasn’t been with me since my job told me that we might’ve been exposed.
1241874301214535680,2020-03-22 23:48:00+00:00,"Prerequistes for COVID-19 testing:

Senator ☑️ 
NBA player ☑️

Congratulations, Bill Bradley!"
1241874297179852800,2020-03-22 23:48:00+00:00,Convicted rapist Weinstein has been tested positive for COVID-19 meanwhile most people Americans and Brits are not being tested including the NHS staff. The USA and UK have let their people down!
1241874287298043910,2020-03-22 23:47:57+00:00,"I'm tired of feeling helpless, I'm tired of feeling fear when I go into work. I just hope the warmth of spring will fix all this covid shit.

I wanna have fun again."
1241874287285452800,2020-03-22 23:47:57+00:00,"COVID-19 health information:

Symptoms:
fever, cough, shortness of breath

Complications:
pneumonia, Acute respiratory distress syndrome (ARDS), kidney failure.

Risk Factors:
 age, serious underlying medical conditions (e.g. heart disease, diabetes, lung disease, etc).
#COVID19"
1241874279202947078,2020-03-22 23:47:55+00:00,"i have been making sure that the people i am friends or even just friendly with are not racist, homophobic, transphobic or sexist in any way, but from now i will have to make sure they stayed home during covid-19."
1241874278599069699,2020-03-22 23:47:55+00:00,"Homeless being placed in hotels and Elderly recieving support from new social care hubs. The same groups hit hard the past decade. Meanwhile workers keep country ticking over. 

We must never allow these people to foot the bill for Covid 19 when this is over. 

No Austerity 2.0."
1241874275931308032,2020-03-22 23:47:54+00:00,Covid better be an April Fools joke on April 1st
1241874274010271745,2020-03-22 23:47:54+00:00,Well do yous not think that CHINA could of warned us sooner as they kept it quiet for months tte covid 19 leak at Wuhan was detected on 2019 hence they called it covid 19 so what response is or Goverments expecting from CHINA ? And why do they not seem to care ?
1241874257438597121,2020-03-22 23:47:50+00:00,"#Covid_19australia #COVID19Aus #AlboMP
Albo's speech in parliament worth a watch - measured, cooperative, and low key but impressive.
Compared to that of Prime Marketer (Scott Morrison) - you're still not Churchill but keep trying."
1241874257258270720,2020-03-22 23:47:50+00:00,"100 Covid-19 cases in one week here in New Zealand - it’s gonna get worse 😬 😷 

#Covid_19 #coronavirus"
1241874256100761603,2020-03-22 23:47:50+00:00,"after who gave COVID-19 its name (a while ago) for the sole purpose of it not having a geographic or ethnic name attached to it, going out of your way to say “chinese virus” says something about YOU"
1241874247678656513,2020-03-22 23:47:48+00:00,Rapists like Harvey Weinstein should not have access to COVID-19 tests. Period.
1241874247569625088,2020-03-22 23:47:48+00:00,One common enemy worldwide. Covid-19. Inter nation differences has taken the back seat.
1241874246285930497,2020-03-22 23:47:47+00:00,"I really miss the moments of having to apply medicated patches  because of the day's tiring work.
Hoping I could land at a stable position when this COVID-19 pandamic ends."
1241874244222570497,2020-03-22 23:47:47+00:00,"Naked and Afraid: COVID-19 Home Edition....
Wandering around your house butt nekkid, foraging for food."
1241874241269772288,2020-03-22 23:47:46+00:00,"Thoughts heading into week 3 of COVID response:
1. Grateful for close, trusted colleagues - they make everything seem possible
2. Daily scramble shifting to controlled planning
3. Getting psychologically ready for a marathon, not a sprint. Not there yet...still feels surreal"
1241874226530975750,2020-03-22 23:47:43+00:00,"King Salman on Sunday issued a nationwide curfew order from 7 pm until 6 am every day for 21 days from the evening of Monday, March 23, 2020 to curb #Covid_19 spread"
1241874220390350854,2020-03-22 23:47:41+00:00,Next message from PETA:  COVID-19 wouldn’t exist in a human-free world
1241874217588510720,2020-03-22 23:47:41+00:00,"__________________________________________

COVID-19 in California, Mar 22, 2020:

1,739 confirmed cases, 4:34 p.m.
(1435 confirmed, 3/21, 5:00 p.m.)

32 confirmed deaths
(26 confirmed deaths, 5:00 p.m., 3/21)
___________________________________________"
1241874209049137156,2020-03-22 23:47:39+00:00,Loss of taste and smell appears to be a symptom of COVID-19... I repeat LOSS OF TASTE AND SMELL is a symptom... it might be your only symptom so pay attention
1241874193941016577,2020-03-22 23:47:35+00:00,It only took a little COVID-19 to stop biting my nails. I’ve been biting my nails for about 35 years. If I can kick that habit then y’all can quit smoking. #coronavirus #SundayThoughts #COVID19
1241874180565381122,2020-03-22 23:47:32+00:00,"Rand Paul heads to the gym after getting tested for COVID. 

I mean..."
1241874175544836096,2020-03-22 23:47:31+00:00,"Anyone else feeling like we’re in some bizarro Clue game: Harvey Weinstein, in Ryker’s, with COVID; Rand Paul, in the pool...."
1241874168204767232,2020-03-22 23:47:29+00:00,"I really don’t know how that conspiracy theory about Covid-19 and 5G was even entertained when there isn’t even 5G where most cases are reported. @davidicke really jumped the shark on that one, and now his son is backtracking on his behalf after deleting all those tweets."
1241874167823314944,2020-03-22 23:47:29+00:00,I hear Harvey Weinstein has COVID. Finally some redeeming work from the DOC. Give the meds to someone else.
1241874164153290754,2020-03-22 23:47:28+00:00,"The world made it through NARS, H1N1, Ebola, and other diseases.  We can make it through Covid-19 but only if everyone does their part and acts responsibly.  A big thank you to all health care workers and others who are working nonstop to help people."
1241874163188580354,2020-03-22 23:47:28+00:00,Just played a game of #Warzone with a guy named Covid_19.. 🤦‍♂️🤦‍♂️
1241874156788027399,2020-03-22 23:47:26+00:00,The patients thats recovering from covid~19 is coming to my hospital to recover because they don’t have enough hospital beds.
1241874153562492928,2020-03-22 23:47:25+00:00,".@SenSchumer &amp; .@SpeakerPelosi 
YOU are Singlehandedly screwing AMERICA by holding out approval of the Covid Bill because YOU don't want any money to go to Corporations. 
Those CORPORATIONS HIRE AMERICANS OUT OF WORK.
You want the economy to tank &amp; you want to blame @POTUS 4 it."
1241874150601433089,2020-03-22 23:47:25+00:00,secondary danger of the Illinois COVID-19 lockdown: I am bored enough to be tempted back into playing Factorio
1241874145924841473,2020-03-22 23:47:23+00:00,Rand Paul COVID-19 test is taking several days.  Trump says he got his test done on a Friday evening and got the results Saturday morning.
1241874144041541632,2020-03-22 23:47:23+00:00,the fact that harvey weinstein can get tested for covid when most of us cannot is disgusting. i hope he survives it and rots in prison all his life.
1241874134264696839,2020-03-22 23:47:21+00:00,harvey weinstein has covid-19 in prison lol
1241874133958492166,2020-03-22 23:47:21+00:00,"If Pete Buttigieg were president right now we'd be hearing sermons on the importance of making in-roads with the COVID-19 and how essential it is for us, as Americans, to honor the values and traditions of the virus."
1241874130187644928,2020-03-22 23:47:20+00:00,"Let s be reminded of Consumers responsibilities amidst the COVID 19, staying informed, read and follow instructions, use products and services  properly , speak out vs . wrongdoing and lawfully purchasing goods and services .

Laban Konsyumer Inc.
Atty Victorio Mario Dimagiba"
1241874127910088704,2020-03-22 23:47:19+00:00,Bernie is hosting AOC on a livestream discussion on Covid-19. Biden is off the fucking grid. We are fucked in a Biden vs Trump election.
1241874126404534274,2020-03-22 23:47:19+00:00,"Thank you to Pastor Webb and the leadership team for quickly adjusting to the recent restrictions on worship gatherings due to COVID-19.  New Bethel obeyed the laws of the land &amp; God’s Word STILL went forth. Hallelujah 🙌🏽.  Check us out on Facebook, Instagram, Twitter &amp; YouTube."
1241874126232403968,2020-03-22 23:47:19+00:00,First death in our city due to Covid-19 😣
1241874113091821568,2020-03-22 23:47:16+00:00,#SuenaAhora Anorexia Isan - The Covenant #TalentoIndependiente  #QuedateEnCasa #Covid_19
1241874111153963009,2020-03-22 23:47:15+00:00,Lool covid 19 have people looking to risk everything
1241874104141123589,2020-03-22 23:47:13+00:00,"How can we have a United States senator  who is this stupid? Apparently, @RandPaul  thinks he’s above following the rules for Covid exposure and isolation. He could be responsible for infecting countless other people."
1241874103109222400,2020-03-22 23:47:13+00:00,How the fuck did Harvey Weinstein get tested for covid-19? Wouldn't be surprised if his lawyer tries to make a case he should be let out of jail.
1241874099070099456,2020-03-22 23:47:12+00:00,"Stock market or 10,000 died from covid-19"
1241874098415972352,2020-03-22 23:47:12+00:00,"The Republicans have been killing the country with their extractive, neoliberal, broken capitalism for the last 40 years. No wonder we are where we are today. Covid may be the death of it. Or it will kill us all."
1241874088961941516,2020-03-22 23:47:10+00:00,Is there just one type of Covid 19 or did those stand up Chinese leaders in their fantastically open society tell a few little porkies about the death rate? Talking of porkies let's strap a pig to a bungie rope..throw it off a bridge!. and call it fun!.those crazy Chinese guys!
1241874082204966912,2020-03-22 23:47:08+00:00,So apparently there another Nintendo Switch Shortage? Is it COVID 19 related? Or is this just the norm every time a new Nintendo 1st party title releases?
