id,date,tweet
1279919649799331845,2020-07-05 23:26:38+00:00,Being single in the time of COVID is... well shit... no different than the previous years.
1279919644825063424,2020-07-05 23:26:37+00:00,"Remember when we freaked out about Covid19?
Sterilized like crazy?
Only went to the grocery store when we were down to mustard and pickles?
Yeah keep doing that
COVID is only getting more contagious
The Virus has not gone anywhere"
1279919643440775168,2020-07-05 23:26:37+00:00,"I'm really debating on what I should get first: a bioshock tattoo, a left 4 dead tattoo, or an ear piercing

...nah, I'll wait for the covid vaccine first"
1279919634603524097,2020-07-05 23:26:35+00:00,I’m glad I only had mild symptoms of covid and it didn’t spread to my family 🙏
1279919610070958082,2020-07-05 23:26:29+00:00,"When I was a kid, my parents would have me read for 30 minutes a day. If I asked them ""am I done yet?"" before time was up, they would add 10 minutes.

America vs COVID-19 feels like young Max vs 22 chapters of Holes in one sitting."
1279919609202634754,2020-07-05 23:26:29+00:00,"i am so lonely, but i’ll stay lonely so COVID will go away."
1279919605549588482,2020-07-05 23:26:28+00:00,"Listen Covid, all i want is movie nights with theatre popcorn and to share a large cherry coke with my girl. I’m tired of popping mediocre popcorn in the microwave. 🙄"
1279919599211995139,2020-07-05 23:26:26+00:00,"On Tuesday, the DC Council will meet for the 1st vote on the 2021 budget. The Council is saying Black Lives Matter, but the budget does not. As we come out of the COVID-19 pandemic, DC is facing unprecedented evictions &amp; homelessness. Let the Council know that #BlackHomesMatter!"
1279919595953020929,2020-07-05 23:26:26+00:00,I work all the time long hours etc. &amp; can't go do my modeling b/c covid.
1279919593344184321,2020-07-05 23:26:25+00:00,"Can we just get facts? 480,000 US people die annually from cigarettes but you take away the one thing that really works to help us put down cigarettes all in the name of your Tobacco Bonds and lies! Meanwhile Covid deaths are a tragedy but cigarette deaths aren’t? @GovMurphy"
1279919575669207040,2020-07-05 23:26:21+00:00,"hey just a reminder to wear your masks, wash your hands, do NOT gather in large (or any) groups, stay home when you can, do anything to keep yourself and OTHERS safe!!! COVID is not over. The world may be opening back up but covid continues to get worse. Pls stay safe"
1279919573018521602,2020-07-05 23:26:20+00:00,This COVID virus has really been a blessing in disguise in some aspects..
1279919559181557761,2020-07-05 23:26:17+00:00,Still voting for Trump! He’s they only man who can pull our country out of the hole the left dug. I believe the left made a deal with China to spread the viruse to start this! Are the Dem local gov saving you now? Our economy pre covid was their grip and they wanted Trump out!!!!
1279919559080701964,2020-07-05 23:26:17+00:00,"Medical conditions that obstruct your breathing??? Covid will literally obstruct your life, better you than me"
1279919534753939456,2020-07-05 23:26:11+00:00,I can’t get over how there was a direct progression from the lies spewed about Obama during his presidency to the fake news surrounding the 2016 election to the mishandling of the covid pandemic
1279919533692616704,2020-07-05 23:26:11+00:00,Raise your hand if you think Hillary associates have a higher death rate than covid. 🙋‍♂️
1279919515426586626,2020-07-05 23:26:06+00:00,"trump has boasted repeatedly that he saved 2.2 million lives from COVID-19, using a figure in a British modeling study to support his claim. That’s not true, the lead author of the report, epidemiologist Neil Ferguson told HuffPost...
Another easily proven, lie..."
1279919512180142081,2020-07-05 23:26:06+00:00,So first China unload Covid -19 on us all NOW the fkers have the Plauge in 2020! can we nuke them yet.. Rats &amp; Flees can't survive that
1279919507168022528,2020-07-05 23:26:04+00:00,My lawyer got COVID-19.... again 😅
1279919494421454848,2020-07-05 23:26:01+00:00,I’m tryin to get my “mama don’t pay for nothing when she with me” game up. And the past 3 weeks I done spent half of what I saved from Covid 😭😂😂😂
1279919488662597632,2020-07-05 23:26:00+00:00,I’m finna get a piece for my chain that says “covid. 19” 🤣🤣🤣🤣🤣🤣
1279919477170278400,2020-07-05 23:25:57+00:00,Is sneezing also part of covid symptoms or I'm just coming up with the usual flu?
1279919450725027840,2020-07-05 23:25:51+00:00,"The code team was called to the covid unit 4 times in one hour during my shift at the hospital 2 nights ago. But yah sure, I hope your beach party was fun."
1279919439232798721,2020-07-05 23:25:48+00:00,i’ll never forget how some people treated the asian community bc of covid
1279919437991247872,2020-07-05 23:25:48+00:00,"MORGANTOWN EVERY SINGLE BAR HAS AT LEAST ONE CASE OF COVID-19 

I HOPE YOU SELFISH MOTHER FUCKERS ARE HAPPY :)))))))

I HOPE YOUR OVERPRICED ALCOHOL WAS WORTH IT :))))"
1279919424560979968,2020-07-05 23:25:45+00:00,3 people i know personally got COVID. Guess what...they are fine sippin Hennessy and shit lol...fuck yo mask man
1279919417581801473,2020-07-05 23:25:43+00:00,Wonder what they did wit all them bodies that died from the  covid
1279919403203780609,2020-07-05 23:25:40+00:00,So I bought jewelry from someone and tell me why they just said their coworker tested positive for covid when i tell you im livid
1279919384937496576,2020-07-05 23:25:35+00:00,"Watched Frozen 2 with my daughter... wtf is it about?? So many unfinished story arc's... looked more rushed then Boris' covid back to the pubs plan, makes no sense"
1279919369578037248,2020-07-05 23:25:32+00:00,"Football players for tomorrow night, 6pm, door 24:
1. IHSAA Health form (paper)
2. GKB Covid waiver form (paper)
3. Name on Covid educational video acknowledgement list (google form)
4. Daily screening complete (google form)
5. gallon jug H2O with your NAME
6. Cleats
7. Face mask"
1279919369263480833,2020-07-05 23:25:32+00:00,Extend Pandemic Unemployment Assistance to Dec.31. This covid pandemic is not over. Call your state’s senators.
1279919357796089856,2020-07-05 23:25:29+00:00,People won’t take Covid serious until they have a loved one in the hospital..
1279919351811002368,2020-07-05 23:25:27+00:00,"Since Covid, the focus is not on whether or not an LMS improves educational outcomes.  Teachers need an LMS! It more about which one best meets the community's needs. Did everyone use the same LMS in your building.  #643Su20wk2 #LMSadoption #MS"
1279919338158424065,2020-07-05 23:25:24+00:00,"After being in quarantine for almost 2 weeks now with covid-19, I ain’t hanging out with anyone that hasn’t been tested... fuck that. this quarantine shit annoying af. KEEP Y’ALL DISTANCE PPL &amp; WEAR A MASK be considerate of others."
1279919327060377600,2020-07-05 23:25:21+00:00,Having a few Covid symptoms is the scariest shit ever. 😩 and not knowing what to believe is even worse.
1279919315005784064,2020-07-05 23:25:19+00:00,"Ellis Park strives to provide a safer, healthier Fast Track to Fun for all of our wonderful guests in the wake of COVID-19. That's why, beginning tomorrow, Monday, July 6th, masks will be mandatory for all guests, employees, and vendors at Ellis Park."
1279919313441390594,2020-07-05 23:25:18+00:00,"Listen to this ! Earlier I read a Tweet from a Woman I.Texas who said that her parents went to get COVID-19 Tested. After 2 hours they forgot It &amp; went home. The next day they received a phone call &amp; were told that they tested Positive!
I have to SCREAM SCAM! We are manipulated!"
1279919312732483584,2020-07-05 23:25:18+00:00,Not a good morning. Didn't had a choice but to wake up early for emergency meetings since our town is now no longer covid free. May God bless us all.
1279919306449526784,2020-07-05 23:25:17+00:00,Someone on Lake Murray wished Biden “Good Luck” in reference to Trump’s Boat Parade. We ALL needed to be wished “Good Luck” because when this pandemic rages as an economy gets shut down again and all the over 45 people who get Covid discover after surviving the ancillary issues.
1279919301936349185,2020-07-05 23:25:15+00:00,"One of my usual coffee customers is a Jehovah’s Witness mold killer business man, he’s probably mid-30s, told me today he’s sold all his things at his apartment and is going to go camping for a few months to avoid the covid second wave 🥴"
1279919268361048065,2020-07-05 23:25:07+00:00,"If I get sick a die from covid oh damn well , do tell people to take it serious it’s a pandemic not a joke"
1279919253676683270,2020-07-05 23:25:04+00:00,"Trump says 99% of Covid cases are harmless. 137,000 Americans have died from it. According to this math, how many of us must have been infected. Can someone do the math?"
1279919247515430913,2020-07-05 23:25:03+00:00,Nobody cared about their compromised immune systems before COVID when they could’ve gotten more deadly infections
1279919227433103361,2020-07-05 23:24:58+00:00,"His lies are becoming more dangerous everyday He is lying About covid And ppl are dying because they believe fox and trump! 

130K+ dead! Covid
Our troops have100K bounties on their heads! Trump and GOP..ARE DOING NOTHING ABOUT IT! 
TRUMP CAUSING CIVIL WAR! #TrumpHasNoCredibility"
1279919214766075904,2020-07-05 23:24:55+00:00,"Welcome to the United States of Corona. Where we are proud to be coronians in the great Nation of Corona. The good ‘ole U S of C19.
Keep Corona COVID-19.

We ain’t ever getting out. Help."
1279919200807424001,2020-07-05 23:24:51+00:00,"Wow. So heartbroken about Nick Cordero. What a terrible and wild ride for his family. 

Covid-19 is real and it is a threat to the healthy and young. Please fucking stay home when not engaging in essential activities."
1279919199003893760,2020-07-05 23:24:51+00:00,i wonder if the threat of the potential long term loss of taste and flavor would’ve been more succes messaging than death or any lung damage via covid. Esp towards younger and the still going on cruises crowds
1279919192553160704,2020-07-05 23:24:49+00:00,When do you think Ghislaine Maxwell is gonna die from Covid?
1279919190367973376,2020-07-05 23:24:49+00:00,Imagine thinking college kids will social distance. Covid in 4
1279919177646604288,2020-07-05 23:24:46+00:00,covid-19 Quick and dirty calculation. The US has had 37 times the cases and 36 times the deaths as NZ. Much for the US to learn from New Zealand. @CarlosdelRio7 @DrTomFrieden @drsanjaygupta @CDCDirector @FauciFan @SVermund @vmarconi2 @rabednarczyk @B_Lopman
1279919176828825601,2020-07-05 23:24:46+00:00,If covid messes up football season imma be sickkkkkk
1279919175939604482,2020-07-05 23:24:45+00:00,"With Trump saying new documented covid cases are very mild symptoms, ask Austin mayor Steve Adler.  Hospitals will be at full capacity within a few days.  Nothing Trump says is substantiated with any documentation or evidence."
1279919160219381761,2020-07-05 23:24:42+00:00,"I feel like people who refuse to wear masks cause they ""don't work"" should be given the opportunity to walk thru the ICU where all the covid patients are and see how effective not wearing one would be 🤷‍♂️"
1279919152585519106,2020-07-05 23:24:40+00:00,The #AllLivesMatter crowd is going out to bars and killing lives by spreading Covid-19 because they don’t matter
1279919102467936257,2020-07-05 23:24:28+00:00,"As the cliche goes....when an alien species attacks earth we will finally be united and put aside our grievances.

Wrong. 

Covid IS the alien. We have doubled down on our greivances because we take comfort in them when we are fearful, anxious and unsure."
1279919091093049344,2020-07-05 23:24:25+00:00,Covid has turned the consumerism world into an introverts wet dream
1279919085552373760,2020-07-05 23:24:24+00:00,the only reason supernatural was cancelled is because of covid. Maybe this virus was onto something
1279919081815076867,2020-07-05 23:24:23+00:00,"Far right nut jobs chants ... covid-19 is fake, covid-19 is a scam"
1279919079231377409,2020-07-05 23:24:22+00:00,Well that's a bit of bullshit. So work made me take today off until I get my covid test back. They were fine with me working from home last week until I got my result but now I have to use annual leave. Bah.
1279919075506876418,2020-07-05 23:24:22+00:00,At this point just shoot me in the head if covid is going to kill me and everyone else/we’ll never go outside without judgement again
1279919075208998914,2020-07-05 23:24:21+00:00,Things we will throw away because of COVID-19 #1: Underwire Bras
1279919065847541760,2020-07-05 23:24:19+00:00,"I rate @realDonaldTrump’s response to Covid a C, the same I would give his presidency. What I factor in as much as what one does is what they do not do, such as the authoritarian measures seemingly desired by democrats in the name of “safety” (see: @GovWhitmer”)"
1279919056737521664,2020-07-05 23:24:17+00:00,I can’t even deal with the fact that my favorite fucking restaurant closed because covid
1279919055512784898,2020-07-05 23:24:17+00:00,"My uncle has covid-19 and is life partner is in the coma  with covid-19 in a icu

Stay safe, wear mask, wash your hands... 

Protect others first!"
1279919029260627970,2020-07-05 23:24:10+00:00,Outside AE hospital had to bring my wife urgently following heart rate jumping can’t go inside coz of covid furious hope everyone enjoying their pint what the hell is going on I’m sick with it
1279919027406733312,2020-07-05 23:24:10+00:00,My grandma in Mexico has Covid :(
1279918995580301313,2020-07-05 23:24:02+00:00,"On the bright side, atleast Covid-19 doesn’t discriminate."
1279918994472886273,2020-07-05 23:24:02+00:00,Not that anyone cares but I’m about to go into surgery (just for my hand) and I’m alone and kinda freaking out. I wish they let me mum wait with me but COVID regulations said she can’t. I’m overthinking and freaking out even though it’s a simple procedure. 😰😰😰
1279918988672237569,2020-07-05 23:24:01+00:00,All these states admitting &amp; realizing they opened up tooooo soon is maybe the smartest conclusion America has came up w/ regarding COVID-19
1279918977892913152,2020-07-05 23:23:58+00:00,the first three months of this year seems to have been a totally different year thanks to covid
1279918974998704129,2020-07-05 23:23:58+00:00,"my mom threatened to kick me out if it didn’t find a new job at the peak of the whole covid hysteria. when there was quite literally no one that would hire me during that time, and i got let go by my previous job. i wont forget that bullshit"
1279918965968568320,2020-07-05 23:23:55+00:00,Gonna be really interesting to hear the TBT covid numbers after this is over. I’m sure the NBA is paying close attention
1279918965486055424,2020-07-05 23:23:55+00:00,"Let’s stop politicizing this COVID-19, do your jobs to the best of your abilities on both sides. Stop the finger pointing grow up and fix this virus problem."
1279918938529435648,2020-07-05 23:23:49+00:00,"Ppl getting mad at ppl celebrating the 4th because of COVID-19 &lt;&lt;&lt;&lt; Ppl getting mad at ppl celebrating the 4th because America is trash

Read that as many times as you need to, to comprehend."
1279918929184505859,2020-07-05 23:23:47+00:00,"I was on the COVID unit and childddd, I couldn’t BREATHE 😭"
1279918928752308224,2020-07-05 23:23:47+00:00,Weed potentially being a COVID preventative just feels like some strange ass blessing. I’m curious to see more research develop but the fact that this is even a valid question floors me
1279918927028654080,2020-07-05 23:23:46+00:00,THANK GOD THROUGHT THIS COVID-19 ‘IM STILL EMPLOYED TRUE HUSTLAZ FOR REAL CANT BE UNEMPLOYED YALL BETTA HOPE THEY SEND DEM CHECKS CUZ WHEN THEY STOP DAS YALL ASS”!!!!
1279918917637615617,2020-07-05 23:23:44+00:00,"You niggas really don’t get how bad shit might get and you just getting on  with life like shit sweet. 

My mother is terrified that imma get lynched out her or catch COVID. 

Natural selection is gonna take a lot of you out the game."
1279918886587113473,2020-07-05 23:23:36+00:00,preparing myself to see “ghislaine maxwell dies from covid” as a headline lmfao 😭
1279918886461325312,2020-07-05 23:23:36+00:00,"Is China gonna sell us the COVID-19 tests too? Again, I’m for dolo 2020."
1279918880534585344,2020-07-05 23:23:35+00:00,This Covid is stupid!
1279918879553269761,2020-07-05 23:23:35+00:00,"97,7% overall survivor rate of COVID 19.
97,7% sobrevida geral do COVID 19."
1279918878844309509,2020-07-05 23:23:35+00:00,"8 days since my covid-19 test and still yet to get the results. Spent hours trying the hotline but the call centre has been at capacity everytime. Can’t even get on hold, absolute joke. Can see why some would refuse to be tested now.
 #COVID19Vic @VicGovDHHS @DanielAndrewsMP"
1279918874943795201,2020-07-05 23:23:34+00:00,Good night all and fuck you Covid-19
1279918872158703616,2020-07-05 23:23:33+00:00,We will never get through covid if we can not unite as a country and start respecting science and each other.
1279918865456279552,2020-07-05 23:23:31+00:00,"My mother complaining about local school’s safety plans for opening in the fall: ridiculous, these kids are gonna be miserable
Me, still CONFOUNDED that this woman is a nurse: YOU KNOW WHAT’S MISERABLE?!?! CATCHING FUCKING COVID"
1279918858372091904,2020-07-05 23:23:30+00:00,Mom's boss tested positive for covid which is fun. She's gonna get a test tomorrow to see if we're screwed now
1279918856409165824,2020-07-05 23:23:29+00:00,God is punishing us with this COVID 🤞🏽
1279918853171150848,2020-07-05 23:23:28+00:00,You know covid is still here???
1279918848309895168,2020-07-05 23:23:27+00:00,"Got sick, aren't allowed bacl to work until i get Covid results (understandably so) am now asking if I'll get sick pay, wish me luck bois"
1279918845701095426,2020-07-05 23:23:27+00:00,"Fuck covid :’( that shit is real. Please take care of yourself, wear your mask, wash your hands every 30 minutes. A loved one lost their loved one today from covid. 😔"
1279918830865842176,2020-07-05 23:23:23+00:00,"Mass pool parties in Detroit and Missouri in the US with over 2.8M cases and 128k deaths from covid-19 , but ppl think black is the dumb race. Truth is Humanity behaves the same anywhere, everywhere, whatever color!!!"
1279918829615734785,2020-07-05 23:23:23+00:00,"New Hampshire is one of the few states reporting a decline in COVID-19 cases

Trump will take care of that

He's having a super spreader rally in NH next Saturday
#TrumpHasNoCredibility"
1279918809692823558,2020-07-05 23:23:18+00:00,Why can’t I book an apt to get tested for covid?!
1279918792659865600,2020-07-05 23:23:14+00:00,Will SA football begin to finish the remaining games? Covid-19 surges. High risk now.
1279918769683472384,2020-07-05 23:23:09+00:00,I took the COVID test on Monday and I still have not gotten my results. How do they know the % of people who are positive from tests from yesterday?  Doesn't make sense to me.
1279918764574691334,2020-07-05 23:23:07+00:00,Finally get to go back to work tomorrow! Screw you COVID can't take me out! :)
1279918759013203968,2020-07-05 23:23:06+00:00,Let’s talk about how  I haven’t been able to see my grandma or hang out with my mom because of this COVID 19 Talk about depressing
1279918758589423618,2020-07-05 23:23:06+00:00,"I always knew the US had questionable intelligence, but it's been quite an eye-opener to watch most countries have success defeating COVID-19 and yet we're over here still fighting about wearing masks, as our cases skyrocket"
1279918733713199104,2020-07-05 23:23:00+00:00,"My best friend, aunt, and some church members have been affected by Covid. And people are saying this thing is fake. This shit is as real as these police killing our people."
1279918731028660224,2020-07-05 23:22:59+00:00,"Opening after covid 
Other countries : pubs &amp; beaches packed with ppl
Msia : traffic jam balik....."
1279918697277054983,2020-07-05 23:22:51+00:00,Looking for apartments during Covid is like being down 20 going into the 4th smh not cool
1279918696899674113,2020-07-05 23:22:51+00:00,when ghislaine maxwell dies of covid in jail just remember i told u so
1279918695637188610,2020-07-05 23:22:51+00:00,Ghislaine Maxwell really about to die from a Covid related gunshot wound in jail
1279918690113400837,2020-07-05 23:22:50+00:00,"The world is facing a crisis. People are dying in droves, and so many feel justified in endangering their fellow human beings or outright pulling the trigger. Often times, it's blatant, unmasked aggression. It's hate and pride for all the wrong reasons. No, not COVID-19. Racism."
1279918673843458048,2020-07-05 23:22:46+00:00,They using covid testing to put chips in your brains
1279918660946063367,2020-07-05 23:22:43+00:00,"Tested positive for covid today after my Tia was exposed to it at her hospital. I’m scared forsure but my symptoms aren’t aggressive and I haven’t been around ppl in 3 weeks so I know I haven’t infected anyone else. I’m doing ok, but please be safe! wear a mask! stay inside!"
1279918648900157440,2020-07-05 23:22:40+00:00,If u wear your mask while driving alone in the car you are single-handed ly curing covid
1279918634371092485,2020-07-05 23:22:36+00:00,My COVID test FINALLY came back and it was negative but since I got tested my bf got tested and wa s positive so now I’ve gotta get tested again to see if I caught it from him 🙃🙃🙃🙃🙃🙃🙃
1279918631908974594,2020-07-05 23:22:36+00:00,"Stop telling people you can’t recove from COVID stupid ass!
I had it back in February and guess what I luckily didn’t need a lung transplant or anything Yes I almost died but I did infact recover 100% and on top of that I didn’t need to go to the hospital i fought for my life -"
1279918626456383488,2020-07-05 23:22:34+00:00,"WHO EVER WANTS A COVID TEST CAN GET ONE. Another LIE kept, the States are operating the test sites and NEVER have Enough as the FED.GOVT. has taken a NO HANDS APPROACH, if all goes well DT takes FULL CREDIT, if it goes wrong, NOT MY FAULT, BLAMELESS! #NoMaskItBuyCasket"
1279918605031755776,2020-07-05 23:22:29+00:00,"Hey, if you’re a pos that goes to parties that can spread covid, you’re a pos and absolutely deserved to be called out. If you’re a 🚬 telling me that calling my own community is the wrong approach, you’re a 🚬 . I’m gonna call out my people cause I want them to be better"
1279918594730659840,2020-07-05 23:22:27+00:00,"Flying for first time since COVID (scary, I know).  Delta FA stopped by my seat to thank me for trusting them after four months.  @Delta CRM and personalization continue to impress, even in a pandemic."
1279918588376293376,2020-07-05 23:22:25+00:00,"My favorite thing is the people that are complaining about all the covid restrictions but aren’t actually doing anything to not have those restrictions... like yes I too would like to be able to celebrate my birthday at my favorite restaurant, that’s why I’m staying home now :)"
1279918582852235265,2020-07-05 23:22:24+00:00,so far my symptoms of covid are lack of sex and inability to acquire alcohol
1279918580193255424,2020-07-05 23:22:23+00:00,lmaooo panicking in the bathroom because idk if my headache and fatigue are from dehydration or covid!! haha!! my fam rented a fuckin cottage or some shit for a week long vacation that’s supposed to be in a few days but!! haha!! what if i get fucking covid!!!
1279918578423169024,2020-07-05 23:22:23+00:00,"Bournemouth Beach was a low point and yet there have been no Covid deaths in any Dorset Hospitals for 20 days. Raves, Protests and Covid Idiots trending for weeks but the numbers are still falling. 
I think we've had herd immunity with far more infected than we imagine."
1279918571938893824,2020-07-05 23:22:21+00:00,Telling you if I didn’t have work thru covid I’d be in the insane asylum by now
1279918568155394050,2020-07-05 23:22:21+00:00,"We gotta get these fuckers to wear masks so something like “my long mask just can’t cover up my red neck” by David Allan COVID 
I don’t know what it’s gonna take"
1279918561209782273,2020-07-05 23:22:19+00:00,really want a new tattoo but worried abt covid :-/
1279918557686640641,2020-07-05 23:22:18+00:00,Ima try record myself getting tested for the COVID aka the brain chip
1279918534634717185,2020-07-05 23:22:13+00:00,it shouldn’t have taken COVID for people to respect the fact that some people don’t like hugs
1279918525671444480,2020-07-05 23:22:10+00:00,"Got a negative COVID-19 test.... so wtf is wrong w me??? 
Nurse goes 🤷🏼‍♀️🤷🏼‍♀️🤷🏼‍♀️"
1279918523238809600,2020-07-05 23:22:10+00:00,"imagine believing that the left is so against you that they would have the nerve to promote the use of masks to save your life. and at the same time think that the president who has killed 130,000 Americans with his lack of Covid response is on your side. it's mental illness."
1279918500664901634,2020-07-05 23:22:04+00:00,"The ICMR is an apex body, headed by an experienced scientist.
Why did it barter its credibility for a COVID vaccine deadline of Aug 15, which was wildly unrealistic?
Why did it bow to pressure from ""the top-most"" powers?"
1279918478678544385,2020-07-05 23:21:59+00:00,So who would like to explain to me why I couldn’t have a college graduation with a million Covid cases but schools are opening in the fall with almost 3 million cases 🧐
