id,date,tweet
1332832237893668865,2020-11-28 23:42:22+00:00,By the look of these stories I’m guessing COVID is gone
1332832234995322886,2020-11-28 23:42:22+00:00,"Covid is a bitch. Fucked up the NFL season for sure. Kaepernick still doesn't have a job. Bronco's have no QB for their next game. Kap still has no job. Every 3rd string QB is worse than Kap. This is America. Fight me! #nfl
#BroncosCountry"
1332832234420768770,2020-11-28 23:42:22+00:00,COVID lightin the nfl up boay
1332832220382457859,2020-11-28 23:42:18+00:00,"Just watched the @ColinHay documentary, and damn, I think I miss live music more than anything else in this Covid-infested world. #musichealsthesoul"
1332832216498507776,2020-11-28 23:42:17+00:00,If COVID-19 is so bad why was Black Friday not canceled??
1332832185460592640,2020-11-28 23:42:10+00:00,my mom was exposed to covid again omfg I’m so sick of this shit.
1332832185309655041,2020-11-28 23:42:10+00:00,"Boris has offered a vote on covid restrictions, you spaghetti spine  cunts better vote properly!"
1332832178892394497,2020-11-28 23:42:08+00:00,How can the #NFL postpone the Ravens/Steelers game because of RB Covid for the Ravens but the #Broncos play with no QBs it doesn’t make any fucking sense and the NFL will look foolish as FUCK if they don’t postpone it...FUCKING JOKE #NFL
1332832174052159488,2020-11-28 23:42:07+00:00,"During this time of #COVID and the #BlackLivesMatter protests, everyone is trying to stay as positive as possible. But, that’s not always the best way to feel."
1332832171233521674,2020-11-28 23:42:07+00:00,"Covid sucks, I’m glad the protocols in place are being enforced, and the NFL should probably postpone the Broncos game...

but goddamn I am LOVING all the ridiculous suggestions about who should be the Broncos’ QB tomorrow. Keep em coming"
1332832152464072705,2020-11-28 23:42:02+00:00,"I have had COVID for 11 days. For 9/11 days, I have been incredibly fortunate to have only experienced loss of taste/smell. Yesterday, the chest pain set in. It hurts to breathe. It hurts to stand. It hurts to hold my water bottle. 

Your parties and “friendsgivings” can wait."
1332832148898791424,2020-11-28 23:42:01+00:00,"Well, with my hometown trending, I suppose this is giving me the opportunity to see the people in #Calgary I have zero interest in ever getting to know like the anti-maskers and COVID deniers."
1332832128548163585,2020-11-28 23:41:56+00:00,Covid is single hardly wrecking football season.
1332832119375101952,2020-11-28 23:41:54+00:00,When is covid gonna
1332832088811335682,2020-11-28 23:41:47+00:00,So Broncos have 0 QBs because if COVID but @NFL says their game against Saints is still on bu the Ravens vs Steelers postponed really not consistent are y'all ???
1332832076857446400,2020-11-28 23:41:44+00:00,"So this is what I know: 

Hospitals are so short staffed that they are requesting folks to come back to work once they are asymptomatic from COVID, taking daily precautions like temp checks at employee health, daily symptom diary. They are decreasing the number of surgeries and"
1332832074118672384,2020-11-28 23:41:43+00:00,"i was exposed to someone who tested positive for covid so i can't go out canvassing tenants this week. getting tested tomorrow. in the meantime, would anyone be interested in having me on their stream to talk about eviction defense, and share some resources for their community?"
1332832060436848647,2020-11-28 23:41:40+00:00,"Boris Johnson states to USA news outlets England has strict covid measures until 5th April 2021🤬🤬🤬🤬🤬
Now  its  time  people"
1332832052396384260,2020-11-28 23:41:38+00:00,"I had been assuming covid would be over by the end of the year. In retrospect,  I don't really know why I thought that other than it seemed like a logical amount of time for it to go on."
1332832049665765376,2020-11-28 23:41:38+00:00,50 Americans an hour are dying of COVID. If you won't wear a mask and stay home at this point go ahead and eat an arsenic sandwich.
1332832048021692419,2020-11-28 23:41:37+00:00,There is a legit shot that either RB Royce Freeman or Jerry Jeudy play QB this week for the Broncos. All QB’s including the practice squad QB have been placed on the COVID/reserve list
1332832047472193538,2020-11-28 23:41:37+00:00,The whole NFL about to have Covid. The way other sports leagues have handled this pandemic compared to the NBA is ridiculous.
1332832040941662213,2020-11-28 23:41:36+00:00,"Hey @NFL. If we need to put a fork in the season until Dak is healt.....I mean until the risk of COVID is not as great, say April or May...that is fine!"
1332832032708235266,2020-11-28 23:41:34+00:00,Protests take number of COVID- across France against proposed security law #fakeheadlinebot #learntocode #makeatwitterbot #javascript
1332832029784719362,2020-11-28 23:41:33+00:00,"Waiting to be let into Hobby Lobby since they reached their max capacity for COVID and this lady is practically shouting about ""how strange this is, omg I've never experienced something like this before""

You mean you've never stood in a line before Deborah??? During COVID???"
1332832021337546756,2020-11-28 23:41:31+00:00,Whelp...covid is in Sydney.....ㅠㅠ
1332832018808385537,2020-11-28 23:41:30+00:00,"Despite COVID, this year has been dropping blessings left and right!"
1332832007521513472,2020-11-28 23:41:28+00:00,My God save my mother who is connected to a fan with covid! Please pray for my mother!
1332832000156131329,2020-11-28 23:41:26+00:00,living in an environment where your concerns about COVID are seen as overdramatic and silly is honestly the reason my mental health has completely regressed
1332831987506294787,2020-11-28 23:41:23+00:00,"We need a globally coordinated active vaccine safety surrvellience as the #COVID vaccine is rolled out. 

This must be active and rapidly updated. 

It is essential we communicate to the public how we plan to actively monitor the safety of the vaccine as it is rolled out!"
1332831986277347329,2020-11-28 23:41:23+00:00,"#whitepeopledontcare If your essential worker! If you get covid, your mother, father get covid. If you wear a mask, and, sanitize. #whitepeopledontcare"
1332831976957616129,2020-11-28 23:41:20+00:00,Police arresting people for holding anti vaxx and anti covid placards - what is this? All these pro covid lies cult speak up and own up to being satan worshippers so the rest of fools know what they are aligning themselves with #plandemic
1332831971135815680,2020-11-28 23:41:19+00:00,It would be sick if all these ski resorts added an anti-jersey stipulation to their COVID regulations.
1332831966668992512,2020-11-28 23:41:18+00:00,The hardest part of covid has been opening produce bags in the grocery store.
1332831965884637191,2020-11-28 23:41:18+00:00,can everyone stop pretending covid isn’t a thing anymore.  people are literally dying
1332831962994716672,2020-11-28 23:41:17+00:00,"Dear @GovStitt - saw your “Oklahoma is Open” commercials. As someone in a neighboring state, keep your #COVID to yourself. 

This is one of the most irresponsible things in the middle of a #pandemic. Good to know you don’t care about people’s health. Won’t ever come back to #OK."
1332831962374025219,2020-11-28 23:41:17+00:00,Covid taking the NFL by storm...
1332831954769743872,2020-11-28 23:41:15+00:00,So the Broncos have no QBs because they weren’t wearing masks and the Saints have people with COVID and the NFL says safety first and we still playing 😂😂😂
1332831948838989824,2020-11-28 23:41:14+00:00,"Another profitable week with #CollegeFootballPicks 

1u - Pitts ✅
1u - Smith ✅
1u - Hutchinson ❌

2-1 +0.9u

YTD:  11-5 +5.4u

Trying to navigate the COVID scene for tomorrow - but will still have some more plays coming."
1332831946016223238,2020-11-28 23:41:13+00:00,"Just because no NFL players have died from covid doesn't mean they haven't spread the virus and killed some people but hey, football. America will sacrifice nearly everything, for nearly anything...except for a functioning government."
1332831939313733632,2020-11-28 23:41:11+00:00,Covid running through the NFL like a tomb raider.
1332831924839190528,2020-11-28 23:41:08+00:00,"Georgetown women’s basketball has entered a pause after a tier 1 member tested positive for COVID-19. 

Due to the pause, the Hoyas first 2 #BIGEASTwbb games (at St. John’s and vs. Creighton) have been postponed."
1332831922020605952,2020-11-28 23:41:07+00:00,"Was at my local @sobeys a few hours ago. It was busy. There was a 40’s woman walking around without a mask, not attempting to distance. No one stopped her. @sobeys is private property. Have you seen the exemption list? It’s short. Please protect the rest of us. #Covid #WearAMask"
1332831914714083328,2020-11-28 23:41:05+00:00,What if I told you that the NCAA is controlling these COVID numbers so the rest of the conferences can catch up to the ones that started early
1332831904811331586,2020-11-28 23:41:03+00:00,Fun new game: do I have covid or did I not eat enough today?
1332831896682651648,2020-11-28 23:41:01+00:00,Eager to see the ornate-ass awards ceremony they design for all who had to be Covid police in our relationships. (Obviously the award itself should look like an Oscar except he’s forwarding a link to his partner.)
1332831886083809280,2020-11-28 23:40:59+00:00,So the nfl is about to let the broncos play tomorrow with no qbs because of this whole Covid stuff 🤦🏿‍♂️
1332831881952366601,2020-11-28 23:40:58+00:00,I just saw one of the saddest stories on Nightly News. A little boy is celebrating his fifth birthday without his parents. They both died from Covid. He doesn’t understand why and neither do I. FUCK him for his total lack of leadership and a national strategy @realDonaldTrump
1332831867905695746,2020-11-28 23:40:54+00:00,"the NFL just need to cancel the rest of the season , mfs catching COVID left &amp; right now"
1332831860326428672,2020-11-28 23:40:52+00:00,"spread your cheeks, not covid."
1332831849677254656,2020-11-28 23:40:50+00:00,"Well at least Pitt hasn’t quit, I’ll give them that credit. Gotta find a way to close the talent gap between them and Clemson. Have some dudes but not nearly enough. Now if Covid didn’t happen this game is played in the Burgh with some better dudes playing on the defensive side"
1332831845633859585,2020-11-28 23:40:49+00:00,Grateful for the inclusion of Dr Jill Jim on the @Transition46 Covid task force. So important and another way the our soon to be President is keeping his word and making sure tribal communities have representation.
1332831843549265920,2020-11-28 23:40:48+00:00,"If u don’t wear masks, I simply hope you get covid and d*e &lt;3."
1332831842593017857,2020-11-28 23:40:48+00:00,it’s so weird that covid doesn’t exist for most people
1332831837748666368,2020-11-28 23:40:47+00:00,"Under @realDonaldTrump 265,000 people have died of COVID Since the election he has played golf eight times and more times per term than any President

“I’m going to be working for you, I’m not going to have time to go play golf”   He takes your money he lies and you vote for him."
1332831834477047809,2020-11-28 23:40:46+00:00,If a covid vaccine came out tomorrow would you get it
1332831831981436928,2020-11-28 23:40:46+00:00,"Spending Thanksgiving alone was a guilty pleasure.   I do miss family and friends, but eating alone in front of the TV with Covid was sublime."
1332831831683633153,2020-11-28 23:40:46+00:00,Fuck cancer. Fuck covid.
1332831827451580416,2020-11-28 23:40:45+00:00,Covid need to go away. And nvr come BACK
1332831825861939201,2020-11-28 23:40:44+00:00,Do y'all really believe a 4-6 week shut down gone stop COVID? Folks is not gone sit still bruh just face it
1332831813820162048,2020-11-28 23:40:41+00:00,If covid wasn't out and I was a little more enthused about this auburn beat down I'd tap into this liquor  but I'll probably just grab another beer and eat some leftovers.
1332831811861405696,2020-11-28 23:40:41+00:00,"In the past month I had a period that lasted 12 days (after not having it for 6 months), got strep throat, my wisdom tooth decided to rupture in my gums, the withdrawals from my meds have lasted for weeksss, and I had to get tested for covid twice. Am I missing anything? 🙃"
1332831804689158145,2020-11-28 23:40:39+00:00,Every single Broncos QB has covid?? My team ☠️😩
1332831796023750656,2020-11-28 23:40:37+00:00,Broncos better not be giving our Saints the COVID tomorrow.
1332831795201658884,2020-11-28 23:40:37+00:00,We’ve got to get #COVID under control!!!              Watching #Razorback BB on Web clearly inferior to an evening in the Bud!! @mcbmd
1332831765069778955,2020-11-28 23:40:30+00:00,"I know I don't talk about my religion at all (I'm Catholic), but I finally got to go back to church tonight after having COVID a couple weeks back. Tonight's homily really hit home for me. (1/3)"
1332831762926460929,2020-11-28 23:40:29+00:00,"So the NFL forges on, despite multiple teams impacted by Covid-19. Broncos have NO QB’s but it’s either play on or forfeit  according to total sycophant GOODELL &amp; the  billionaire boys club. It’s completely insane. Multiple Steelers/Ravens also infected-game STILL on for Tuesday."
1332831760032391173,2020-11-28 23:40:29+00:00,Drew Lock lip sync rapping “Covid Cough”
1332831758681862146,2020-11-28 23:40:28+00:00,"Florida is about to hit a grim milestone in its battle against coronavirus as The Sunshine State grows ever-closer to hitting 1 million cases. The state has a known total of 985,297 COVID-19 cases as of Saturday, when the Florida Department of Health confirmed 6,277 new COVID"
1332831729573261312,2020-11-28 23:40:21+00:00,Covid is no joke ... I just wanna feel better already 😭☹️
1332831719951634435,2020-11-28 23:40:19+00:00,COVID in the NFL is just like the syphilis episode of BMS on a widespread level
1332831709805547520,2020-11-28 23:40:17+00:00,Anyone else have to do math to remember how old they are? Perhaps it’s somehow a Covid life artifact for me. I often do the math to verify for myself that I am the age I think I am. I hope this doesn’t indicate atypical cognitive decline.
1332831708492738568,2020-11-28 23:40:16+00:00,Looking back at photos/videos pre covid is making me so sad😭 just want life to get back to normal🙏🏽
1332831706966077447,2020-11-28 23:40:16+00:00,This Covid shit annoying as fuck
1332831702700355584,2020-11-28 23:40:15+00:00,"Maybe Elway can suit up! Would be the first big contribution in the last 5 years...
 — Denver Broncos QBs Lock, Rypien and Bortles were pulled off the field Saturday over concerns about their contact with QB Jeff Driskel, who is infected with COVID-19"
1332831700049678337,2020-11-28 23:40:14+00:00,COVID going wild
1332831697440804864,2020-11-28 23:40:14+00:00,My mom out here talking about she can smell Covid in the air. Child please 🙄
1332831694110547968,2020-11-28 23:40:13+00:00,we’re so focused on the covid pandemic no attention is being given to the pandemic of brain worms
1332831688100077568,2020-11-28 23:40:11+00:00,"i know i only have like 2 mutuals that watch superstore BUT i was doing a lot of thinking and what if amy is actually in a covid coma and so she’s imagining what happens if she leaves to go to california so her and jonah didn’t actually break up it was just a dream, and she will-"
1332831678620971014,2020-11-28 23:40:09+00:00,This Iron Bowl don’t count.. Covid 19
1332831672576958470,2020-11-28 23:40:08+00:00,"Healthcare workers who don’t take COVID seriously give me the heebie-jeebies, man."
1332831660283453442,2020-11-28 23:40:05+00:00,I just don’t understand how an NFL and College Football playoff will work in a year like this unless no one gives accurate results on COVID tests......
1332831622652170241,2020-11-28 23:39:56+00:00,I'm was really looking forward to next semester because I thought I'd get to see a baby be born in my L&amp;D clinical. COVID is really the most ghetto 😢.
1332831621767163905,2020-11-28 23:39:56+00:00,"Just copped Royce Freeman to start at HB for me bc James Conner got COVID

Is this a w?"
1332831602561458177,2020-11-28 23:39:51+00:00,NFL needs to make a big move on COVID-19 ASAP before this spirals out of control.  If I was commissioner I would HALT ALL games for 2 weeks.  Basically it would be like these weeks didn’t exist and would pick back up after that.   Make all teams lockdown to stop the spread.
1332831587956887552,2020-11-28 23:39:48+00:00,This is 2020 for you... Trevor Lawrence is going to be penalize for getting COVID and missing a gm plus a gm getting postponed hurting his Heisman Trophy chances.
1332831583661854725,2020-11-28 23:39:47+00:00,When you wanna treat someone but have no monies to do it. :/ covid feels bad haha
1332831557938241538,2020-11-28 23:39:40+00:00,Covid ruined everything 😭
1332831553983045632,2020-11-28 23:39:39+00:00,Now in zim side different set of requirements one must have original covid certificate &amp; copy if u don’t have a copy one must pay R5 . Passports are being collected by this chap who just came in the bus from nowhere. I guess immigration officers this side are afraid of catching
1332831549990055938,2020-11-28 23:39:38+00:00,Denver Broncos so scared they all ran out and caught Covid .
1332831549255868416,2020-11-28 23:39:38+00:00,"In the time of Covid 
Blunt
Very much to the point
When did the reality tell you otherwise?
Gonna hace a bigger problem
Anti-maskers
Start with wearing mask
Could not be more real
Do people around you a favor
Warned of humanitarian crisis
Vows revenge
Has come at a cost"
1332831543799255041,2020-11-28 23:39:37+00:00,"Hi, um, maybe if teams are completely infested with covid across college and professional sports as the nation’s cases skyrocket, we just shouldn’t be playing said sports anymore

Idk maybe that’s just me"
1332831537138708480,2020-11-28 23:39:35+00:00,I dont understand though do we not have fast testing for covid for these players? I'm not complaining since they are playing the Saints lol but still
1332831530780135428,2020-11-28 23:39:34+00:00,the least covid-safe situation i’ve been in all year has definitely just been michael’s the saturday after thanksgiving
1332831528695558144,2020-11-28 23:39:33+00:00,"Thinking about life and shit, lot of things happened this week, COVID scare, family deaths, personal stuff, people I knew turning out to be garbage. and I like to think I’ve come out the other side a better person who can handle life better and I can’t wait to share that with you"
1332831524065058820,2020-11-28 23:39:32+00:00,The handling of the COVID 19 by the NFL has been astoundingly bad
1332831519405174804,2020-11-28 23:39:31+00:00,Idk if it’s me but ion like when artists make Covid puns in they music . Like folks really dyin . Just messes the whole song up for me .
1332831498622406659,2020-11-28 23:39:26+00:00,"Started my day with 5 of my pts admitted w COVID. 2 high risk &amp; got worse, went to the ICU. 1 went home after a 3 week stay. The other 2 are doing well. Tomorrow I’ll probably have 5 COVID or more again, and the cycle repeats. Is this our new norm as hospitalists?"
1332831498517557249,2020-11-28 23:39:26+00:00,"Postgame comments: Not the outcome we wanted, saw some good effort on defense. Offense not executing. Some playing time for younger guys. Liked their effort. Time to get our guys ready for SoAL. Something about Covid.  #phoneitin #boilerplate #oneTROY"
1332831479366254593,2020-11-28 23:39:22+00:00,"The reason COVID spread so quickly:

Everyone thinks they're an exception at some point or another to the guidelines"
1332831476598136835,2020-11-28 23:39:21+00:00,Covid got the whole NFL fucked up 💀
1332831463855824897,2020-11-28 23:39:18+00:00,"That’s crazy y’all counting a Covid win, must suck to be desperate"
1332831454884106240,2020-11-28 23:39:16+00:00,"Y’all I swear, if a star player on Seattle’s offense gets COVID y’all better say the back ups all got it as well and reschedule the game so that star can play with the team... @Seahawks @PeteCarroll"
1332831447493828617,2020-11-28 23:39:14+00:00,I am loving my negative COVID test tho.
1332831440132825089,2020-11-28 23:39:12+00:00,Broncos can’t bring in anyone who isn’t on the team due to Covid testing delays. Jeff George has already jumped on a flight though.
1332831438618714116,2020-11-28 23:39:12+00:00,"Both of my parents had Covid in May, both are considered high risk, and both recovered. God."
1332831437314269184,2020-11-28 23:39:12+00:00,I can’t wait for my post covid glow up.
1332831429856796673,2020-11-28 23:39:10+00:00,"🤔
All Broncos' QBs ineligible to play Sunday vs. Saints after being exposed to COVID-19, but team won't forfeit - Schefter"
1332831424307716098,2020-11-28 23:39:09+00:00,Covid-19 gonna win el Super Bowl.
1332831421321318402,2020-11-28 23:39:08+00:00,Man this don’t feel like my birthday 🎉 weekend. COVID got everything all messed up this year 🤦🏾‍♂️ I want to go outside and play like the olden days 🥺
1332831399586488320,2020-11-28 23:39:03+00:00,"So homie acid tripped his account inactive eventually, the entire NFL covid situation is actually laugh out loud funny, and a female squibbed a kickoff in a 41-0 loss for an 0-8 team and we care because its POWER 5?!  That the day recap?"
1332831399380914176,2020-11-28 23:39:03+00:00,"Every time I hear someone explain that some event is being done differently ‘because of COVID’ it makes me wonder if there are people out there who don’t know we’re in a pandemic. Not the deniers, but people who are so isolated they haven’t gotten the news yet."
1332831397099278338,2020-11-28 23:39:02+00:00,My family all just got COVID tests done because my mom was confirmed positive. Keep us in your thoughts for a second or two please.
1332831392472977420,2020-11-28 23:39:01+00:00,"whether you think Covid is real or not, just wear your mask. just stay away from people. just follow protocols wherever you are"
1332831387028746241,2020-11-28 23:39:00+00:00,COVID era lifestyle: it’s 6:30 on a Saturday evening. I’m showered and in my robe and see no reason why not.
1332831386823225348,2020-11-28 23:39:00+00:00,"Today I got called a piece of shit and was told that the gates of hell are open for me because I said that anti maskers and covid deniers shouldn't receive medical care when they get the virus. 
So..I'm saying it again.
Stay home and hope you don't die."
1332831376916275201,2020-11-28 23:38:57+00:00,How are all these athletes who have strict covid protocols on them testing positive?  Like where are you going!?
1332831358654275587,2020-11-28 23:38:53+00:00,Since Brian beat COVID he’s been sort of reckless.
1332831352278827012,2020-11-28 23:38:51+00:00,that fact that my parents just basically told me they'd rather me quit medical school than to get the COVID-19 vaccination when it comes out........
1332831341583372288,2020-11-28 23:38:49+00:00,"alright i'm happy na svt has plans (?) for a concert here next year pero feel ko wag muna, kasi hindi pa kontrolado yung covid dito :(( i just don't want anyone to be infected again :(("
1332831329990316032,2020-11-28 23:38:46+00:00,god fuck 2020 and fuck covid and fuck anyone who doesn’t understand the effects covid has had on people on a personal level and fuck people who are going out and partying right now
1332831329646305280,2020-11-28 23:38:46+00:00,I really had to put getting the COVID vaccine on my 2021 bucket list 😭
1332831327146618881,2020-11-28 23:38:45+00:00,"If the reporting is true, and @Broncos have all of their QB’s on the reserve/COVID list because they weren’t wearing their masks and appear to be in violation of @NFL protocols, they should be forced to play or forfeit."
1332831317701005313,2020-11-28 23:38:43+00:00,Oh my god the Denver Broncos just had all of their quarterbacks placed on the covid list and made ineligible to play in their next game..... that kicks off in 21 and a half hours.
1332831304837115905,2020-11-28 23:38:40+00:00,Joe Joyce with more jabs than a COVID 19 Vaccine clinic #DuboisJoyce
1332831301045538816,2020-11-28 23:38:39+00:00,We're in the final 6 weeks of the NFL Season and is a fucking mess with the COVID-19 situation. You just wonder if some of these complete utter morons are taking this pandemic seriously.
1332831289318252551,2020-11-28 23:38:36+00:00,man i haven’t seen my mom in a little over 3 years and the rest of my family for ~2 years. i was supposed to be able to see/visit everyone this year but COVID+persistent asthma said no. it REALLY sucks watching people skirt around safety bc they don’t feel like it anymore
1332831277150515200,2020-11-28 23:38:33+00:00,You may bitch about not visiting the pub recently ? I celebrate not being in a covid ward in over 24 hours #NHS
1332831273094696963,2020-11-28 23:38:32+00:00,I’m getting a Covid test while watching @ColleenB123 live show!!! It’s so much fun!!
1332831271735713794,2020-11-28 23:38:32+00:00,"One of my best friends just got diagnosed with COVID. Along with half of his family.

FOR THE LOVE OF GOD, WEAR A MASK, SOCIAL DISTANCE AND WASH YOUR HANDS."
1332831269886042113,2020-11-28 23:38:32+00:00,"All of Denver’s quarterbacks are ineligible to play tomorrow after possible COVID-19 contact/tracing.

Nothing about this means the season should continue. What an embarrassment."
1332831267847426050,2020-11-28 23:38:31+00:00,Bruh everybody in the NFL catching Covid ....
