id,date,tweet
1237891047876747265,2020-03-11 23:59:59+00:00,They don’t name diseases anything cool anymore. COVID? Wuhan Virus? Pfft. What happened to “Consumption” or “The Ague”?
1237891041769844739,2020-03-11 23:59:57+00:00,The ACC just announced no fans will be allowed at the remainder of the #ACCTourney games due to concerns over COVID-19.
1237891040729690114,2020-03-11 23:59:57+00:00,NC DHHS announces an 8th case of COVID-19. The person is from Wake County and the case is related to a traveler from Indiana who visited Biogen in Raleigh last week @wsoctv
1237891040591269900,2020-03-11 23:59:57+00:00,"It’s one thing to inform the general public about COVID-19, in a conducive manner vs what the media is doing right now. The fact that doctors along with other healthcare professionals are asking the media to stop over sensationalizing facts and information is telling enough."
1237891033041518599,2020-03-11 23:59:55+00:00,"Hey @CityOfFriscoTx as a surgeon in the community for 15yrs and with recent COVID-19 cases(likely many more yet identified) should we be still holding large public events? We have a great city with great people, just thinking we may need to consider some social distancing. Thx"
1237891027932827651,2020-03-11 23:59:54+00:00,Me really nuh like lock up in a me house by myself. I hate COViD-19
1237891012334202881,2020-03-11 23:59:50+00:00,"If you’ve swam in a tide pool on St. Simons, you’re immune to covid-19"
1237891008316096515,2020-03-11 23:59:49+00:00,I’m curious...how do the recent measures taken by the NCAA and higher education make you feel in relation to the spread of COVID-19?
1237890999998803973,2020-03-11 23:59:47+00:00,Is God going to punish me for going to The Book of Mormon by sitting me beside someone with Covid-19?
1237890994667835393,2020-03-11 23:59:46+00:00,I'm not afraid as much of contracting covid-19 as I am of the general economic repercussions of it
1237890967711211520,2020-03-11 23:59:40+00:00,Sitting in wildfire fighting training thinking about how I’d rather die in a fire then deal with the COVID-19 hysteria
1237890955925209088,2020-03-11 23:59:37+00:00,Wearing a condom 24/7 to protect myself from the covid.
1237890936937439233,2020-03-11 23:59:32+00:00,"The response to COVID has exposed the competencies and priorities of leaderships, corporations, and the like. 

Everyone wants to love and allign themselves w/ diversity and inclusion but when shit hit the fan, how did your leadership respond?"
1237890916171411459,2020-03-11 23:59:27+00:00,BREAKING!!! All Premier league matches to be played behind closed doors as a measure to Combat the nobel COVID-19
1237890914330112005,2020-03-11 23:59:27+00:00,"The year is 2030. COVID-19 has ravaged the global population. The daily broadcast suggests the Internet might come back online in a few months, and I can’t wait to check the #Bitcoin price. I chant my seed phrase again as I lower myself into the Purell sanitation pod."
1237890899608129536,2020-03-11 23:59:24+00:00,"To the people and businesses taking Covid-19 seriously, thank you. Nothing wrong with being cautions and taking precautions. You are saving a life. To those who are blowing it off, you don’t get to complain later."
1237890873318191105,2020-03-11 23:59:17+00:00,"Somewhere right this very second, somebody is headed to a $8.99 all you can eat buffet. And they haven’t washed their hands in a week. This is why 100 million people are going to have COVID-19 in a week. I hate you and the decrepit genetic pool you were spawned from"
1237890866812817409,2020-03-11 23:59:16+00:00,"Don't panic BUT please wag din naman masyadong over confident konting ingat din. I also urge friends on FB to not downplay the covid-19 epidemic by comparing this to other diseases who have high mortality rates. Dengue, HIV and covid-19 are the same!"
1237890852690640899,2020-03-11 23:59:12+00:00,"My conservative friends, unbidden, sending me articles about how COVID-19 isn’t a big deal now that the first reported case is in my county. 

I s2g they will do ANYTHING they see Trump do, and I’ll never understand why that burpfart is their ideal role model."
1237890844906029056,2020-03-11 23:59:10+00:00,"A doctor interviewed in the 60mins vid I saw earlier this morning talked about how #covid19 is gonna make health inequity more pronounced. Looking at US where the quality of covid-19 response seems to be handed down to the state and local levels, I think this disparity will show"
1237890844054544387,2020-03-11 23:59:10+00:00,office seems to be preparing for possible quarantine since an office in the next building has a covid case and all i'm thinking is god damn if i have to stay home i'll finally get to clean up my room.....
1237890801004232705,2020-03-11 23:59:00+00:00,"Infectious disease experts, not politicians, state this is just the start of COVID-19 and to be virulent, pardon the pun. It CAN be stopped but DO NOT under-estimate the damage."
1237890799351693312,2020-03-11 23:59:00+00:00,"All those folks who listen to Rush and Hannity telling them COVID-19 is no worse than the regular flu are going to kill, not only themselves, but many other people they come in contact with."
1237890796407250944,2020-03-11 23:58:59+00:00,WOULDN’T IT BE INTERESTING IF #TRUMP HAS COVID-19?
1237890773518929921,2020-03-11 23:58:53+00:00,COVID-19 really is helping introverts not seem so flaky for not leaving their homes.
1237890771618951168,2020-03-11 23:58:53+00:00,Surprised my mum hasn't yet forced my dad to come round with a big bundle of supplies because she's panicking about COVID-19. I have so many bags of hint of lime Doritos just from her base level panicking about me not feeding or looking after myself.
1237890771585556480,2020-03-11 23:58:53+00:00,"I've been hearing a lot of people talk about how the world is overreacting to COVID-19, and I just want to throw this out there: all the precautions being taken? They probably aren't to protect YOU but that doesn't mean they aren't valuable, important, and necessary."
1237890768452218880,2020-03-11 23:58:52+00:00,"ATM, ever ten minutes, something new is being cancelled due to the COVID. Class. Housing. March Madness for spectators. The St. Patrick's Day parade, and more .

At what point do they just announce that outside is canceled until further notice?"
1237890761271570433,2020-03-11 23:58:51+00:00,"So, you'll get a free test for COVID-19.  But, your treatment will be charged accordingly!"
1237890746809593856,2020-03-11 23:58:47+00:00,honestly grateful for how close covid-19 has brought the citizens of the world
1237890744896999425,2020-03-11 23:58:47+00:00,Every single thing about the COVID-19 has been pissing me off and it just keeps getting worse
1237890726379139073,2020-03-11 23:58:42+00:00,"My biggest fear right now with Covid-19 isn't catching it, but exposure to my immediate family. I live with my grandma who is 81, and work in a restuarant that serves a lot of people. I'm washing my hands like a mf lately. First cases confirmed today in ny state."
1237890724017790983,2020-03-11 23:58:42+00:00,"In my opinion, all schools uptil middle must be closed. 
However, high school students can be called n trained on how to deal with pandemic when it gets to worse situation.
They will be the soldiers when time comes. The situation that covid-19 is creating could be worse than WWII"
1237890716786814978,2020-03-11 23:58:40+00:00,"On the topic of COVID-19, it's been incredibly rewarding to see the work that we @hivemetric have done to support development efforts of the RCKMS platform, which is actively aiding epidemiologists and public health agencies in the US track lab test results nationwide."
1237890708238823430,2020-03-11 23:58:38+00:00,Hey @GoZwift Can you look at creating a ride and a run to support #Italy We need to show them they are not alone. I suspect riders and runners will join in from around the world. #RideWithItaly #RunWithItaly Italy could be us. @UEC_cycling #Covid_19
1237890705369907201,2020-03-11 23:58:37+00:00,So proud of the leadership at WVU who canceled in person classes ahead of any cases of COVID in WV and kept the focus on protecting vulnerable populations. #WVU
1237890695295143939,2020-03-11 23:58:35+00:00,"Coronavirus is a non-issue. Less lethal than the flu, and has killed less americans than H1N1 (swine flu). Yes, i understand that nearly 4000 people have died from covid-19, but the average age of those killed are over 80. Younger people who have a healthy body have next to -&gt;"
1237890694670254080,2020-03-11 23:58:35+00:00,"My fellow Mainers. I know there aren't any official cases yet here. But let's not get complacent. It is highly unlikely that COVID-19 isn't here. If you aren't making contingency plans now, start tomorrow. Life needs to go on, but it can go on in smart ways that mitigate risks."
1237890673841287170,2020-03-11 23:58:30+00:00,yo this whole fucking time I thought it was corvid-19 not covid-19 i guess i just like crows
1237890664160886784,2020-03-11 23:58:27+00:00,I was here during the 2020 covid-19 outbreak :)
1237890663712083968,2020-03-11 23:58:27+00:00,"If I get hit with flu-like symptoms, I'm just going to assume it's Covid. I've already had two different colds, so surely I must be immune by now to whatever Cold crud is going around town, and I've had my flu shot, so it probably won't be the damn flu."
1237890652563636226,2020-03-11 23:58:25+00:00,Lol tell my man in Nigeria you can't get COVID-19 if you're black
1237890651712192514,2020-03-11 23:58:24+00:00,"Buzz over Sunak is surprisingly intense. I know the Tories are pushing it (likely to distract from COVID response &amp; Javid's departure) but its being absolutely taken up and he does seem like an improvement. 

Interesting historical shift for the Johnson Government, feels big?"
1237890649673707522,2020-03-11 23:58:24+00:00,"This COVID 19 is going wayyyyyyyy to far
#nCoV2019 #COVID19"
1237890648771948545,2020-03-11 23:58:24+00:00,"I don't want COVID-19!

I don't even know what happened in 1 through 18?"
1237890645634600961,2020-03-11 23:58:23+00:00,"I fully expect tonight's COVID speech to focus primarily on business impacts / aid while downplaying the nation's approaching health crisis.

I only hope that there's more preparation going on that it seems, and that warmer weather does indeed play to everyone's benefit..."
1237890645152292866,2020-03-11 23:58:23+00:00,"just thinking about the transmissibility of COVID-19, and the fact that the last flight before wuhan was locked down arrived in kalibo, it’s almost impossible that there is no transmission in this area."
1237890642199498752,2020-03-11 23:58:22+00:00,"Thinking of starting a wine delivery service in the Walla Walla Valley for people who are self-quarantined due to covid-19 and before anyone accuses me of disaster capitalism let me assure you my reasons are purely humanitarian in nature, I promise"
1237890639196381185,2020-03-11 23:58:21+00:00,"I don't have COVID-19, I've never had COVID-19. If I wanted COVID-19, yes, I probably can go out and get it, because I AM WHAT? SICKENING. You could never have COVID-19 because you are NOT THAT KIND OF GIRL."
1237890631680155649,2020-03-11 23:58:20+00:00,Testing for the Covid-19 should be free to all Americans as well any vaccine for this virus just as our government did in the 1960’s for Polio virus in the United States which would cover all Americans with or without insurance
1237890629117423616,2020-03-11 23:58:19+00:00,But as corona virus no dey fit we Africans make our government reports false cases before these whites folks make covid 19 turn covid 59 cuz that will be too strong for our skin😅😅😅
1237890621597052929,2020-03-11 23:58:17+00:00,"guys almost human extinction na btw, do what needs to be done before covid gets us done. mahalin mo na ung mahal mo at tangina i-coronavirus mo naman ung pride mo, remember mas importante ung tao kay sa mistake niya so lower down your pride and give love a bit of yourself~"
1237890619705626625,2020-03-11 23:58:17+00:00,COVID-19 is just to test how much humanity will freak out over dumb shit. Goodbye toilet paper
1237890601024024577,2020-03-11 23:58:12+00:00,In the midst of the COVID-19 I get strep throat 🙃
1237890590617899010,2020-03-11 23:58:10+00:00,"I am just wondering, how come there's no covid 19 news from Russia? #COVID19"
1237890589770670089,2020-03-11 23:58:10+00:00,"Italy has the oldest population Europe, so I'm not shocked that there are more covid-19 deaths there.
#COVID19 #coronavirus"
1237890589560983552,2020-03-11 23:58:10+00:00,Ima kick your ass COVID-19 &gt;:[ you're making my babies and girlfriends sad. I'm going to punch your face and make you cry and feel even more pain.
1237890577758171139,2020-03-11 23:58:07+00:00,"In this COVID-19 hysteria, it’s hard for a band like Disturbed to make royalties off of their mega-hit, “Down with the Sickness.” I am starting a grassroots campaign to get Down with the Sickness to #1 on the charts. Please join me in this effort to help our nu-metal brothers"
1237890574650245120,2020-03-11 23:58:06+00:00,"I’ll be going nowhere for awhile due to the COVID-19. As some of you know, I am immunocompromised and can not afford the risk.

The lockdown begins. Be clean. Wash your hands and be safe."
1237890563765981184,2020-03-11 23:58:03+00:00,honestly excited to see what terrifyingly uneducated shit 45 is gonna say at this press conference tonight regarding covid-19
1237890525635547136,2020-03-11 23:57:54+00:00,Apparently #Riverdale was in the middle of taping their 20th episode for the season when they found out about the person who came in contact with the covid-19 patient. I hope we can get a good season finale.
1237890522926071811,2020-03-11 23:57:54+00:00,"TAM is monitoring the coronavirus (COVID-19) outbreak. Following the guidance of public health authorities, the Museum is operating under regular hours (Tuesday - Sunday 10 am to 5 pm and every Thursday until 8 pm). Admission will be limited to 250 visitors at any one time. 1/3"
1237890517494427649,2020-03-11 23:57:52+00:00,"When are college students going to stop acting like they know the best course of action for containing COVID-19. This is doesn’t feel like the time to flood administrators with passive aggressive emails, they’re already facing a shitstorm."
1237890515460218882,2020-03-11 23:57:52+00:00,The prevalence of this Covid-19 kills our calm thoughts and invoke ominous feelings.
1237890501434429442,2020-03-11 23:57:49+00:00,The silver lining of COVID-19 is St. Paddy’s Day is cancelled this year #worstholiday
1237890499974848516,2020-03-11 23:57:48+00:00,"People are so concerned about COVID-19, but microwave plastic, drink water from plastic bottles left in heat and love to ingest chemicals through furniture and new car smells. Please stop."
1237890491389116421,2020-03-11 23:57:46+00:00,"Amidst the panic-buying and calls for social distancing, SOCIAL SOLIDARITY is needed now more than ever. 

COVID survives in people and if we think that we can do better by thinking only of ourselves, we are very wrong.
1/"
1237890472741224450,2020-03-11 23:57:42+00:00,"Social Distancing is a must. No handshakes, No ‘beso’, No Close Contact. Let’s work all together to fight this CoVID-19."
1237890456572137473,2020-03-11 23:57:38+00:00,Isnt covid-19 a destiny character
1237890447692849153,2020-03-11 23:57:36+00:00,"Bro y’all are really hoarding toilet paper? Like honestly, if you’re worried about food and water before toilet paper? I mean COVID-19 can’t spread through water, but still. I understood cleaning supplies and face masks but toilet paper confounds me"
1237890444085862400,2020-03-11 23:57:35+00:00,some lady at work told me I was gonna burn in hell after dying from the coronavirus (covid-19) .....maam
1237890434761781249,2020-03-11 23:57:33+00:00,We all have a responsibility to stop the spread of @COVID 19. Each one of you is a citizan of the world &amp; you have a duty to practice social distancing and wash hands @ASTRO_org @MDAndersonNews @ASH_hematology
1237890430487818241,2020-03-11 23:57:32+00:00,I keep saying Covid like the guy in American Movie says Coven.
1237890407393923081,2020-03-11 23:57:26+00:00,"“It is clear that the spread of the COVID-19 virus has increased and presently shows no abatement.  In an attempt to maintain a safe environment, Holy Cross College will cease campus operations effective immediately through April 13th” says President Rev. David T. Tyson."
1237890396979486722,2020-03-11 23:57:24+00:00,"Today it took me a long time to finally focus and resume working on the dissertation's literature review. Thankfully, I did end up making good progress. Starting tomorrow classes (in person) are canceled at my college until the 27th as a preventive measure against the Covid-19"
1237890394416766976,2020-03-11 23:57:23+00:00,"Love seeing schools who have had no contact with COVID-19 switch to online while my school, located in DOWNTOWN CHICAGO where there have been multiple cases, stays in session :-)"
1237890385248047104,2020-03-11 23:57:21+00:00,If I can’t get tested for COVID-19 I’m not paying my taxes.  Not sure if I’m joking.
1237890368902819840,2020-03-11 23:57:17+00:00,"Ljust because the number of COVID cases gets higher and higher, we must not panick. We should be prepared. For ourselves and our loved ones. 

Despite the lack of alcohol, masks, and other paraphernalia to protect us from COVID, we must be healthy inside. Boost your immune system"
1237890364935045125,2020-03-11 23:57:16+00:00,Has your company gone work from home due to COVID-19? Medical professionals can skip this question.
1237890355808202754,2020-03-11 23:57:14+00:00,"But I remember a few weeks back, nung kakaputok pa lang ng covid-19 I just bought 2 bottles of alcohol the bigger ones for the house, and 3 small bottles to carry in my bag. We just have enough inside our pantry. Even tissue rolls, enough for 2 weeks consumption."
1237890351467098112,2020-03-11 23:57:13+00:00,covid-19 is here and there is not toilet paper but at least we will get pink eye from wiping with our hands
1237890336262778887,2020-03-11 23:57:09+00:00,What if we discover the only cure for COVID-19 is experiencing the thrill of a live sporting event in person?
1237890333809115137,2020-03-11 23:57:09+00:00,"Saudi attacked US #shale industry now 7mill bpd. #Russia and #Covid_19 not fundamental cause. Damage to US &amp; five eyes countries far exceeds the 300,000bpd Saudi pushed Russia for.  Get your big pants on and call them out 
@CBS_Herridge @SquawkBoxEurope @business @Reuters"
1237890327521800192,2020-03-11 23:57:07+00:00,covid-19 you can kill me but do not kill riverdale
1237890324183126018,2020-03-11 23:57:06+00:00,A lil codeine a day keeps the covid away
1237890319565242368,2020-03-11 23:57:05+00:00,man if y’all are surprised about people having to pay absurd COVID-19 testing costs just wait till you hear about how sexual assault survivors have to pay for their exams :/
1237890312057446401,2020-03-11 23:57:03+00:00,"The girls done gave this virus names.  😭😭

“Mutha Vid”
“Miss Rona”
“Sister COVID”
“Miss VID19”"
1237890301152202754,2020-03-11 23:57:01+00:00,"JUST IN: A 26-year-old male is the fifth COVID-19 case recorded in Quezon City, Mayor Joy Belmonte said. The patient had no history of travel abroad and resides in Barangay Bagong Lipunan ng Crame. @inquirerdotnet"
1237890298023297024,2020-03-11 23:57:00+00:00,Something tells me tonight’s presidential address will be more about the economy than slowing Covid-19. I hope I’m wrong.
1237890297998086151,2020-03-11 23:57:00+00:00,"#bearmarket 
Part of my work takes me to the hospitals. Every year at this time the beds and ICU units are filled because of complications from the annual virus strains. Now add the COVID-19 elderly patients on top of those already admitted, and we have an unfathomable  crisis."
1237890294412013569,2020-03-11 23:56:59+00:00,"WHO declares COVID-19 a pandemic. 

More than 1k positive in the US. 

Kids on Spring Break this week and our ISD is thinking of extending the break as people test positive in our county. 

We have to have our temperature taken today to enter work. 

Keep and make sure your safe."
1237890289995374593,2020-03-11 23:56:58+00:00,"COVID-19 is now a global pandemic? 

PANIC BUYING INTENSIFIES

Seriously though, don't horde."
1237890288225357825,2020-03-11 23:56:58+00:00,"You ladies wearing acrylic/fake nails shouldn't fear COVID-19, you should fear the level of e-coli under under your nails

The hospital I worked at banned them after swabbing all RNs, stating those were; ""nothing more than a petri dish of bacteria"" 😧"
1237890286967066628,2020-03-11 23:56:57+00:00,By being proactive with the COVID-19 virus it prevents the American cycle of ignorance and regret that comes later from tragedy.  It also cuts the ability for the assholes who knew better later giving lovely speeches about how we are better than this and we will rise above it.
1237890271817256962,2020-03-11 23:56:54+00:00,"Y'all know how there's that (probably inaccurate) statistic about how many Americans don't have $500 for an emergency?

COVID-19 is a national emergency. Most folks' rent is more than $500."
1237890270387036163,2020-03-11 23:56:54+00:00,"Very, very difficult decision to have to make, but with AZ ramping up its COVID-19 preventative measures amidst more outbreaks, I don't know if it would be wise to travel back and forth to a large gathering.

Cancelling my trip to Michigan Masters 2020, sad to say."
1237890261079842822,2020-03-11 23:56:51+00:00,The problem with a negative Covid-19 test result is that it only means that you have not been infected with the virus as of the moment of the test. You could have picked up the virus while walking out of the testing station from another patient.
1237890234764779520,2020-03-11 23:56:45+00:00,My band is going on tour next month amid the COVID-19 outbreak. Should we wear hazmat suits on stage?
1237890224677482508,2020-03-11 23:56:43+00:00,Of course Iberia would be confirmed with COVID-19
1237890223356272642,2020-03-11 23:56:42+00:00,"Some of our government officials, whether be in the Senate, Finance Department &amp; Transportation Department will be on self-quarantine as they did interact with some persons being afflicted with covid-19. 

Would the persons they did indeed interact with will be included by the"
1237890218247643137,2020-03-11 23:56:41+00:00,"there have been 5ish reported COVID-19 cases in nebraska so far and our institutions have been slower and more hesitant to shut down / move online compared to our coastal peers. so right now it’s feels like i’m at a screening of Contagion, sitting in one of the middle rows"
1237890204683264001,2020-03-11 23:56:38+00:00,just your average day at work where the most royal i’ve felt in life is bc i am the chosen one to transport a covid-19 + patient from icu to the floor
1237890193383755783,2020-03-11 23:56:35+00:00,COVID-19(Pandemic 2020) trucker hats coming soon
1237890182512164864,2020-03-11 23:56:33+00:00,"2nd Tweet of the day:

Topic of discussion Covid-19 or whatever it’s called. 

Mom: maybe they’ll cancel church. 
Me: why so you don’t feel bad for not going?
Mom:(laughs and doesn’t say anything)"
1237890178372579328,2020-03-11 23:56:32+00:00,CBS national HQ is infected with COVID-19 and they're off-air switched over to CBSN Boston while they disinfect the building. Wow.
1237890149440094210,2020-03-11 23:56:25+00:00,Covid is a pandemic case where even first world countries are having issues in controlling it. I wonder how some would blame it to the government? I'm not pro or against it but I believe pandemic cases was part of the topic during college days and blaming gov't isnt part of it.
1237890148970291200,2020-03-11 23:56:25+00:00,Theres a rumor that one of the student at my lil cousin’s school issa suspect of covid-19 and she got it from her friend which lives near to my place 🤧 pls pray for my aunt’s family n my little sis’ healthiness cs they lives tgt. Thank you 🙏
1237890144373329926,2020-03-11 23:56:23+00:00,"Germany has reported 1,565 cases of COVID-19 and only 2 deaths.

Great news for them!

Italy on the other hand has not been so lucky. They have reported 10,149 cases and 631 deaths"
1237890132994174976,2020-03-11 23:56:21+00:00,Covid is in the air.
1237890128460288000,2020-03-11 23:56:20+00:00,"If covid-19 continues to spread, I can see how I could potentially be quickly made redundant."
1237890125771628545,2020-03-11 23:56:19+00:00,"WHO: ""COVID-19 outbreak is now a pandemic""
Australia: ""Get your lazy ass to work mate"""
1237890119534645248,2020-03-11 23:56:18+00:00,"I don’t understand what’s gonna happen with COVID-19. Everyone says get 2 weeks of food/meds when they’re talking about 6 months of quarantine. Minimum six months of no school, no work, no large crowds. Explain to me how the fuck that’s going to work?!"
1237890116804399104,2020-03-11 23:56:17+00:00,I’m so happy that @AlabamaMBB elected to sit out the NCAA tournament amidst the COVID-19 outbreak. Truly taking the best precautions possible.
1237890100417015808,2020-03-11 23:56:13+00:00,"Dear Trump White House,                         Is there still an ADULT IN THE ROOM?                                                          Signed, COVID 19"
1237890098030510081,2020-03-11 23:56:12+00:00,"Well, so much for my plans for going to Tails and Tornadoes.

With COVID-19 spreading like wildfire, I don't think I'll be able to make it to the convention."
