id,date,tweet
1366169440476422144,2021-02-28 23:32:31+00:00,"Had to end the stream pre-emptively!

My grandfather just got out of the hospital from having covid and he managed too live so I'm heading to go see him"
1366169420704456704,2021-02-28 23:32:26+00:00,Unoo upset Anju wid unoo covid vaccine conspiracies
1366169402903834625,2021-02-28 23:32:22+00:00,"COVID definitely had be fucked up for 5 days straight, but thank God it’s over"
1366169319546236929,2021-02-28 23:32:02+00:00,Seriously @ottawa? Volunteer firefighters get@the vaccine before other Heathcare workers. Eff you all. And to all the haters no not because I can’t get it yet. I know lab workers who are eyeballs deep in covid every day and they are not even on the radar.
1366169316236795907,2021-02-28 23:32:01+00:00,"It’s crazy how a lot of people are acting like if Covid isn’t a thing anymore, like bitch put your mask on ain’t no one wanna see your ugly ass"
1366169316115296256,2021-02-28 23:32:01+00:00,"JJ vaccine does what Moderna and Pfizer do - it keeps you protected from severe Covid and prevents hospitalization and death. 

When my patients ask me which vaccine to take, trust that I’ll be telling them to take any of the three vaccines they can get."
1366169278811152387,2021-02-28 23:31:52+00:00,"What happened?!
Biden: Can't deliver a 10-minute speech without stumbling over prepared words; wins election with millions of unverified votes
Trump: Delivers a 45-minute speech with vigor, humor &amp; insight; gains more votes than any incumbent president
Answer: COVID Vote fraud"
1366169274428047362,2021-02-28 23:31:51+00:00,Mass Tom succumb to Covid...
1366169266765107204,2021-02-28 23:31:50+00:00,"RT @KateSullivanDC: Starting tonight, the Biden administration will begin distributing 3.9 million doses of Johnson &amp; Johnson's Covid-19 vaccine, according to a senior administration official. Those doses will be delivered as early as Tuesday morning, the official says."
1366169257147592707,2021-02-28 23:31:47+00:00,"My bf is house sitting for his parents while they travel to another town to get their covid vaccines so I'm on my own for dinner and we're really low on groceries. So I made breakfast tacos, which is quite possibly one of the most predictably bachelorette meals 😂"
1366169253322219520,2021-02-28 23:31:46+00:00,"I fairly admit, I rely too much on social media use because I sense there's not much actual engagement with the people around me. Apart from COVID being a contributing factor, dogma—I hate that shit. If people invite me out, I'm mostly off character. I don't fit in. Ya feel me?"
1366169244405280772,2021-02-28 23:31:44+00:00,Any bombshells or measures announced tonight that will make an impact on the covid spread? #JustAsking
1366169241666338820,2021-02-28 23:31:44+00:00,"RT @KateSullivanDC: Starting tonight, the Biden administration will begin distributing 3.9 million doses of Johnson &amp; Johnson's Covid-19 vaccine, according to a senior administration official. Those doses will be delivered as early as Tuesday morning, the official says."
1366169239254564864,2021-02-28 23:31:43+00:00,A Golden Globe Actress had only 4 dresses to choose from instead of the usual 40 this year. PHUCK THIS COVID SHITE!!!!
1366169223920246786,2021-02-28 23:31:39+00:00,"A bit more reflection from Trump at #CPAC on lessons learned about fed govt management (e.g. COVID), comms in a crisis, what could've been done better in both the campaign and the post-election challenges would've been helpful. Nevertheless, it was a solid speech overall."
1366169218727751684,2021-02-28 23:31:38+00:00,"Every day, i get sadder and sadder abt my inability to go to the gym.
why did a global pandemic have to happen? why now, of all times?
then again, would there ever be a right time for something like Covid-19 to strike the world?
in any case, it's something difficult to live with."
1366169212998148100,2021-02-28 23:31:37+00:00,"What’s going to happen first, Covid ending or Adele dropping a new album?"
1366169212020998146,2021-02-28 23:31:36+00:00,"While I understand that not everyone can work from home, in the year since COVID-19 took up residence in JA, has your private sector employer taken any tangible steps to pivot and move operations that can be done remotely in order to allow staff to WFH?"
1366169196627963908,2021-02-28 23:31:33+00:00,Our schools are opening tomorrow . It’s forbidden to enter without a negative covid test . Yes even the children. Imagine now about the vaccine . Will be mandatory or not ? I will let you all guess #COVID19 #vaccine #COVIDVaccine
1366169192513363976,2021-02-28 23:31:32+00:00,I hope even after Covid the restaurants keep the contactless menu. It’s better than those big ass menus.
1366169187773775874,2021-02-28 23:31:31+00:00,"My understanding is really getting affected. I mean, no one is allowed to get sick anyone. You're not even allowed to get headaches or use acetaminophen to treat it. Can't throw up too. Our normals now being replaced by fricking FRAUD called Covid!!!"
1366169172791734273,2021-02-28 23:31:27+00:00,Wait... suh the ppl dem weh dead from COVID cyaa even bury. 😭
1366169167993462789,2021-02-28 23:31:26+00:00,"After President Trumps CPAC speech, it makes me wonder, how the hell did people vote against this man, only to find out, they voted for a liar, who still is riding Trumps covid plan like it's his own, didn't he run on he had the answers? Yet continues the Trumpn plan. 😆"
1366169164176588801,2021-02-28 23:31:25+00:00,Oh god me and this boy are talking about gagging (ITS IN CONTRXT OF COVID TESTING BUT WITHOUT CONTEXT ITS MAD)
1366169158136823809,2021-02-28 23:31:24+00:00,"Trump said in his CPAC speech that Biden has undone all of his achievements. It’s true. Covid is down, people aren’t attacking the Capitol, we’re acknowledging science and we’re not reading daily hate tweets. Miss ya, buddy."
1366169145272893443,2021-02-28 23:31:21+00:00,"I don't get the logic behind Covid conspiracy theory people

Like they think it's engineered in a lab, and that's why they don't wear masks?

Bitch if that's true you should try to protect yourself more you dense fuck"
1366169141581905921,2021-02-28 23:31:20+00:00,today is the first weekend in SO long that I’ve gone somewhere and actually done something (covid safe obvi) and it felt so good
1366169119444328448,2021-02-28 23:31:14+00:00,"Prime Minister Justin Trudeau commended U.S. President Joe Biden on getting the United States to re-engage with its allies during a wide-ranging interview on NBC's Meet the Press on Sunday that touched on everything from COVID-19 vaccines, Saudi Arabia and the Keystone XL pi…"
1366169117057822724,2021-02-28 23:31:14+00:00,"I was put on covid shot list in Jan and never called, I'm waiting on  the Va to reply from Cape Coral?"
1366169116441145344,2021-02-28 23:31:14+00:00,covid has made it easier to sell sponsored posts on meme pages I swear on Jah
1366169077203357701,2021-02-28 23:31:04+00:00,"You guuuyyys!! I have officially booked my appointment for my first COVID-19 vaccine 😫🙌🏾  put it in, put it in, all the way iiiiinnnnn 💉 I’m super stoked  😬"
1366169076113027072,2021-02-28 23:31:04+00:00,first benefactor of covid : uzi’s new album
1366169064121360389,2021-02-28 23:31:01+00:00,Blueberry Eyes - Max feat Suga BTS @MAXMusic I LOVE ITS SO REFRESHING. Don’t get me started on your glowing wife and congratulations on your little bundle of joy! Come to Australia post-covid. Me and my 11months old loved the song so much 😘😘😘
1366169062485680128,2021-02-28 23:31:01+00:00,"Whether you’d like to believe it or not, we live in a lawless society. We are seeing the consequences of that now more than ever with the COVID-19 numbers and crime. This is the culture that will ALWAYS cripple our progress. Time and time again."
1366169027610103808,2021-02-28 23:30:53+00:00,Sis seh she nuh waa hear bout covid she waa hear bout Jasmine Dean.. I
1366169014565818376,2021-02-28 23:30:49+00:00,I am so fucking over Covid-19. Somebody please tell her to go home.
1366169010308407296,2021-02-28 23:30:48+00:00,"Since testing positive for COVID, I've been contacted in various ways from the state about contact tracing. That's great. I just wish I'd gotten some ""Hey, you got COVID, here are some treatment suggestions"" material, too. The only thing I've been told is to isolate."
1366169005988413444,2021-02-28 23:30:47+00:00,.@MSNBC does not have the integrity to tell Americans that the $1.9T “stimulus for Covid” package only has 9% of those funds slated for Covid relief.  Have some integrity msnbc and tell Americans the truth to become real news.  Your slanted view is so obvious.
1366168946370637825,2021-02-28 23:30:33+00:00,bro did anyone know that due to covid and shit CO2 emissions went down by EIGHT PERCENT???? BECAUSE I DIDNT!
1366168939869388807,2021-02-28 23:30:32+00:00,I can’t believe I actually never got covid tested last year. It’s shocking cause the way my job hustled for me to get it
1366168932646850560,2021-02-28 23:30:30+00:00,1 year anniversary of pre covid boinkage 😔😭 i have been so brave 🤧
1366168918684028929,2021-02-28 23:30:27+00:00,Covid has been an incredible blessing to those who suffer from FOMO.
1366168902900871169,2021-02-28 23:30:23+00:00,"OK, I started to believe that @EU_Commission has completely failed with this Covid crisis..."
1366168898974978049,2021-02-28 23:30:22+00:00,"A few years ago a virus called bat coronavirus RaTG13 was discovered and classified as low risk.

When scientists sequenced the genome of the virus behind COVID-19, they found that 96% of it was identical to RaTH13. #CoronavirusExplained"
1366168882042474497,2021-02-28 23:30:18+00:00,i NEVER napped before covid came along 😭 i’d be up at 6am to get ready to go to campus and at midnight i’d sleep wtf....
1366168865764306944,2021-02-28 23:30:14+00:00,"So finally Covid-19 is 1 year Old
If we all Could remember how it all started last year, person go think say na Judgment day we Dey💔"
1366168859070197763,2021-02-28 23:30:12+00:00,Re Covid tracing in NZ and reliance on honesty - one thing I haven’t seen receive much discussion is official acknowledgement of the grey and black economies. In some cases revealing your social networks amounts to “narking”. Thoughts on how to deal with this reality anyone?
1366168833002770434,2021-02-28 23:30:06+00:00,Scientists have developed a vaccine for Covid. Our own Government let’s the virus of the Republican Party run wild. That’s scary.
1366168822021955586,2021-02-28 23:30:04+00:00,Anybody have experience with booking a house boat on Lake Powell? Trying to do a little post-Covid planning. All tips appreciated.
1366168816154206209,2021-02-28 23:30:02+00:00,"#POFreight : since 22 February you do not need to take a covid test if you are returning to France after spending less than 48h in the UK,. To validate your trip duration, please keep your tickets from your crossing to the UK, to present at check-in when you return to France."
1366168812882694145,2021-02-28 23:30:01+00:00,"Note:

If you are young, though not likely, you can still get sick from covid.

And the long term effects (#longcovid) are still largely unknown and a large number of people are reporting long term damages."
1366168803864936452,2021-02-28 23:29:59+00:00,Kind of amazing that a nationalist germaphobe with a long history of hostility to China failed to turn covid to his political advantage.
1366168795870593026,2021-02-28 23:29:57+00:00,"I wrote another editorial about how disabled New Yorkers are not being allowed equal access to the Covid vaccine.  The one I sent to the Albany Times-Union never got published.  Hopefully the one I just wrote to another paper will come out.

If it does, I will post it here."
1366168772848082945,2021-02-28 23:29:52+00:00,at that point of covid where i genuinely can’t tell if i’m sore because i’m still sick or if my muscles are just atrophying
1366168757899587584,2021-02-28 23:29:48+00:00,Raptors finally get hit by this dang thing called COVID sucks man !
1366168743131291648,2021-02-28 23:29:45+00:00,"#pawcircle update
Keep the good thoughts coming
 RT @moretta_moon: After her massive reaction to the Covid  Vaccine last week Joanne is now starting to pull up.  She hopes to return to Social Media soon Thanks for all your Prayers and good Wishes"
1366168741185277962,2021-02-28 23:29:44+00:00,So #GoldenGlobes can happen but Cali keeps other businesses closed cause of #covid lol just goes to show the Hollywood elite gets special privileges
1366168729986490373,2021-02-28 23:29:42+00:00,"On FB Covid police 👮‍♀️ are telling everyone how far they can travel to exercise. Self righteous know it all’s get on my nerves, I’m surrounded by hills and I’ll walk them when I want."
1366168699590303746,2021-02-28 23:29:34+00:00,"sorry i been ignoring yall. I have F in like 3/5 of my classes, 6 people from my family contracted covid and died, i gained 40 pounds , and i have no will to live. Anyways ill be in rahway if anyone wants to do cr@ck"
1366168697186885632,2021-02-28 23:29:34+00:00,Got emotional getting my first covid vaccine right now!!! I’m so happy to do my part
1366168687716102146,2021-02-28 23:29:31+00:00,"Word to the wise: if u didn’t get COVID last summer, it’s going tf down right now! #staysafe #thinkitsagame"
1366168676957900805,2021-02-28 23:29:29+00:00,Ok the “public health experts” who run Ontario require that school children be locked in isolation for 14 days if exposed to “COVID” Unreal
1366168673778610178,2021-02-28 23:29:28+00:00,"I want to go to a picnic date, bowling, paintballing and  literally everything else... I hate Covid."
1366168660377763841,2021-02-28 23:29:25+00:00,Me can married now inna Covid Suh me can make it small fi that reason? 🥴
1366168655654912003,2021-02-28 23:29:24+00:00,"Hi @cvspharmacy my parents got their first COVID shot somewhere else and are signed up for the second shot with you in a couple weeks.

We want to double check that it's the same kind of shot but it's not on their paperwork. How can we check? 

Thanks!"
1366168648692469766,2021-02-28 23:29:22+00:00,My hospital Bill a rack... I hate Covid .
1366168639649550339,2021-02-28 23:29:20+00:00,"today's a year since covid rlly sunk in for me, I remember chatting to some friends who really had no idea and I think still didn't quite believe me at the time"
1366168631432871940,2021-02-28 23:29:18+00:00,"Niggas going to events with more than 10 people, no masks , &amp; wonder why covid still here .🙃☠️"
1366168620838092800,2021-02-28 23:29:16+00:00,bro. i can’t wait for the day that i’ll be able to give devonte one huge ass hug 🥺🥺🥺🥺 ugh covid go away. i’m tired of u mf
1366168613053472773,2021-02-28 23:29:14+00:00,"Truly superb performance by PRESIDENT TRUMP at CPAC!
He nailed so many issues perfectly especially the corrupted 2020 Presidential Election. ""They used Covid as a way of CHEATING .. with the corrupt mail in voting."" 
""We reject left wing lunacy, we reject cancel culture"" Superb!"
1366168611916808192,2021-02-28 23:29:13+00:00,Government is the problem not covid.
1366168603653853188,2021-02-28 23:29:11+00:00,"i got covid micro-manging my actions and now stupid people who believe things that are not true. guess what, fuck off. you can look and see there is nothing. i will cut out anyone who had betrayed my trust. people who are on the edge shape the fuck up."
1366168594929704962,2021-02-28 23:29:09+00:00,My coworker &amp; I were evacuated early today from work. Other coworkers are positive with covid and they had to spray/disinfect our work area. So they sent everyone home in order for the disinfecting process to take place. I took a nap &amp; now feeling refreshed. #Sunday #Covid_19
1366168561991868416,2021-02-28 23:29:02+00:00,Agh - the Covid Karen’s are back in full force. Stop the ride. I want off
1366168551363649539,2021-02-28 23:28:59+00:00,Terrible stream I am too sick and too exhausted for that I hate this year I hate COVID I hate everything
1366168550554140673,2021-02-28 23:28:59+00:00,We are disproportionately dying from COVID-19. We are NOT disproportionately dying from the vaccine. - Rev. Mark Thompson
1366168550004695042,2021-02-28 23:28:59+00:00,"nothing describes the effects of gentrification more than Columbia COVID testing its students TWICE a week while West Harlem residents struggle to find accessible testing, often forced to wait in long lines to get tested, all while Columbia offers no support or resources"
1366168548184260610,2021-02-28 23:28:58+00:00,Yoo the level of braffin n spending that will happen post covid...
1366168530333409280,2021-02-28 23:28:54+00:00,Oh Look it's the Covid Queen  #Noem
1366168526868926468,2021-02-28 23:28:53+00:00,Is2fg if I got covid I will fucking commit a crime I'm way too careful to deserve this
1366168521701351425,2021-02-28 23:28:52+00:00,my school has had 6 covid cases in 1 month but they keep saying shit like “pls continue to send ur kids to school they r safe” my god
1366168519260450817,2021-02-28 23:28:51+00:00,"112,000 covid deaths since dementia joe took office. Those are the covid deaths tolls under joe Biden’s presidency."
1366168486397964288,2021-02-28 23:28:43+00:00,"My wife had her first Covid-19 swab yesterday. How many ppl out there are still nasopharyngeal-swab virgins? And how can they go for over 12 months without a cough, runny nose, sore throat, or headache? They either live in a bubble or don't have kids or both! 🤣#viruses"
1366168474859433988,2021-02-28 23:28:41+00:00,Registers for Covid Vaccine. Immediately books a trip to Arizona.
1366168461886566404,2021-02-28 23:28:38+00:00,Dude next to me def thinks i have COVID... lolll post weekend sniffles and allergies killing me today! #sorrybud
1366168459118280713,2021-02-28 23:28:37+00:00,"Just had my first post-Covid-insanity trip with some of my best friends (we got tested, wore masks, yada yada yada).  I can confirm that we humans haven’t turned into robot recluses numb to the importance of socialization.  It was refreshing and a jolt of life into the soul."
1366168449542668288,2021-02-28 23:28:35+00:00,the amount of people who have gained some kind of medical cert in COVID from learning from social media &amp; not real life...
1366168415937982464,2021-02-28 23:28:27+00:00,Ok Mr  @AndrewHolnessJM we see that you have a new plan for COVID every week and it is to implement new curfew time. What is the plan for the people of your country and their livelihood?
1366168401928855555,2021-02-28 23:28:23+00:00,"I just saw a list of places that are welcoming fully CoVid vaccinated travelers into their country 👀 
Iwontdoityetbutgoodtoknow 😁"
1366168383792775172,2021-02-28 23:28:19+00:00,My cousin’s family that has Covid? All of them do. A family of 8. Baby was breastfed through and recovered quickly. 2 are asymptotic. All else were SICK. My cousin? She’s currently going to hospital via ambulance who checked them everyday.
1366168372803629057,2021-02-28 23:28:16+00:00,COVID-19 vaccines should be obligatory to all.
1366168369112694788,2021-02-28 23:28:16+00:00,i’ve never had covid but i’ve had beiber fever
1366168362833702912,2021-02-28 23:28:14+00:00,We need consequences for people who break COVID rules. Ignorance and stupidity is not an excuse. They're putting lives in danger. I support our government for the most part but you can't get on our case about complacency when you're being so lenient #covidnz
1366168355384795137,2021-02-28 23:28:12+00:00,So who else is just gonna wear a face mask forever now regardless of whether or not the human race gets Covid under control? Tbh the less my face is visible the better.
1366168355237990407,2021-02-28 23:28:12+00:00,yall if i get covid im giving my genshin account to whoever and that person better get me a fucking venti or else i will haunt them as a ghost and fuck their mom
1366168351798530048,2021-02-28 23:28:11+00:00,i got the covid vaccine ahh yay
1366168350842322944,2021-02-28 23:28:11+00:00,At this point Covid isn’t going anywhere so it’s either stay scared or learn to adapt and live with it 🤷🏽‍♀️
1366168348929626113,2021-02-28 23:28:11+00:00,"Covid didn't crush the economy, government crushed the economy.  Kristi Noem ripping Biden"
1366168308551155713,2021-02-28 23:28:01+00:00,you can't just say covid is a hoax. you have to say that you do not believe in science. you have to explain to me in DETAIL how the biochemical makeup of covid is just an illusion. tell me
1366168305053143050,2021-02-28 23:28:00+00:00,"The covid situation here is making me so stressed I'm just, can the ignorance in this country be ended? Please"
1366168286837276678,2021-02-28 23:27:56+00:00,"I’ve noticed afew famous people
expressing some regret that they took an old person’s COVID-19 vaccine. 
Haven’t heard yet from@Marco Rubio though?!!!?.....,,,"
1366168286052945922,2021-02-28 23:27:56+00:00,wait do covid tests actually hurt?
1366168284308008960,2021-02-28 23:27:55+00:00,"I guess if everyone going to your party has already had COVID it probably doesn't matter, right? Let's hope not."
1366168281095241729,2021-02-28 23:27:55+00:00,"Just heard positive COVID-19 tests in LA county fell from 19% to 2% in a month......

We are supposed to believe that masks, social distancing, lockdowns, and the vaccine are responsible.

Not one mention of the PCR test threshold being lowered.....

Sheep believe the first part"
1366168262149427207,2021-02-28 23:27:50+00:00,"Total MP 109/220 = 49.5%

Darurat announced.

YDPA consented parliament should convene. 

Total MP 109+2 = 111 = 50.5%

Now you know the real reason for darurat. 

#COVID #Darurat #Emergency"
1366168257078714376,2021-02-28 23:27:49+00:00,"AndrewHolnessJM: Effective Thursday, March 4, 2021, all persons entering Jamaica (both Jamaicans and non-Jamaicans) will be required to present a negative COVID-19 test (which was conducted within 72 hours prior to date of travel) at check-in for their flights."
1366168249382092800,2021-02-28 23:27:47+00:00,"What people don’t seem to understand that that covid is like other viruses - difference is - it’s highly #CONTAGIOUS! So don’t touch stuff a million people  has, don’t breath air that’s stagnant and protect your uptake of aerosols! Other people’s sneeze or cough!
Simple!"
1366168239466807300,2021-02-28 23:27:45+00:00,AndrewHolnessJM: 2. We now for the first time are seeing that the number of symptomatic persons requiring hospital care approximates the number of dedicated COVID beds in our health system.
1366168228104466438,2021-02-28 23:27:42+00:00,Damn they scheduled me for another covid test. Damn I just took one 2 weeks ago.
1366168216435834883,2021-02-28 23:27:39+00:00,"I feel like it's important to note that if you present a negative test 72 hours before travel, you can in fact catch covid between that time and your travel time. Just saying"
1366168184827576325,2021-02-28 23:27:32+00:00,"Honestly as shitty covid and everything has been, my life has been so good the last 4-6 months"
1366168181870645253,2021-02-28 23:27:31+00:00,I don’t want COVID-19 AGAIN! Unuh please talk to Anju. I ain’t vote for Covid...mi vote fi him.
1366168148060307459,2021-02-28 23:27:23+00:00,My 68 year old mom was FINALLY able to get her first covid shot!!! I'm so happy I could cry...she kept getting denied because there weren't enough before. I travel every week and still can't get mine so this is a major win 🥳
1366168143362740228,2021-02-28 23:27:22+00:00,not even when u dead u can get rid of covid a bother yuh spirit.
1366168142297391112,2021-02-28 23:27:21+00:00,can we make march 1st like an international day of mourning the year we lost to covid
1366168125834620932,2021-02-28 23:27:18+00:00,okay so im gonna be doing more art of people cause in my art class that waht i was learning about before covid hit and stopped me from progessing and i do traditional art i havent started doing digital art yet but would you guys be interested in seeing my art when i do fan art :0
1366168116716310529,2021-02-28 23:27:15+00:00,"No funerals and burials, so all the bodies of the people who die from covid-19 are gonna go where Anju?"
1366168097250414597,2021-02-28 23:27:11+00:00,"Happy Monday🌞
Aussie News: 
Body parts found ,South Coast NSW beaches. 1 part confirmed to be missing mother (of the missing million$) Melissa Caddick. 
South Australia leading the way in banning ALL single use plastic- straws, bags,cutlery etc. 🍀☘️🐲
COVID Vaccine begins."
1366168062114865160,2021-02-28 23:27:02+00:00,"Reminder!  Complete self checks and do not send anyone to school that has covid related symptoms. If anyone at home has symptoms, please keep everyone home until a negative test or alternate diagnosis is established.  We need everyone to be on board."
1366168050274349058,2021-02-28 23:27:00+00:00,I need a wee favour.  A lovely man Patrick Monaghan is turning 80 on March 10th. He lost his beloved wife to Covid 😢 He's a huge Celtic fan &amp; his daughter is trying to get afew birthday messages for him.. Can u help @chris_sutton73 @JohnHartson10 @MaccaFrank @BrianMcClair13 💚
1366168047115886593,2021-02-28 23:26:59+00:00,"after months of stressing out, so many phone calls and multiple forms being filled out, I'm so excited to say that I will finally be getting the covid vaccine at the end of the week🥺🥳#peaceoutcovid"
1366167996570497026,2021-02-28 23:26:47+00:00,I had something in my Timehop about wanting Pizza Hut buffet and I’m sad Bc they’ll probably never do buffets again bc of Covid
