id,date,tweet
1237885265366192128,2020-03-11 23:37:00+00:00,to stay safe from COVID-19 i will NOT be going to the gym for at least the next 6 months. thank you for your support.
1237885251747115009,2020-03-11 23:36:57+00:00,"COVID-19, COVID-19
I’m begging of you, please don’t take my gran
COVID-19, COVID-19
Please don’t take her just because you can"
1237885248886751232,2020-03-11 23:36:56+00:00,covid-19 is just another way of pronouncing thanos 😳 im jk im jk
1237885240070176781,2020-03-11 23:36:54+00:00,"John Travolta was hospitalised with suspected Covid-19.  After extensive tests, doctors said it was just Saturday night fever."
1237885228535803907,2020-03-11 23:36:51+00:00,"before COVID-19 kills us all, anyone wanna admit they have a crush on me? 🥺👉🏽👈🏽"
1237885227747303429,2020-03-11 23:36:51+00:00,I'm sorry to inform you that Snacks and Stats with Dad has been cancelled until further notice due to COVID-19. 😭
1237885217081192450,2020-03-11 23:36:49+00:00,all these people panicked over COVID-19 need to do some research and calm the fuck down lol
1237885213708939264,2020-03-11 23:36:48+00:00,Covid-19 had to hit when the Lakers are ballin. We had to suffer through Robert Sacre just for this
1237885211079143425,2020-03-11 23:36:47+00:00,"So in other news I finally got a flu shot

This is not a ""Cass thinks the flu shot helps with COVID-19"" situation, it's a ""Cass was really sick this winter and wasn't able to get the flu shot until now"" situation

But hey I got it"
1237885209636245507,2020-03-11 23:36:47+00:00,I can’t believe the media blew up COVID 19 into what it is.. honestly insane
1237885206276608002,2020-03-11 23:36:46+00:00,Someone I work with made an EXCELLENT point about working from home due to COVID-19: it’s a wonderful opportunity to support your local businesses! They’ll need it!
1237885202610802688,2020-03-11 23:36:45+00:00,"100,000 people died in Lombardy in 2018. Italy has the oldest population in Europe. How many of the 468 Covid linked deaths in Lombardy this year were really caused by elderly people’s other illnesses?"
1237885190350852096,2020-03-11 23:36:42+00:00,"Boyle County Schools WILL be in session tomorrow.

We are committed to keeping you informed and dispelling rumors, and any closing will come by call/text from the district. Our students’/staff’s safety is top priority. COVID-19 is a unique situation we are monitoring closely."
1237885184596271104,2020-03-11 23:36:41+00:00,"I’m glad to see institutions and local/state governments taking COVID prevention seriously. Because judging by people’s reactions to things like fans not being allowed at the NCAA tourney, most could give a shit less if they catch it or give it to someone else. 

And that’s scary"
1237885183799341056,2020-03-11 23:36:41+00:00,what if covid is the new influenza?
1237885182700425216,2020-03-11 23:36:41+00:00,Should they cancel DEF CON even if COVID-19 passes?
1237885181647675393,2020-03-11 23:36:40+00:00,i’ve become so numb to all the covid-19 news that i’m not even sure things are real anymore and that’s on information overload
1237885178749415427,2020-03-11 23:36:40+00:00,I cancel my life due to COVID-19
1237885178002931712,2020-03-11 23:36:39+00:00,"okay so covid is near my city AND I'm a med student so I'm always close to people that work in hospitals
kinda scared"
1237885167156379648,2020-03-11 23:36:37+00:00,Because of Covid-19 Patriots owner Robert Kraft now having to pay for elbow jobs.
1237885166594314241,2020-03-11 23:36:37+00:00,COVID-19 &gt; every event that was suppose to happen
1237885162643271680,2020-03-11 23:36:36+00:00,“I wonder how bad Covid-18 was”
1237885145085964289,2020-03-11 23:36:32+00:00,"COVID SHOULD BE ERADICATED! 
COVID SHOULD BE ERADICATED! 
COVID SHOULD BE ERADICATED!
COVID SHOULD BE ERADICATED!
COVID SHOULD BE ERADICATED! 
COVID SHOULD BE ERADICATED!
COVID SHOULD BE ERADICATED!
COVID SHOULD BE ERADICATED! 
COVID SHOULD BE ERADICATED!

For real though! PERIOD"
1237885133295738881,2020-03-11 23:36:29+00:00,My parish mayor just announced COVID is now in our parish. I'm hoping work will let me take precautions but seeing as I recently got in trouble for wearing a face mask they probably won't. 😂
1237885121715253250,2020-03-11 23:36:26+00:00,"Today's Kitchen Table Economics from the @AFLCIO // 1,251: The number of K–12 schools around the country that have closed or are scheduled to close in response to the growing COVID-19 outbreak. #coronavirus #1u"
1237885120331292672,2020-03-11 23:36:26+00:00,I hope the monthly chess tournament I'm going doesn't cancel cause of COVID-19
1237885119270023168,2020-03-11 23:36:25+00:00,Now I’m looking out to see if carnivals throughout the region will be cancelled or postponed because of this covid-19 fella
1237885111070158849,2020-03-11 23:36:23+00:00,Fuck the Coronavirus and COVID-19.
1237885111011442689,2020-03-11 23:36:23+00:00,"Important update :
Dear Hampshire College Community,
Our community has been working responsibly and creatively to respond to the continuing spread of the COVID-19 virus. We are taking a number of important steps effective today, detailed below."
1237885104791228421,2020-03-11 23:36:22+00:00,Covid. Remember drinking water throughout the day in small amounts experts say is advisable. Google for more information. It’s has to do with the throat not remaining dry &amp; receptive and the water flushing the virus into the stomach...check it out!
1237885104715730944,2020-03-11 23:36:22+00:00,Overheard a gaggle of women earlier talking about the corona virus (COVID-19 for those unaware) and how it is a man made virus that has been designed by governments to take out the elderly in order to save money. They also mentioned this operation was funded by Bill Gates
1237885104120197121,2020-03-11 23:36:22+00:00,"According to Joe Lunardi’s latest Bracketology, COVID-19 will be this year’s overall #1 seed."
1237885086931890178,2020-03-11 23:36:18+00:00,Really hoping Worlds Cheerleading is not cancelled at Disney in April .. go away COVID 19!
1237885085891743751,2020-03-11 23:36:17+00:00,"UK Government figures, for UK COVID-19, for today, Wednesday 11th of March 2020:
Total infections 456
Total deaths 8.
Thus the death rate is 2%."
1237885084897665025,2020-03-11 23:36:17+00:00,"My mother, who has said, “I don’t know why everyone is freaking out” read up on covid-19 in Italy and went “the number of dead jump drastically over night. That’s alarming.”"
1237885083308011520,2020-03-11 23:36:17+00:00,"So my dad bought Billie Eilish tickets-

But the show was cancelled because of CoViD 19"
1237885080644640773,2020-03-11 23:36:16+00:00,"It is really important to not be scared but to stay cautious and get your information about COVID-19 only from trusted sources of government and health officials. Think of the most vulnerable countries around the world, support one another and we will get through it together."
1237885080514596867,2020-03-11 23:36:16+00:00,"W/ all the COVID-19 news, it’s been a crazy time to be a college journalist. It’s challenging, important, necessary work that can sometimes be undervalued because it’s “student produced.” 

But it’s where you’ll get the best, most personalized info. Support collegiate journalism!"
1237885072453197825,2020-03-11 23:36:14+00:00,"Guess is who going to raise your insurance premiums to compensate for the cost of Covid-19. You guessed it, Obama😂"
1237885056548364288,2020-03-11 23:36:10+00:00,"U.S. stocks plunged, ending the longest bull run in history, after the WHO called Covid-19 a pandemic

Asia awaits for U.S. response to WHO Pandemic statement"
1237885050219163654,2020-03-11 23:36:09+00:00,"Kindergarten teacher taking attendance in the year 2030:

David, Emma, Alexa, Bernie, Biden, Vax, Covid, Michael Scott, Tiktok, Emily,"
1237885047572582400,2020-03-11 23:36:08+00:00,The hospital just had an all-staff meeting re: Covid-19 and the infection control RN said “so basically know your holes” in regards to protecting your face and all the gays on staff had to bite their lip
1237885046335234054,2020-03-11 23:36:08+00:00,One thing that is gonna grip the south with panic this spring is gonna be the pollen... imagine... is it the pollen fever or COVID...
1237885032737325064,2020-03-11 23:36:05+00:00,No surprise uncle Joe and Bernie want the debates to be closed. Wouldn’t it be nice to have an option to vote for a president who isn’t in the vulnerable population for COVID-19?
1237885021496553474,2020-03-11 23:36:02+00:00,"#Covid will not kill the #UnitedStates.. its use as a political weapon and of every calamity like it in such a manner, just might. #Unify against #RealThreats. Stop #Misinformation. Help fight the disease."
1237885019198074893,2020-03-11 23:36:02+00:00,"Okay so yes, I am a week behind. 

Yes I know there is bigger things going on like the COVID-19, an election and some bachelor with a crazy mom. 

HOWEVER— I am about to drive my ass to Baldwin City, KS to yell at Alex Karev for making me feel this way. I. CANT. EVEN. 😭"
1237885010788540421,2020-03-11 23:36:00+00:00,"If you survive COVID-19, you'll gain enhanced strength and be eligible for recruitment as an Antifa supersoldier. The Deep State told me so in a letter with my Soros check"
1237885007571582976,2020-03-11 23:35:59+00:00,Just glanced at Facebook and all I can say is after COVID -19 is under control I hope they work on curbing stupidity 🤦🏼‍♀️
1237885004044107776,2020-03-11 23:35:58+00:00,The name should be changed from covid-19 to Cooties!
1237884990202863618,2020-03-11 23:35:55+00:00,"To anyone particularly worried about the recent ""Pandemic"" upgrade of COVID-19.

HIV/AIDS has, and still is, classified as a pandemic. Don't let that classification scare you - we can &amp; will figure out a way of managing this current outbreak, just like we (sorta) have for HIV."
1237884973039759361,2020-03-11 23:35:51+00:00,"Daniele Rugani tested positive for the Corona Virus (Covid 19). Cristiano Ronaldo was celebrating with him just days ago and could be infected.

This means every Instagram model in the world could now be infected. Sad news"
1237884967239086083,2020-03-11 23:35:49+00:00,"COVID-19 thing that nobody’s mentioning: Supermarket today &amp; this one guy was in front of me &amp; he was Touching. Every. Single. Pepper. Dude, they provide bags. Use them to pick things up that aren’t packaged. 
I needed a pepper. I was not pleased. He left before I could speak."
1237884961014726656,2020-03-11 23:35:48+00:00,But how are Pauly D and the gang reacting to covid 19?
1237884944065519616,2020-03-11 23:35:44+00:00,"I had to go to the hospital last night, and imma be honest: Louisiana is not ready for COVID 19"
1237884933185536000,2020-03-11 23:35:41+00:00,"Our NHS is AMAZING and we all need to start appreciating it some more and stop taking it for granted.
To all health care providers doing all they can to help and putting themselves right in the middle of the COVID-19 outbreak we salute you 💚
#supportthenhs"
1237884913073836038,2020-03-11 23:35:36+00:00,"Non-healthcare workers crack me the f up about this covid-19 shit and the need to deplete stock in hand sanitizer and soap. 

Y'all would never last a regular day in nursing. We work in every, sometimes contaminated, bodily fluid you can think of. We deal with c-diff, MRSA, VRE.."
1237884890617491457,2020-03-11 23:35:31+00:00,"Lots of restaurants in Seattle closing for covid-19, some for good :( it's already hard enough to have a smaller business here with the cost of rent"
1237884879787851777,2020-03-11 23:35:28+00:00,"Due to the COVID-19 outbreak and out of an abundance of caution, the 2020 SCMEA rehearsals and concerts scheduled for this weekend have been CANCELLED.  Information will be forthcoming in regard to ticket money refunds.  #BBPSCHOOLS #SCMEA #Disappointed #StayWell #PerformingArts"
1237884878638612483,2020-03-11 23:35:28+00:00,"Has Trump declared covid-19 a national emergency yet, or is that only reserved for when he wants to scare people so he can try to build his silly wall?"
1237884878571450368,2020-03-11 23:35:28+00:00,"Temporarily (maybe permanently??) deleting Twitter. Y'all, I don't need MORE anxiety. Lord. COVID-19 and the election are my whole feed and wowie. Gbye! And that's on hand sanitizer."
1237884877426450433,2020-03-11 23:35:28+00:00,"Long Thread Alert:

I am full of anxiety presently.  As a bartender in the Bay Area, the Covid-19 pandemic has potentially long lasting, drastic effects on myself and my family..."
1237884871109775361,2020-03-11 23:35:26+00:00,"In our first #HKS lecture with @DrMaithri, who recommended us first years to get into #medtwitter. With covid-19 officially a pandemic, these ideas of medical inequality feel super relevant to the health systems we see as crucial to fighting this outbreak."
1237884856220004358,2020-03-11 23:35:23+00:00,"Alex, Val, and I just read the BSU COVID-19 email “popcorn style” around our living room"
1237884854345142273,2020-03-11 23:35:22+00:00,"2020 so far, LFC out of cups, Bernie on the brink of losing, COVID-19 declared a pandemic, what a shit year this has turned out to be so far."
1237884833168146432,2020-03-11 23:35:17+00:00,"A lot of hysteria is driven by the social media era we live in. No, I’m not saying COVID is fake news. Just think the 24/7 media circus can sometimes exaggerate reactions"
1237884833134608384,2020-03-11 23:35:17+00:00,"ITALY

- 196 new coronavirus deaths today, the highest daily toll recorded anywhere in the world (including China) since the start of the outbreak.

- Government orders that all shops close, with the exception of pharmacies and food stores.
#COVID19 #Covid_19 #coronavirus #Corona"
1237884811341004800,2020-03-11 23:35:12+00:00,I Got COVID-19 at Historic Sakura-Con 2020
1237884807377387520,2020-03-11 23:35:11+00:00,So my spring break is now two weeks long lol thanks covid-19
1237884803573112840,2020-03-11 23:35:10+00:00,With Covid-19 getting worse by the day in the Philippines... I’m scared I might be stuck here if we continue our vacation here.
1237884799588528129,2020-03-11 23:35:09+00:00,"Can anyone explain to me why the USA is torturing us with all of this ""non-testing"" for the Covid-19 mess? I'm in Indiana and our state health department says we have 10 confirmed cases with 43 people tested. What? Seriously? #GodHelpUsAll #TestUSANow #PleaseDontLetUsDie"
1237884793007697920,2020-03-11 23:35:08+00:00,"Covid -19?   Oh no, not here. We do fist bumps at F3  🤛😆"
1237884788234571778,2020-03-11 23:35:06+00:00,"With these fiasco and mass hysteria with the COVID-19, I ponder -- what will Olivia (Caroline) Pope do? #OverACliff"
1237884779892105217,2020-03-11 23:35:04+00:00,goodmorning covid-19
1237884776540819459,2020-03-11 23:35:04+00:00,Guyana had covid-19
1237884775999954944,2020-03-11 23:35:04+00:00,COVID-19 YOU DUMB FUCKIN BITCH
1237884764893278209,2020-03-11 23:35:01+00:00,BREAKING: President Michael Crow announces ASU will switch to online instruction over COVID-19 concerns.
1237884760417898500,2020-03-11 23:35:00+00:00,Well i feel all sorts of fucked right now. Found out someone my husband works with has the covid 19. I am immunocompromised and now i might have it. Fuck
1237884760178868225,2020-03-11 23:35:00+00:00,Last debate Biden proposed a DARPA for health.. we already have that tho &amp; COVID-19 is what they came up with..
1237884754411671559,2020-03-11 23:34:58+00:00,"It's not so much of a question of if this will happen anymore, but rather more of a question of exactly when this will happen .#Corona #Covid_19"
1237884753035968513,2020-03-11 23:34:58+00:00,"I find the ""if we were all vegan, there would be no coronavirus"" discourse sickening. Not only does it show zero knowledge of animal and human biology, but it's also insensitive towards the situation that we are all in right now! #Coronavid19 #Covid_19 #coronavirus"
1237884750385176581,2020-03-11 23:34:57+00:00,"Jan 20:First case of Covid-19 reported in the U.S.

Almost 2 months after and still no headway."
1237884748564852737,2020-03-11 23:34:57+00:00,One of my mom's friends is a teacher in Oklahoma and they go on spring break next week. They were told not to come back for the rest of the year. All bc of COVID-19
1237884735424065541,2020-03-11 23:34:54+00:00,"S/O to anyone working in a school right now: you are carrying a lot of anxiety/expectation as you figure out what COVID-19 means for our communities + our kids.There’s no one better equipped than teachers/admins who care abt students to design a kid-centered response.

THANK YOU"
1237884733326913537,2020-03-11 23:34:53+00:00,"this pandemic is blowing up my inbox, noodles and company i did not need a covid-19 update how did you get my email"
1237884728314740742,2020-03-11 23:34:52+00:00,"So it’s been decided that physical contact greetings are a bad idea right? Surely that holds true after COVID-19, it’s not the only virus. Let’s end handshakes, hugs and kiss greetings for good! I’ve always been a fan of the head nod or eyebrow raise myself."
1237884714964275205,2020-03-11 23:34:49+00:00,Everybody going to church tonight to pray away the covid when actually they're helping it spread
1237884714112839681,2020-03-11 23:34:49+00:00,COVID-19 is now a pandemic❗️
1237884696299589633,2020-03-11 23:34:45+00:00,"I see a lot of hate with how this whole covid-19 situation is playing out. It’s not the best method for athletes, but best method for people’s safety."
1237884691211907072,2020-03-11 23:34:43+00:00,"Due to concerns over the spread of COVID-19, the @Big12Conference has made a decision to implement limited access to the #Big12MBB &amp; ##Big12WBB games. Fans will not be allowed to attend the games scheduled for Thursday, 3.12 through Sunday, 3.15. A ticket refund is in process."
1237884683351777282,2020-03-11 23:34:41+00:00,"PSA: Stop raiding Costco’s/other supermarkets water and toilet paper supply like it’s the zombie apocalypse. ITS NOT. Covid-19 is a respiratory infection not the flu. And don’t blame the employees for being sold out. ITS THE CUSTOMERS FAULT! So please, educate yourself."
1237884674707353600,2020-03-11 23:34:39+00:00,"The Covid-19 virus has everyone panicking!NCAA’s March Madness,will be played,without any fans I attendance!MLB(Baseball) starts on 3/26/2020 &amp; they are talking about doing the same thing,no fans!The Players are not going to be to happy about this,minor in the seats,no money!"
1237884659301634048,2020-03-11 23:34:36+00:00,Why dont we simply cancel COVID-19
1237884647331135488,2020-03-11 23:34:33+00:00,I am actually rather worried about this covid-19 now
1237884644445442050,2020-03-11 23:34:32+00:00,It's just Atletico. The Covid-19 of UCL. 😝🙃
1237884644143456259,2020-03-11 23:34:32+00:00,my boomer boss j sent me a chain email containing a pdf of a ppt abt covid-19 for the world congress of SBMY (spine brain and mental disorders) by the society for brain mapping and therapeutics at the LACC this month???
1237884637084450825,2020-03-11 23:34:30+00:00,Radical idea for executive branch obsessed with finding a solution for the economic impact of covid. Focus on fixing the actual public health crisis - it’s literally your lack of focus here that’s making markets terrified.
1237884636690173957,2020-03-11 23:34:30+00:00,"With the recent outbreak of COVID-19 in WA and uncertainty surrounding the spread of the virus, our club gathering for March 18th has been canceled. We apologize for this change in plans but at this point exercising caution is prudent."
1237884633447952390,2020-03-11 23:34:30+00:00,Thank you @GregHuntMP for the announcement of new funding for a COVID-19 test under Medicare. #AustralianPathology is pleased to work in partnership with you &amp; Government to provide highest standards in healthcare &amp; no patient out of pocket costs #coronavirusaustralia #auspol
1237884631489208324,2020-03-11 23:34:29+00:00,"To my @wplainsschools Tigers, I know you are concerned about COVID-19. Please know we will do everything we can to keep you healthy. That’s a promise. We are here for you. #WPProud"
1237884627659845642,2020-03-11 23:34:28+00:00,"Until covid-19 resolve, my mind,soul,mental and body will not get a break.  I didn't choose my job, dang! 

I still keep an eyes on Stray Kids just less interact on twitter. To my lovely moots, please know that I'm still alive."
1237884624518307840,2020-03-11 23:34:27+00:00,"Basically every list I’m subscribed to is sending out COVID updates and how they’re protecting their clients. As a client, would you appreciate that?"
1237884611515912193,2020-03-11 23:34:24+00:00,"Today we did dry runs for our SRR/MDR at the end of the month.  The review is probably going to be entirely by telecon, which is a first for me.  COVID-19 might actually make NASA SRB reviews more efficient, by setting a telepresence standard.  #PI_Daily #PUNCH_SMEX"
1237884611499151362,2020-03-11 23:34:24+00:00,1 of the teachers at a school in the district I teach at cAnt come to work because she was exposed to COVID 19 🤦🏽‍♀️🤦🏽‍♀️
1237884603953598465,2020-03-11 23:34:23+00:00,"Theres a case of COVID-19 in my Parish, great.
(in Louisiana we call counties parishes)"
1237884596533874691,2020-03-11 23:34:21+00:00,"World Health Organization declares COVID-19 a global pandemic!

Soros is a big time contributor to the organization,

think he paid WHO to make this announcement?

I do!"
1237884592226471936,2020-03-11 23:34:20+00:00,"if i have to read one more ""dont worry about covid! it wont kill you! live ur life!"" tweet. i s2g.."
1237884589307097092,2020-03-11 23:34:19+00:00,MIZZOU and LU are literally not going back for the Covid-19 so MAC... do your thing...
1237884579047866373,2020-03-11 23:34:17+00:00,Maybe I’m missing the obvious here but what would be the purpose of announcing in public the names of footballers who have Covid-19? Don’t they deserve privacy?
1237884574232801286,2020-03-11 23:34:15+00:00,covfefe sounds an afwul lot like covid dont u think? 🧐🤨
1237884573670715393,2020-03-11 23:34:15+00:00,"Winter is just total bad vibes, covid 19 wouldnt be this active if my babe summer is about rn 😢"
1237884570386731008,2020-03-11 23:34:15+00:00,"#ATSchat
A3
Intubation is with RSI and should be done with no prior bag valve mask ventilation. We limit moving patients from ICU for procedures. We worry that no NIV imposes a burden on our sick pulm patients who do not have high COVID risk"
1237884569149247488,2020-03-11 23:34:14+00:00,"Netflix lowers the cost of entry in the PH, launches today P149 mobile-only monthly plans. That’s 60% cheaper than their current basic plan.

The COVID-19 angle is that it’s more inexpensive now to get Netflix if stuck at home because of this pandemic. | @miguelrcamusINQ"
1237884545543712771,2020-03-11 23:34:09+00:00,Ableist people Love making jokes about covid-19 is &amp; it’s not a fucking joke to me so fuck off
1237884536962375680,2020-03-11 23:34:07+00:00,"UPDATE
(March 12, 2020)

The WHO had declared that COVID-19 is now on pandemic stage. 

This is due to the fast spread of the virus accross the globe. It has reached 121,564 cases claiming the lives of 4,373.

#COVID2019"
1237884530888978432,2020-03-11 23:34:05+00:00,"I'm pretty low risk for contracting COVID. I mean, I leave my house once, maybe twice a week. But pollen is flying and I am sneezing and my lungs are wheezy. Thinking about calling my doc tomorrow to ask for some albuterol, try to clear the lungs up. Just in case."
1237884527051067392,2020-03-11 23:34:04+00:00,Bernie Bros this is your chance. Boomers are most at risk for COVID-19. Boomers hate Bernie. Threaten them to vote for Bernie or you will not wash your hands.
1237884520831037440,2020-03-11 23:34:03+00:00,"High school boys basketball regionals are this weekend, and there's no way in hell that's going to get cancelled in Indiana, where it's considered sacred, which means a whole lot of rural folks are about to get COVID-19 I guarantee this is how it starts here"
1237884516414324737,2020-03-11 23:34:02+00:00,Been on annual leave since the COVID panic ramped took a peep at my work emails and theres like 40 new ones over the last 2-3 days 💀. Anywhooo I’m still off 😎
1237884509023948805,2020-03-11 23:34:00+00:00,My email is literally flooding with companies telling me what they’re doing for safety/cleanliness because of covid-19 lol
1237884506536923136,2020-03-11 23:33:59+00:00,"If this COVID-19 reaction is really warranted, and the government is trying to prevent spreading before its out of control, why the fuck are schools/government buildings still open??"
1237884495866425350,2020-03-11 23:33:57+00:00,"The breadth of opinions on Covid-19 is really, really interesting to me. My social nets have plenty of folks from both the ""Covid-19 is just the flu / fear is the only thing to fear"" camp and the ""I'm not saying we're all going to die, but we're all going to die"" camp."
1237884493806964737,2020-03-11 23:33:56+00:00,COVID-19 is enough. Dont be a part of another virus called STUPIDITY
1237884492418674688,2020-03-11 23:33:56+00:00,Death Stranding has prepared me to wait out Covid-19 in my home while Norman Readus brings me bulk ceramics and pizzas
1237884470260191233,2020-03-11 23:33:51+00:00,"Stephen Miller and Jared Kushner are writing Trump's COVID-19 speech. 

Miller is talking about putting COVID-19 in a cage while Kushner is working out how to make money on the cages."
