id,date,tweet
1332836668240433158,2020-11-28 23:59:59+00:00,The rigel greys sent this CHASTISEMENT plague covid 19  to their seed the Chinese
1332836659164016640,2020-11-28 23:59:57+00:00,"So let me get this right, the ravens and Steelers game gets pushed from Thursday to Tuesday because of a few cases of Covid, but the Broncos don’t have a single healthy quarterback; but want to continue the game tomorrow. How does this make sense"
1332836643221409792,2020-11-28 23:59:53+00:00,"A lot happened today in the NFL. Ravens add 4 more players to their COVID list, Steelers RB James Conner tests positive, Lions fire HC Matt Patricia, 49ers don’t have a place to play for the next three weeks, and every Broncos QB ruled ineligible against the saints tomorrow."
1332836642290331654,2020-11-28 23:59:53+00:00,I don't know.  I don't think so.  Heaven's Gate.  The Croods.  CNN.  I wonder what they have.  Illegal parties.  Warehouses.  A warehouse shooting.  Police crack down on secret parties flouting covid restrictions.
1332836633754828801,2020-11-28 23:59:51+00:00,"If Covid is THAT serious, why is it so damn hard to get a test? 🤬"
1332836633343832065,2020-11-28 23:59:50+00:00,"Seems small compared to other #49ers news of the day but Saturday roster moves: 

Activated from IR: CB Richard Sherman, RB Raheem Mostert, RB Jeff Wilson Jr. 

Players activated from COVID-19 list: LT Trent Williams, LB Joe Walker"
1332836632618266628,2020-11-28 23:59:50+00:00,"TRUMP has not taken responsibility for the 265000 COVID dead or the 13,000,000 COVID cases. Note: TRUMP lost the election by about 6,000,000 votes. Likely people that got COVID and lived voted against him. He could have won if he paid attention and let SCIENCE RULES dominate!"
1332836631347425280,2020-11-28 23:59:50+00:00,I got off work super early to go watch the fight but I’d rather just stay home. Don’t care to be bothered with him or the Covid that’s probably over there
1332836592348696576,2020-11-28 23:59:41+00:00,"Who in the blue hell would've thought that Gary Bettman, of all people, would do a better job at handling COVID than the NFL."
1332836585142964226,2020-11-28 23:59:39+00:00,tested negative for covid and I’m so happy because my body cannot take that right now 🥳
1332836584572547077,2020-11-28 23:59:39+00:00,Roger Goodelle is nothing but a piece of shit as a commissioner he moves back the ravens and the Steelers game to Tuesday because people test positive Covid but he doesn’t wanna move back the Saints and Denver game what is the difference you the worst commissioner of all sports
1332836578511634434,2020-11-28 23:59:37+00:00,"WR Brandon Aiyuk, DL D.J. Jones and Jordan Willis remain on the COVID-19 list.

DL Alex Barrett is up from the practice squad, along with COVID-19 replacements OL Tony Bergstrom, and DL Darrion Daniels and Willie Henry Jr."
1332836573730267138,2020-11-28 23:59:36+00:00,"6h8r News:
""Another 145 COVID-19 cases were reported in York Saturday. The region has seen a total of 10,453 cases with 1,114 of those being active.""

What's an active case? How many hospitalizations? How many ""covid adjacent"" deaths? How old were they? 80+ with co-morbidities?"
1332836568189587463,2020-11-28 23:59:35+00:00,I DONT HAVE COVID!
1332836563559063552,2020-11-28 23:59:34+00:00,I was supposed to start jiu jitsu in 2020 but this lame ass covid.
1332836562925735937,2020-11-28 23:59:34+00:00,"eyes issues tough, new COVID-19 rules including quarantines for some #fakeheadlinebot #learntocode #makeatwitterbot #javascript"
1332836562418036737,2020-11-28 23:59:34+00:00,"Tested positive for covid for the 3rd time. I am so lonely. It’s been a month now. I am not feeling to badly, so that’s a good thing."
1332836562309156865,2020-11-28 23:59:34+00:00,"Okay... So the #Ravens have Covid cases, the game gets postponed. If the #Broncos get Covid cases, they have to play with a WR being the starting QB? Your bias is so blatant, Roger Goodell."
1332836558152589314,2020-11-28 23:59:33+00:00,"I still believe the only way you can get Covid is when a gypsy you've done dirty rubs your cheek and says ""Covider"""
1332836551567486979,2020-11-28 23:59:31+00:00,I don't follow how you can postpone one NFL game with many instances of Covid but not another where they themselves ruled the QBs ineligible.  Someone explain this?
1332836546882498561,2020-11-28 23:59:30+00:00,"Post covid thanksgiving food review:

YOUR SHIT BLAND."
1332836546131623936,2020-11-28 23:59:30+00:00,"My cousin tested positive. Her husband now has symptoms. Their older daughter is trapped alone in her apartment, their younger daughter is with them trying to isolate in their home. This morning we had a munazat for their brother-in-law in B'desh who passed from Covid."
1332836542554001408,2020-11-28 23:59:29+00:00,I hate Purdue. But I hate Covid (fake flu) more. And I hate targeting even more. What a fucking horrible rule. The Purdue kid tackled a guy.
1332836541530517511,2020-11-28 23:59:29+00:00,If COVID doesn’t kill me hua chengs sexy ass will
1332836533640937475,2020-11-28 23:59:27+00:00,Not to be insensitive but I kinda enjoy the added degree of difficulty that covid adds to fantasy football.
1332836533242617859,2020-11-28 23:59:27+00:00,some lady i use to work with posting how masks don’t work and covid is a hoax .... and then she’s selling custom masks ? i hate some people
1332836513705443328,2020-11-28 23:59:22+00:00,The #49ers activated LT Trent Williams and LB Joe Walker off the reserve/COVID-19 list. SF lists both players as questionable to face the L.A. Rams on Sunday in Week 12.
1332836505690238977,2020-11-28 23:59:20+00:00,"Each hour another 50 people die from covid in America.

We're taking the term of ""home of the brave"" way too fucking far. 

#COVIDIOTS"
1332836504570302468,2020-11-28 23:59:20+00:00,I would love to see another season of The League with all this crazy covid shit going on in football.
1332836494696964097,2020-11-28 23:59:17+00:00,"The scientific research have successfully succeed to made the VACCINES against Covid-19.
I have appreciated the incredibles works that they are doing for save the World.
I thank Moderna Pfizer, Astrazeneca and spoutnik V for producing the vaccines very efficacy"
1332836490813071372,2020-11-28 23:59:16+00:00,getting covid has literally made everything I eat smell and taste like rotting meat to the point where thinking about food makes me nauseous now
1332836488992710656,2020-11-28 23:59:16+00:00,The Covid19 virus has hit our household...could I please get prayers for my husband and I along with our adult son? I’m a little weirded out right now as I recently lost my mom to covid. Thank you! @RadioRosary @DrewMarianiShow #CatholicTwitter #Pray #covid19
1332836487164030976,2020-11-28 23:59:16+00:00,Covid has me bored. Who wants to go travel the world when this shits over? Not made to be nailed down
1332836482265063426,2020-11-28 23:59:14+00:00,A Christmas Carol was published in 1843. Tiny Tim tested positive for COVID -177  #COVID  #HolidaySeason
1332836479920340992,2020-11-28 23:59:14+00:00,Bro so I got a week off from work bc I literally be around people at work that had covid so I was not gonna risk it so they petty asses gave me the whole month off 🙃😂 ion go back until dec 15 🤣🤦🏽‍♀️
1332836476657262593,2020-11-28 23:59:13+00:00,Covid taken out depth charts
1332836457162092544,2020-11-28 23:59:08+00:00,Denver Broncos really lost all 4 quarterbacks to COVID protocols . Wild .
1332836451336155136,2020-11-28 23:59:07+00:00,"Some good news for the #49ers: T Trent Williams and LB Joe Walker were taken off the COVID list, making them available for Sunday's game. Brandon Aiyuk, D.J. Jones, Jordan Willis and Daniel Helm (psquad) NOT activated, which means they will not be available."
1332836441202814976,2020-11-28 23:59:05+00:00,"The NFL is amazing in the bad way. NCAA isn’t much better. Maybe seeing the football season implode is more compelling to the COVID deniers than hospitals being overrun. 

Or folks really want to see John Elway as a cyborg QB?"
1332836436790358016,2020-11-28 23:59:04+00:00,"My neighbors probably think I have Covid-19 , whole time I’m just a stoner."
1332836429769084930,2020-11-28 23:59:02+00:00,I just read replies to a typically ignorant @BobLonsberry tweet. People were claiming that the COVID-19 mortality rate was around 1%. That simply is not true. The mortality rate is actually greater than 5%. Even if you survive you may end up with life altering organ damage.
1332836396332175360,2020-11-28 23:58:54+00:00,"I'm sorry, was a U.S. Senator just supposed to blow the whistle on something as huge as ""covid"" before it was public knowledge and lose everything, possibly even her life? That's ludicrous. Y'all are childish."
1332836389893890050,2020-11-28 23:58:52+00:00,I have yet to see a professional sports team get dragged like the Marlins did for having COVID outbreaks.
1332836378246217729,2020-11-28 23:58:50+00:00,My friend is still having her wedding in Vegas in &lt;2 weeks. I'm not going for obvious reasons. A guest just posted how excited they are to attend. They are coming from Rio de Janeiro and have an insta account full of party photos/videos with comments that COVID isn't real 😳
1332836367345340417,2020-11-28 23:58:47+00:00,COVID goin stupid gon head drop that playoff schedule wrap this thing up @NFL
1332836362547056642,2020-11-28 23:58:46+00:00,"could the covid app be used to determine priority for being vaccinated, vaccinate those with most close contacts earlier, to help reduce spread and break the chain?   #Vaccination"
1332836360269541377,2020-11-28 23:58:45+00:00,There probably are facebook groups for long haul survivors with COVID 19.
1332836353344634880,2020-11-28 23:58:44+00:00,"wakes uo in a cold sweat

stack kill  is the @AmongUsGame version of covid and they want us to keep a healthy distance from everyone else 👁👁"
1332836344322805767,2020-11-28 23:58:42+00:00,"All Broncos rostered QBs are ineligible to play on Sunday due to COVID-19 exposure, however the team won’t forfeit - @AdamSchefter"
1332836339440611328,2020-11-28 23:58:40+00:00,"Curious .. the globe and mail says they do not like a bbq chef making policy on covid. But they support the current minister of health, Hajdu, an interior designer. What makes her more qualified? Just asking? Chef, designer, drama teacher?? What the difference?"
1332836332880748546,2020-11-28 23:58:39+00:00,"February: I hope I don't get covid so I don't die!

June: I hope I don't get covid and spread it to someone vulnerable!

November: I hope hospitals have room for me in case literally any health emergency happens..."
1332836328325722115,2020-11-28 23:58:38+00:00,My mom is so annoying how can someone HAVE covid and still doubt it 💀💀💀💀💀
1332836309916901378,2020-11-28 23:58:33+00:00,the NFL is 100% dropping the ball with covid.
1332836308067217409,2020-11-28 23:58:33+00:00,"Can Dems just promise that if they win the Senate with GA they’ll pay every American under a certain income to stay home until COVID is under control?

Clear, simple relief seems like a hell of a good election message, no?"
1332836279604682753,2020-11-28 23:58:26+00:00,So can the Jets trade Darnold to the Denver by tomorrow? Some sort of covid exception.
1332836276563750913,2020-11-28 23:58:25+00:00,"When multiple nurses tell you covid is bullshit, it's bullshit #scamdemic #plandemic #covid1984"
1332836272029786115,2020-11-28 23:58:24+00:00,It’s disgusting how much money the NFL and college football are spending to keep the league afloat and what dangers they are putting people in. This money could be spent helping the communities suffering the most from COVID. I have feelings about this.
1332836266686222342,2020-11-28 23:58:23+00:00,"Mickey Mouse on extended leave:
Large California theme parks such as Disneyland and Disney California Adventure remain closed and are unlikely to return to full operation until early 2021 or next summer under COVID-19 health and safety reopening guidelines issued by the state."
1332836253843288065,2020-11-28 23:58:20+00:00,"Ravens have 18 players on covid reserve, Broncos don't have a QB that can play due to covid/close contacts, and the Niners are ban from their facility for 3 weeks 🥴 how much longer the season gonna go on?"
1332836253566345216,2020-11-28 23:58:20+00:00,I love all the advice I get from my parents and titas/Titos on how to manage covid
1332836251360137216,2020-11-28 23:58:19+00:00,"#SuperSpreaderSaturday
#SuperspreaderEvent in - you guess it- Alberta where the Covid crisis is already way more than their feckless premier and conservative government can handle. 

The treasonous ones are the haters with their intelligence-insulting “Trudeau blah blah blah”"
1332836241348329473,2020-11-28 23:58:17+00:00,"Crazy how the @NFL will reschedule for the @Ravens when @Lj_era8 is out with #COVID but when the @Broncos do not have a single QB on roster, they do not accommodate. Hypocrisy at its finest."
1332836231990841344,2020-11-28 23:58:15+00:00,"With all of the @Broncos QBs out on COVID-19 risk, I suggest the league institute a pool of Veteran Qbs who can sent to any team without any active QBs on the roster on any week. And of course would be aptly named the ""Josh McCown"" rule. @BrettKollmann @thedraftsmanFB @minakimes"
1332836220167217153,2020-11-28 23:58:12+00:00,"My dear fellow Americans,
Please stay the f#ck home!!!!
Don't you realize there's a PANDEMIC out there?!?
Show some respect for your fellow citizens!!!
STAY HOME!  It won't kill you!  But Covid-19 might!
SOCIAL DISTANCE is the key!"
1332836218086764544,2020-11-28 23:58:11+00:00,If it weren’t for COVID I would’ve seen my brother score his first College TD live 🤦🏾‍♂️
1332836208490278915,2020-11-28 23:58:09+00:00,I been back here since the end of April &amp; never went out smh I miss my friends. Only linked up with them once since I been back. This covid shit irritating
1332836203293380610,2020-11-28 23:58:08+00:00,I would never recommend flying on a holiday during covid while pregnant. Surprising my parents &amp; spending time with my family was worth everything 🥺😭 #judgeme
1332836203276582912,2020-11-28 23:58:08+00:00,I complained about working during covid but now that I’ve had three days off I’m even more depressed
1332836195932336128,2020-11-28 23:58:06+00:00,"Thank you @KNTV, @SFSymphony, and Michael Morgan for televising the Bay Area Blue Notes episode.  Much more interesting than watching #Saturday Football.  I wish stations would broadcast more arts and music, esp. during the #covid lockdown.  Much appreciated! 🎼🎶🎷"
1332836188395286529,2020-11-28 23:58:04+00:00,Bruh... they said every QB on Denver Broncos team is ineligible to play due to risk of Covid 😐
1332836187837493251,2020-11-28 23:58:04+00:00,If Nate Robinson beats jake Paul covid ends immediately
1332836187195793415,2020-11-28 23:58:04+00:00,People are so selfish during this pandemic. Like yes I understand you wanna go out and have the world be normal. But it’s not. Hospitals are becoming overwhelmed with covid patients. People are spreading it without regard to who they might kill. It’s not hard stay home. Mask up.
1332836186767958016,2020-11-28 23:58:04+00:00,I don't go back to school until December 14th due to another 2 kids in my class having covid. Thank you school system for not being retarded for once
1332836182829494276,2020-11-28 23:58:03+00:00,Broncos need to sign Kap and get him a rpid covid test
1332836176651116544,2020-11-28 23:58:02+00:00,"if i see an adam schefter weekly ""no positive covid tests this morning, game on"" tweet tomorrow i will lose it lmao"
1332836169894211584,2020-11-28 23:58:00+00:00,Told the girls that since we have shielded granny &amp; grandma all year we would continue at Xmas. It didn’t go down well. I now feel rubbish especially since none of their friends are doing that with their grandparents. Cheers COVID. Please someone say they are doing the same as us
1332836164420702208,2020-11-28 23:57:59+00:00,"Looking at the crowd in this Eggbowl game, I'm guessing there's no Covid in Mississippi."
1332836141540601856,2020-11-28 23:57:53+00:00,This covid shit is sooo annoying lol it’s like an ambulance truck that never goes away
1332836140177616897,2020-11-28 23:57:53+00:00,"Am I the only one who almost likes the way covid has made everyone freak out... Because so many people are like AHH I don't know what's going to happen and everything is so stressful and scary!! And I'm like yeah, that's how I feel all the time?"
1332836126864896000,2020-11-28 23:57:50+00:00,"Imagine testing everyone in companies, schools and on sports teams for the flu every week? Of course people get sick. Covid is a real virus but it’s been used as a weapon. We need to push through and not be told what to do. More people are dying due to being trapped and alone."
1332836119214501891,2020-11-28 23:57:48+00:00,If you’re a lump and struggling to find work after COVID I suggest you join a boxing gym. After watching that performance I reckon you could be a contender in a couple of months
1332836103431335940,2020-11-28 23:57:44+00:00,Covid is such a prude.
1332836103045439489,2020-11-28 23:57:44+00:00,"I know we’re all worn out &amp; fucking tired of this pandemic...but my friend who’s mid30s &amp; had no health conditions has had COVID since March, and trust me, wearing masks &amp; social distancing is way better than the hell they’re going through. Do it. Save yourself &amp; others from it"
1332836102667812867,2020-11-28 23:57:44+00:00,Visiting the ER with my 1 year old on the same day as our new record # Covid cases was rather anxiety provoking. (He’s ok but put his bottom row of teeth completely through his bottom lip) 😢
1332836098242871296,2020-11-28 23:57:43+00:00,AB has 704 ICU beds.  Currently 88 occupied. Of the 88 how many are strickly covid related no other issues?
1332836096632385536,2020-11-28 23:57:42+00:00,I made the mistake of telling Mike I have a fucking cold and he’s having a full fledged meltdown because he’s convinced I have COVID. I hate 2020
1332836090877595648,2020-11-28 23:57:41+00:00,The @NFL is a joke. Lamar gets Covid and they postpone the game twice yet when all of the @Broncos QB’s get exposed and are ineligible to play we have to go out there and start our 3rd string RB at QB...
1332836082652737536,2020-11-28 23:57:39+00:00,My healthy 76 year old grandad (no underlying health conditions) was admitted to a covid ward today. Honestly cannot explain how this feels. I want things back to ‘normal’ as much as you but please think about others and wear a mask/keep your distance especially from the elderly.
1332836080370913291,2020-11-28 23:57:39+00:00,COVID bout to win NFL Comeback Player of the Year.
1332836079053975552,2020-11-28 23:57:38+00:00,Every @Broncos QB is out for Sunday because of COVID. All four of them. Are we still pretending the NFL will have a full season?
1332836077502083072,2020-11-28 23:57:38+00:00,if i get covid i am blaming it on my mom
1332836059957383169,2020-11-28 23:57:34+00:00,I wanna sign up for MMA so bad I wish Covid-19 would hurry up and go away I can't be bothered with bringing something home to me family especially considering their age.
1332836049278693377,2020-11-28 23:57:31+00:00,Me and my man realized we had COVID when we couldn’t smell the weed 🤣🤣🤣😭😭😭
1332836048590745607,2020-11-28 23:57:31+00:00,Gus Malzahn prolly hoping for some Covid-19 contract tracing probs  so he can’t catch 2 more L’s in the last 2 games this Season #AUBvsBAMA #IronBowl #WDE
1332836045906382855,2020-11-28 23:57:30+00:00,Driving through a major city during covid is kinda like a drunk girl at a frat party: lights on but nobody is home
1332836040042745858,2020-11-28 23:57:29+00:00,"When your recovering from Covid, you must return to your favorites; @donald_faison , @zachbraff , and @VDOOZER with @scrubs and throw in @alanalda with some M.A.S.H.! GREAT WRITING, GREAT HUMOR, and Wonderful Stories! I rather cough from laughter #COVID #covidrecovery"
1332836036636971008,2020-11-28 23:57:28+00:00,The two Broncos coaches tasked with getting something out of the quarterback position with no quarterbacks available Sunday against the Saints due to COVID-19 protocols: OC Pat Shurmur and QB coach Mike Shula. #NYGiants
1332836026318991361,2020-11-28 23:57:26+00:00,"COVID-19: Refusal to take precautions 

We ordered food and NO ONE who works there was wearing a mask. I asked the owner why. She said, “We just don’t feel comfortable wearing masks!”  #TokyoRestaurantMooresvilleNC #TokyoJapaneseSeafordRestaurant

#OrderCanceled  #Goodbye"
1332836022309281792,2020-11-28 23:57:25+00:00,Don’t even like leaving the house anymore thanks a lot covid
1332836019259854848,2020-11-28 23:57:24+00:00,"Having flashbacks to the Las Vegas Hilton Star Trek Experience, when the voice of Worf declared ""YOU HAVE ACTED WITH HONOR"" right before the urinal flushed.

@edzitron had a much worse experience there as a young dumbass. If we could rebuild that, Vegas has hope after COVID."
1332836019159379970,2020-11-28 23:57:24+00:00,not me getting my period and finding out i’m covid positive in the same day 😩 this is evil
1332836010246463490,2020-11-28 23:57:22+00:00,"If I had a wish then it would be for God to care for all and help us find our ways. We each have a story, I don't believe its straight forward as good / bad. Sometimes it takes a big force like Covid-19 to see we have common enemy. Stay safe all. If I was lost I would go church."
1332836008677822466,2020-11-28 23:57:22+00:00,"PS5 really doing its part to hold these covid relationships down, huh 🎮"
1332835999085260800,2020-11-28 23:57:19+00:00,I def get social anxiety now because of covid lol
1332835984740929536,2020-11-28 23:57:16+00:00,I’ve lost 10 pounds since getting covid 🙃
1332835979413966850,2020-11-28 23:57:15+00:00,"So newton goes on covid list game postponed 2 weeks...@Broncos loose all 4 qb’s, see ya sunday? Seems a bit one sided? Huh"
1332835966101323777,2020-11-28 23:57:11+00:00,"Things turn really bad in Mile High. #BroncosCountry are gonna be without any of their QB come Sunday in their matchup vs #Saints. 

Jeff Driskel tested positive for COVID-19. Drew Lock, Brett Rypien, and Blake Bortles were deemed close contacts. (Per @AdamSchefter) 🏈"
1332835939677315073,2020-11-28 23:57:05+00:00,Tell me why people thought it was okay to ignore the fact that COVID is still a thing just for some turkey. My ass was the only one wearing a mask and disinfecting things around me at Thanksgiving
1332835939253694464,2020-11-28 23:57:05+00:00,haha aunt lost her sense of smell this morning so grandma went and got tested and it came back covid positive and little sis was hanging out with them for the past 3 days HAHA!! SO FUNNY HAHA GLAD Y'ALL WANTED TO DO FAMILY STUFF LIKE THIS HAHA
1332835932655865858,2020-11-28 23:57:03+00:00,"NBA is going to be a year of coaching and depth this year, more so than any other. 

Teams are gonna be down 5 players some nights due to Covid."
1332835928637730816,2020-11-28 23:57:02+00:00,"And still, people are too dumb to educate themselves on the covid stats. CASES DO NOT MATTER. The death rate without co-morbidity does. Hospitals are not over crowded. How did society become some dumb? Good job to the Calgary Freedom protestors. #Calgary #Covid19AB #COVID19AB"
1332835920744247296,2020-11-28 23:57:01+00:00,"I want to do a thread about how angry I am about how my family’s total dismissal of the pandemic has led to my grandmother being hospitalized with COVID-19, but I’m scared it’ll get back to my stepmom and somehow it’ll affect my relationship with my siblings."
1332835912649207809,2020-11-28 23:56:59+00:00,Also y'all are crazy for wanting weekend days off there are toooooo many people out and about and doing fun things on a Monday is better without 1 million people (even before covid)
1332835908031107072,2020-11-28 23:56:58+00:00,"The United States has now recorded more than 13M COVID cases just 6 days after the country read 12M infections. That's a million within 6 days. 264,000 Americans have been killed by COVID-19.(BBC)
#globalnews #worldnews #海外ニュース #国際ニュース #英語表現 #英単語"
1332835897369387017,2020-11-28 23:56:55+00:00,My second cousin is in the ICU with covid and my family is finally realizing it could get ANYBODY
1332835891056881664,2020-11-28 23:56:53+00:00,"I never tweet this shit but between the death of a family member, putting my grandma in a nursing home, a positive COVID test in my family...... I’m going through it. Send me good vibes 🥺"
1332835869410037760,2020-11-28 23:56:48+00:00,COVID spun the block on niggas like the second half of Dreams and Nightmares.
1332835854327242753,2020-11-28 23:56:45+00:00,"I’ve seen masks wore below the nose quite often, but today was the first where just his nose was covered. 10months on... 😐#covid"
1332835849596067840,2020-11-28 23:56:44+00:00,"Per @SuperBookSports John Murray (@vegasmurray) on whether Saints-Broncos will go back on board, even if Broncos start someone other than a QB at QB: ""We will get a line up. Just need more clarity on what Broncos are gonna do."" Denver has no QBs available due to COVID.
@Covers"
1332835845569736705,2020-11-28 23:56:43+00:00,I find it amazing that 18-22 year old college athletes can handle the covid situation better then grown ass men in the NFL
1332835838317748224,2020-11-28 23:56:41+00:00,I wish COVID didn’t exist Covid can burn to hell sry for using the h word I’m just sick of Covid
