id,date,tweet
1237887387851620362,2020-03-11 23:45:26+00:00,"pretty zoinked right now

bc of covid-19, for the next 2 weeks my parents are not allowing anyone inside or outside of this house for any reason except for getting groceries

so uh, no social interaction from me for the next 2 weeks i guess
i'm gonna go take a nap i hate it here"
1237887378380840962,2020-03-11 23:45:24+00:00,"One thing the COVID-19 pandemic is revealing;

90% of people do not need to go into the office. People have been forced to waste of tons of time, money, and energy in the name of control.

Seriously, most people's office jobs can be done in pajamas on the couch without any diff."
1237887375876882434,2020-03-11 23:45:23+00:00,The one thing I always look forward to in march just got canceled for this year due to the covid-19... 😪 I was looking forward to this years too..
1237887330599325703,2020-03-11 23:45:13+00:00,"Fuck COVID-19 for happening my last semester of senior year. Should’ve happened like my freshman year, or like, any other time than now..."
1237887328397357057,2020-03-11 23:45:12+00:00,Crazy. . . aint heard nothing bout any big 3 stalling any factory production b/c of covid-19
1237887323670335489,2020-03-11 23:45:11+00:00,"Casual employees self isolating or unwell with COVID can claim the sickness payment (Newstart level). Will waive waiting period but not asset test. 
Didn’t say how to access it if stick at home

Name of sickness payment in process of name change to job seeking payment"
1237887321862582272,2020-03-11 23:45:11+00:00,"Oh boy this one covid don jam my ends , gym make sense?"
1237887320885325824,2020-03-11 23:45:10+00:00,"The way Covid-19 is being treated by the White House  is reminding me of the USSR...all the downplaying, avoidance, and misinformation...feels like the leadership is trying to protect their image rather than their people."
1237887308931592193,2020-03-11 23:45:07+00:00,Had a dream last night that I was praying for cure of covid-19. It's really that serious
1237887305542557696,2020-03-11 23:45:07+00:00,lol so the worst covid-19 can do is kill me? oOoOoOo so scared
1237887299662352384,2020-03-11 23:45:05+00:00,"Trump’s advice for America concerning Covid-19 tonight will be “ do as I do, play more golf”"
1237887295497203712,2020-03-11 23:45:04+00:00,people be making joke about COVID “untag naay ma infect aron graduate nata dayon.” like wtf? pag tuon oy atay bogo
1237887289239293957,2020-03-11 23:45:03+00:00,I never thought I'd say anything negative about masks but here it is. A mask won't save you from Covid 19. Only the #JackalopeDynasty can save you. Watch this space.
1237887276580892679,2020-03-11 23:45:00+00:00,"This COVID-19 shit is getting pretty serious. Not saying we should panic, but if you're not paying attention, you should be."
1237887273753960449,2020-03-11 23:44:59+00:00,COVID-19: fuck them fans
1237887273170948096,2020-03-11 23:44:59+00:00,Australia just announced a $17 billion stimulus package to cope with COVID
1237887271908581376,2020-03-11 23:44:59+00:00,I hope I get covid-19 I’ll take one for the team so my homies can get out of school
1237887200332677122,2020-03-11 23:44:42+00:00,My state Louisiana has gone from 1 to 13 COVID-19 cases in 3 days.
1237887195433689088,2020-03-11 23:44:40+00:00,Can't believe U.K. Parliament had a meeting for budget when their health minister is infected with covid-19. No life is sacred in a world ruled by money 😤
1237887179428220928,2020-03-11 23:44:37+00:00,"Presidential Spokesperson Salvador Panelo on Covid-19: The Palace confirms that President Rodrigo Roa Duterte (PRRD), together with Senator Christopher Lawrence ""Bong"" T. Go, will have themselves tested for Covid-19. @pnagovph"
1237887149875159041,2020-03-11 23:44:30+00:00,"Folks are criticizing responses to COVID-19 as being too extreme, especially in education. They're not extreme enough, and we're probably weeks too late for some of what we're doing. Shut it down."
1237887126248677377,2020-03-11 23:44:24+00:00,"Yet another weekend in the hospital with lungs and a heart that won't behave.  Half hoping I'd get COVID-19 and get this dance with death over with.  Alas, they old me I wouldn't die today or, likely,  tomorrow, so they sent me home to enjoy pondering my mortality."
1237887113992888320,2020-03-11 23:44:21+00:00,"#newsnight Maitlis waxing lyrical about Tory Budget, this slight of hand fools no one:
10yrs of Austerity has left us all vulnerable to Covid-19 
Not enough critical care Beds
Cost for Care of the most vulnerable placed on Councils, not Central Government, meaning increased CTax"
1237887103306006528,2020-03-11 23:44:18+00:00,Girl w Elizabeth Warren tote lecturing me on how COVID disproportionately affects poor people 😐 ma’am tell that to your homegirl 😐😐
1237887101808422916,2020-03-11 23:44:18+00:00,covid-19 is going to inconvenience me and I’m mad about it
1237887094929817601,2020-03-11 23:44:16+00:00,"When I see @CitizenKBA in panic mode over this covid-19 hype, then I'll know we have a REAL PROBLEM! Till then, everyone chill the fuck out."
1237887074948108291,2020-03-11 23:44:12+00:00,"It's going to be pretty stupid IF we're able to stem the spread of COVID-19 because of all the closings going on and all the 'overreaction' naysayers will come out of the woodwork and be like see we told ya so, nothing bad happened! 🙄"
1237887071831740429,2020-03-11 23:44:11+00:00,"I'm slightly nervous about going out of the house, but that applies even without COVID-19, so..."
1237887066580471809,2020-03-11 23:44:10+00:00,"""Heard a rumor that UT Med Center had their first COVID-19 case on Monday.""
-2020"
1237887061526364160,2020-03-11 23:44:08+00:00,I need to buy bottled water but everyone at the store will judge me thinking I’m paranoid about COVID but in actuality I really do only drink bottled water. None of this “from the tap” shit.
1237887058347208704,2020-03-11 23:44:08+00:00,I’m so salt. UTSA switches to online classes due to COVID-19. Where was this when I had to drop due to a medical emergency literally 2 weeks ago 🙃
1237887054152781825,2020-03-11 23:44:07+00:00,Yesterday there were 0 cases of COVID-19 in my county and we just got the first two. When people said Stanislaus? Where is that? They were NOT joking lmao
1237887054056263681,2020-03-11 23:44:07+00:00,How long till some indie runs a show with a Covid-19 inspired name? Or have I already missed the boat?
1237887049719373825,2020-03-11 23:44:06+00:00,"I've heard people scoff at a projected 2% mortality rate of COVID-19 (WHO actually projects 3.4%).

Let's put that 2% into perspective:

2% of the US population of ~320M = 6.4M

2% of the world population of ~8B = 160M

2% of the number of US Swine Flu infections (61M) = 1.22M"
1237887033147711488,2020-03-11 23:44:02+00:00,"Dang, the meme is real. People really be panic shopping due to Covid-19. Specifically in toilet paper. Kind of unnerving seeing it happen where I live which is Nevada."
1237887029616062470,2020-03-11 23:44:01+00:00,"I know many people think this COVID-19 is overblown and no big deal, I also know most of them have yet to be impacted by it. THAT is about to change."
1237887027627954177,2020-03-11 23:44:00+00:00,"Plot twist corona virus evolves into COVID-500 , everybody that gets infected at this stage turns into Zombies. 😱"
1237887023815389187,2020-03-11 23:43:59+00:00,"Playing behind closed doors is the prudent measure for the PL to adopt given the current COVID situation, but the lack of atmosphere will be palpable. Except at the Etihad, where it’s the norm"
1237887016022368257,2020-03-11 23:43:58+00:00,COVID-19 is reportedly at 10 confirmed cases in MD. Stay clean gamers. And stay away from me.
1237887014235541505,2020-03-11 23:43:57+00:00,"Coronavirus is spreading minute by minute like a wildfire and the world is now officially facing a pandemic. While there is no vaccine for COVID-19, preventive steps and awareness are the best tools to prepare and protect."
1237887006258028544,2020-03-11 23:43:55+00:00,"Can the covid-19 virus be transmitted in second hand smoke, because lung cancer was caused by second hand smoke?"
1237887004819349504,2020-03-11 23:43:55+00:00,"Alright I’m done with my COVID-19 vent,  hope y’all stay safe in these streets 😂😅"
1237886995738685447,2020-03-11 23:43:53+00:00,"Colleges are already going home but Princeton is keeping us for midterms!
Meanwhile we can’t get tested for COVID-19
We’re really out here taking the wrong tests"
1237886982631510019,2020-03-11 23:43:50+00:00,my tita is circulating this “algorithm for triage of patients with posdible covid-19” from DOH and im just like WHAT DOES THIS MEAN
1237886981528420359,2020-03-11 23:43:49+00:00,"I guess I can tell my future kids that I graduated college the same year everyone got the Corona Virus, and that they also missed an opportunity to call it COVID-20."
1237886966621847553,2020-03-11 23:43:46+00:00,"Sheesh, just because I’m not living my life in fear, doesn’t mean I’m not taking precautions against COVID. You ppl are kinda weird sometimes... I got enough to worry about, if I catch it then I catch it. Then I get treated and go from there. Not much I can do other than that."
1237886951501545472,2020-03-11 23:43:42+00:00,so um... a delivery driver at my work today gave someone their shopping who was covid-19+ and well um.... it was nice knowing y’all.
1237886942399705090,2020-03-11 23:43:40+00:00,"There isn't going to be a US election this year... Maybe never again. Drumpf will manipulate the spread of Covid-19 so it peaks a couple of months before, then supported by a Republican Senate he'll declare an emergency &amp; cancel 2020. He'll destroy the country enough..."
1237886941888045057,2020-03-11 23:43:40+00:00,ok can covid-19 chill in st. joseph until friday. i'm planning on dressing decently tomorrow so i kind of need my moment
1237886937974722566,2020-03-11 23:43:39+00:00,Two concerts on my calendar were cancelled today due to Covid-19. This is starting to piss me off.
1237886936095678464,2020-03-11 23:43:39+00:00,"A break from our incompetent POTUS, COVID-19 news, and worries about my beloved parents in their 80’s. Detectorists on Amazon is funny, gentle, beautifully shot, and British. Also years old, but I’m a late adopter. Perfect antidote to social isolation."
1237886935433003010,2020-03-11 23:43:38+00:00,"So, one of our famous books, blindness by Saramago, describes a population in panic when an epidemic strikes... With all the human values being thrown away... This was written in 1995, and if I look for the covid-19 in the Portuguese population I can see this in some cases ...."
1237886927690289152,2020-03-11 23:43:37+00:00,"THE #APOCALYPSE IS HERE! It includes the Second Coming, (Christ), beginning in 1998; Climate Change; the destruction of the 8th World Empire (consisting of the USA, UK, EU, NATO, Canada, and Australia); SARS, H1N1, Covid-19; Ebola; a new age, a new era. Dan. 2:32-45."
1237886925656092672,2020-03-11 23:43:36+00:00,"My co-founder @dremilyanhalt came up with the brilliant idea to host an online discussion on the psychological impact of working remote and feeling isolated during Covid-19. 

We have 10 spots available to keep the discussion intimate. Who wants to join?"
1237886905435459584,2020-03-11 23:43:31+00:00,Will @PokemonGoApp be releasing a new Covid-19 themed Pokémon?
1237886904302854144,2020-03-11 23:43:31+00:00,"Has anyone else noticed a trickle down effect in emails regarding Covid-19 ?

At first emails from NIH/CDC, then the University. Last week our local officials and the public library updated me on how it’s responding.

Today I got an email from my waxing salon. About Covid-19. 👀"
1237886895436132361,2020-03-11 23:43:29+00:00,"Notes for a long-form pitch / dissertation called ""Love in the Time of the Coronavirus"":
- Is cuffing season year-round now?
- Is co-quarantining the new co-residing?
- Is the 3-date rule for handshakes now?
- Will the most popular quarantine baby boom name be Wuhan or Covid?"
1237886880374390784,2020-03-11 23:43:25+00:00,"One thing I will say about EU Standards. British infection of Covid-19 is slower than in Europe. We have no market rules on face masks, we are being given no advice other than to wash our hands with soap for twenty seconds. We manage ten and Macron and Merkel should get this."
1237886878096871426,2020-03-11 23:43:25+00:00,"lol apparently professors at my school actually have covid but the president sent out an email saying that there are no cases
okay."
1237886859499278337,2020-03-11 23:43:20+00:00,Nashville State Community College has confirmed a student from their East Davidson and Southeast campuses has COVID-19. The school is currently on spring break.
1237886851119104000,2020-03-11 23:43:18+00:00,"#Update 

 Juventus defender Daniele Rugani has tested positive for coronavirus, the Serie A club said on Wednesday (March 11).

""The footballer, Daniele Rugani, has tested positive for Coronavirus-Covid-19 and is currently asymptomatic,"" Juve said in a statement."
1237886844315959298,2020-03-11 23:43:17+00:00,"I am so worried about covid in Malaysia. Please guys avoid mass gatherings, less body contact with others. Don't be selfish. Be alert to the latest announcement and to those who are being summoned go check yourself!"
1237886827538735104,2020-03-11 23:43:13+00:00,lrt for the last time the US government and medical network has a vested interest in ppl potentially with COVID-19 NOT getting tested. the government is acting like if they dont show up as positive they basically dont exist
1237886824355229697,2020-03-11 23:43:12+00:00,"Let’s take the 350 million a week we have saved doing fuck all about COVID-19 and send it to rich people 

#Budget2020"
1237886823650607106,2020-03-11 23:43:12+00:00,"i took an exam in abnormal today, and as i was handing it in, my professor goes “deeeeep breaths, mya” because we were talking about covid-19 before the test and she saw that i was freaking out. she’s literally my college mom. i ❤️ u professor ferri!!!"
1237886815480057858,2020-03-11 23:43:10+00:00,"Breaking: In response to COVID-19, Alabama Football has transitioned from cash handoffs to direct wire transfers for all recruits. All inquiries can be directed to the Red Elephant Club."
1237886801437589506,2020-03-11 23:43:06+00:00,My really dumb roommate went on a European vacation during this virus outbreak and is there now where she posted a picture of herself stating she kissed the Blarney stone. See y'all in the next life when she breaks back that COVID-19 and gets us all
1237886792386220036,2020-03-11 23:43:04+00:00,"Think of your local grocery store employees. While their jobs aren’t nearly as important as health care professionals, we’ll all have to die before anyone decides to close our doors due to the covid 19."
1237886784010252289,2020-03-11 23:43:02+00:00,"Just got approved to cover Tribeca, assuming that doesn't become another covid casualty"
1237886783951499266,2020-03-11 23:43:02+00:00,"UNICEF provides equipment to help Laos' response to COVID-19: UNICEF provides equipment to help Laos' response to COVID-19 ... UNICEF Representative Octavian Bivol handed the essential supplies over to ... ""if we each make the effort to wash our hands properly with soap and…"
1237886773633654784,2020-03-11 23:43:00+00:00,Shoutout to COVID-19 for forcing an early summer
1237886769669931008,2020-03-11 23:42:59+00:00,"The game of #Liverpool v #Atletico Madrid is relatable to life. One minute you have it and the next minute it all gone. Same with #COVID-19, few weeks ago the world was at peace, today it is something else. 
#LIVATL"
1237886765152612352,2020-03-11 23:42:58+00:00,"covid-19: Its’s not a bug, it’s a balance patch #BoomerRemover"
1237886762472443905,2020-03-11 23:42:57+00:00,It’s funny how even though there are several confirmed cases of COVID-19 here in IL including in Chicago most everyone’s just kinda going about their business. Yeah the St Patrick’s day parade was canceled and one CPS school’s students are quarantined but that’s pretty much it
1237886757883895814,2020-03-11 23:42:56+00:00,I just used covid 19 infection strategies and won plague Inc for the first time. Hm
1237886705492992000,2020-03-11 23:42:44+00:00,i’m getting pretty jealous of all the attention my bf is giving to covid &amp; not to me these days 🥺
1237886683405643776,2020-03-11 23:42:38+00:00,"Earlier this morning the World Health Organisation officially declared COVID-19 (Coronavirus) a pandemic. Taking this action into thoughtful consideration, I have made the decision to cease all of my other political affairs and focus my time and resources to this health crisis."
1237886670147424256,2020-03-11 23:42:35+00:00,"tw: covid-19, coronavirus

First community transmission of coronavirus today in Scotland, so that'll be me staying at home now.

Only 36 cases in Scotland but that's double what it was yesterday and they're all on my side of the country.

As a weak lungs person, gotta stay home."
1237886667966439424,2020-03-11 23:42:35+00:00,"If Covid 19 infects every person on earth with a current mortality rate of approx 3.6%. It will cause the death of 276,000,000 people. At current pop. Growth it would take only 3.5 years for the earths pop. To return to current levels. Scary..."
1237886667094028288,2020-03-11 23:42:34+00:00,"two predictions:

- handling of Covid forces Republicans to flee Trump (who flees to Saudi Arabia to avoid prison for NYC indictments) and Romney comes to the rescue of the party as Nominee at their convention

- bernie runs for prez as independent creating a 3 way race"
1237886666871689218,2020-03-11 23:42:34+00:00,And now begins the flood of emails from various companies telling me what they're doing about COVID-19.
1237886664917188608,2020-03-11 23:42:34+00:00,"It's starting to feel like Trump's plans to cut Social Security and Medicare include letting COVID 19 thin the herd for him first.

Can we drop informational leaflets down to nursing homes? These old folks can read, if we can just give them a variation on FOX News."
1237886660647346177,2020-03-11 23:42:33+00:00,"Does anyone besides me think watching the COVID-19 virus case by case

is like watching the kitchen faucet drip🚰

drip🚰

drip🚰"
1237886660328583170,2020-03-11 23:42:33+00:00,"""We're at the stage where suppression of news about news about COVID-19 is most important.""

No, they're not saying that.  But they would if they could."
1237886656104943617,2020-03-11 23:42:32+00:00,"now that WHO has declared this COVID-19 outbreak as a pandemic to the world, sadly, no more travel plans till the end of the year till the situation gets better. 😪"
1237886654829842436,2020-03-11 23:42:31+00:00,"As an artist , you have the responsibility to spread awareness as you has become a role model for youngsters, public , but you abused that by showing off , posting pictures of you travelling during this COVID season, and by not wearing mask ."
1237886647871483904,2020-03-11 23:42:30+00:00,"Where I am living there is a confirmed death by COVID-19.

But there is no count regarding the numbers infected nor the city where there's confirmed outbreak.

Feels good."
1237886635624169473,2020-03-11 23:42:27+00:00,"Sucks that I can’t cancel my con ticket, due to COVID-19 prevention by proxy (sake of grandparents) even though it’s still gonna be on and I still have the chance to go. 

If sacrifice is the highest form of love, guess I’ll find other ways to spend my time."
1237886616930144260,2020-03-11 23:42:22+00:00,"Per the Centers for Disease Control and Prevention (CDC), the following preventive measures should be taken to help reduce the spread of COVID-19:

Avoid close contact with people who are sick.
Avoid touching your eyes, nose, and mouth.
Stay home when you are sick."
1237886612614172675,2020-03-11 23:42:21+00:00,Can I go more than 60 seconds without seeing something about COVID-19 PLEASE FOR GODS SAKE
1237886608826748929,2020-03-11 23:42:21+00:00,2nd positive test result of covid-19 at trinity college
1237886608759590915,2020-03-11 23:42:21+00:00,"For almost the entire time while I was at K College, I did not stay at my parent's house. It was not a healthy place for me. If COVID-19 was a thing two years ago and my school was one of the ones sending people home, I would have been essentially homeless. I can't imagine what.."
1237886605563592711,2020-03-11 23:42:20+00:00,Hey @SingaporeAir it is pretty poor form that you will not waiver cancellation fees to countries who have just closed their borders due to COVID-19. @flightcentreAU poor form too for not refunding cancellation fees.
1237886592095674369,2020-03-11 23:42:17+00:00,"I had a client today that would not shake my hand bc of COVID-19, and would give mean looks to people that would cough in the lobby"
1237886560051159041,2020-03-11 23:42:09+00:00,I just hope I don’t see anything  covid related on a club flyer.
1237886541743046657,2020-03-11 23:42:05+00:00,sooooo they just confirmed 2 cases of covid-19 at my school. cool. cool cool cool . ha ha. 🙃🙃🙃🙃🙃🙃🙃🙃🙃🙃
1237886541235736576,2020-03-11 23:42:04+00:00,Cheltenham &amp; Liverpool fc total crowds  125k crammed together. We are not taking this international medical emergency seriously. #covid-19
1237886527318810627,2020-03-11 23:42:01+00:00,GPs given uncertain advice on Covid 19 and inadequate PPE
1237886526370897921,2020-03-11 23:42:01+00:00,"Full private coaching announcement and @rstaragency announcement tomorrow prior to competitive fortnite and ahead of many fortnite players staying at home to grind because of the unfortunate COVID-19 Situation.. 

Invest Your Time and Money on What you NEED.

Watch out 👀🥵🤫"
1237886519911657475,2020-03-11 23:41:59+00:00,"NHL games are being conducted with fans barred from attendance.... :-( I’ll still be screaming/cheering at my tv... hope the @PredsNHL can hear it... 

Covid-19 is getting serious"
1237886519202869256,2020-03-11 23:41:59+00:00,"I didn’t get over my recent bout of bronchitis, and have been worried I might end up with pneumonia, as has happened in the past. COVID-19 pandemic has be scared. I live in Pennsylvania; I always thought I’d die by having a deer hurl itself in front of my car on the turnpike."
1237886517944541186,2020-03-11 23:41:59+00:00,"I watched a debate where a Doctor expresses that COVID-19 is over-hyped. Many cases may be present and death is possible if you are at risk, like have a poor immune system then the chances of you dying is the same as having the common cold. ""The media does not know how to..."
1237886509455298560,2020-03-11 23:41:57+00:00,I would not only like to thank God but COVID-19 for migrating classes to online instruction until further notice at UIC in Jesus name amen and also hallelujah
1237886509358829576,2020-03-11 23:41:57+00:00,"good morning~ woke up to news that my college might unexpectedly shut down for a temporary time because of the increasing spread of covid-19. we might be one of the firsts because our college is smack right in the city which is always bustling with people, so... there's that -"
1237886493617606667,2020-03-11 23:41:53+00:00,"sudbury has one case of COVID-19 and shuts down the university. Toronto has multiple cases, only one university takes action. rip us."
1237886489305870336,2020-03-11 23:41:52+00:00,I’m supposed to visit Arizona at the end of the month and it’s only an hour and 20 minute flight... where do we stand on this trip in regards to COVID-19? 🤔
1237886482934718466,2020-03-11 23:41:51+00:00,"""The Perfect Leave Application""

""Dear HR,
I am possibly suffering from coronavirus Covid-19 and request you to grant me paid leave for 30 days. Otherwise I will come to office. 

Signed,
Sniffling hardly-working Employee""

😂"
1237886463007576068,2020-03-11 23:41:46+00:00,"So the WHO declared COVID as a pandemic. Who woulda thought eh? When people are sick, they stay in bed and complain, but when they get this virus, they decide it’s the right time to travel the world and go sightseeing. F in the chat for humanity 💀"
1237886450273644550,2020-03-11 23:41:43+00:00,"The world will end, #APOCALYPSE-----&gt; #Truth A lot of people will die. Human misery will increase.&lt;-----#COVID is a #Nothingburger"
1237886436755427333,2020-03-11 23:41:39+00:00,"Hi coronovirus OR covid-19 whateva, can u just fucking stop? We dont want you here sis🙏🏽👀🎉🦹🏽‍♀️👺🥳😘"
1237886423379787776,2020-03-11 23:41:36+00:00,Pretty much all Ive done the past few days is play Stardew Valley and worry about Covid-19. 😬
1237886422494769152,2020-03-11 23:41:36+00:00,Canceled honeymoon trip because of CoVid-19: Check. #depresso
1237886409278517261,2020-03-11 23:41:33+00:00,Are Hollywood people still kissing each other amid covid?
1237886406837432322,2020-03-11 23:41:32+00:00,"So apparently, according to Fox ""news"", schools have been teaching facts: 1+1=2, &amp; according to Fox, doesn't given anyone freedom to think that it ""could"" mean 3, under certain circumstances. Well no, 1+1=2, &amp; always will be. 
Covid 19 is a killer!!! No secrecy will change that."
1237886403821719559,2020-03-11 23:41:32+00:00,"#ClosetheSchoolsuk My children have got events they'd be devastated to miss(&amp; I have too) but I firmly believe that the government should close schools, stop events &amp; stop travelling when not essential.
If they're serious about delaying the impact of COVID-19. Anyone else agree?"
1237886395781390336,2020-03-11 23:41:30+00:00,"I still think LimeWire was a bigger threat than COVID-19, as far as viruses are concerned"
