id,date,tweet
1279928042060525568,2020-07-05 23:59:59+00:00,If the stupid syphilitic racist orange bastard insist on falsely and dangerously calling COVID-19 “china virus” we should rename it the #TrumpSyndrome  #ChinaVirus
1279928040919687168,2020-07-05 23:59:59+00:00,"Dan Andrews is not to blame for this latest COVID-19 outbreak. Anyone not practicing social distancing and taking precautions seriously, they need to wake up and take a hard look at themselves and their inaction. @AusOpinion @australian @DanielAndrewsMP #COVID19Vic"
1279928014474629120,2020-07-05 23:59:53+00:00,"What if we all get Covid-19 and that wipes out humans. Leaving the Earth to the Animals. 
Wouldn't that be nice 🐅🦍🦓🐖🐘🐢🐝🐜🌲🌵🌷🌻🌾"
1279927996338638849,2020-07-05 23:59:48+00:00,covid 19 taught me to just do it. yolo baby
1279927985718558720,2020-07-05 23:59:46+00:00,I wanna go to Canada 😩 fucking COVID 🙄😒
1279927978126970881,2020-07-05 23:59:44+00:00,my parents decisions during covid really shaves years off my life....
1279927968882667520,2020-07-05 23:59:42+00:00,7/6: Foxborough Town Manager Monday Covid-19 Update ~10:00 a.m.*
1279927963325063168,2020-07-05 23:59:41+00:00,A normal president wouldn’t call Coronavirus/COVID-19 the China Virus. Ever. Trump is childish.
1279927959059673088,2020-07-05 23:59:40+00:00,"my siblings were at college when i went through my hamilton phase, but covid made sure they were here for me to annoy during phase two !! #thanksdisney"
1279927958141120512,2020-07-05 23:59:39+00:00,"4 freaking ECQ/GCQ months = (1) rising COVID-19 infection; (2) ballooning national debt; (3) tanking economy; (4) suffering of the masses, pero Laging Handa to gaslight the nation, silence critics and coddle political allies. #JUNKTERRORLAW #MassTestingNowPH #DefendPressFreedom"
1279927946464149504,2020-07-05 23:59:37+00:00,"Just a friendly reminder taking off your mask in a store where it’s required for Face ID is not a good excuse, you look stupid for not remembering your password, and covid isnt gonna stop killing for your stupidity❤️"
1279927917242388480,2020-07-05 23:59:30+00:00,wish this covid shit was over already
1279927916080570368,2020-07-05 23:59:29+00:00,After all this Covid-19 stuff. I want to walk around as a plauge doctor now.
1279927894500937728,2020-07-05 23:59:24+00:00,"Trump supporters: if you were not on the A-B  honor roll in school, then you may not have the best thoughts in your head, The best logic. Trust smart people to lead you to victory, not incompetent Trump who thinks testing generate cases of COVID-19. DT’happy. Ignorance is bliss."
1279927884375826432,2020-07-05 23:59:22+00:00,especially every since COVID FUCKED shit up
1279927871679500288,2020-07-05 23:59:19+00:00,"i continue to see more and more people hanging out and i continue to be dumbfounded when i look at the daily covid happenings, y'all have no discipline or what?"
1279927863073017856,2020-07-05 23:59:17+00:00,"From breast cancer to double mastectomy to COVID-19, 2020 is trying to kill me for some reason but God yes my God won’t let that happen"
1279927854013255681,2020-07-05 23:59:14+00:00,Don’t take this COVID shit lightly. I been out of commission for a week now and this sickness is no joke. Luckily we are all on the mend. But I wouldn’t wish my “mild” case on anyone.
1279927826213453824,2020-07-05 23:59:08+00:00,"Just left a gas station where both people behind the counter, a woman with a 10 y.o kid, and another woman were all wearing masks but not covering their noses. The kid actually removed hers entirely as she hung half-in, half-out the door, holding it with her covid-ridden hand."
1279927811269177348,2020-07-05 23:59:04+00:00,"UGH. Trump is planning a rally here in NH July 11 where our COVID numbers are relatively under control. #GenZ and #kpopstans, you know what to do!! Stop the madness!

Register for FREE TICKETS on the ""Trump 2020"" App.

Text APP to 88022 #COVID"
1279927785541304320,2020-07-05 23:58:58+00:00,What did covid 19 cost you?
1279927783561613316,2020-07-05 23:58:58+00:00,"I have COVID-19. It’s no news, as I’ve been sick, but the major things that have helped me are Vitamin C (sodium ascorbate crystals), zinc paired with tonic water WITH quinine, boiling citrus and inhaling vapors, and soaking in the sun for all natural Vitamin D. Hydrate all day!"
1279927769435115520,2020-07-05 23:58:54+00:00,"I rarely wish Ill of people. But there are some Covid-19 denier people on my timeline who I really hope catch it and get a horrible dose. Just so I don't have to read their daily 5G, George Soros, Patriot, its just a flu, the government are using Covid to control you, BULLSHIT 💩"
1279927768797634560,2020-07-05 23:58:54+00:00,"Those of you with a family member who has tested positive for covid and showing symptoms, living with their family, how do you sleep at night?"
1279927758550859777,2020-07-05 23:58:52+00:00,The government is genuinely mishandling the Covid situation in hopes that “it won’t be this bad “ &amp; “ the whole population can’t be asymptotic “ etc &amp; I can’t stress this enough not because shit ain’t bad now doesn’t mean it can’t get worse.
1279927731078287361,2020-07-05 23:58:45+00:00,thinking about how I have to go back to face to face classes while the # of COVID cases increasingly goes up everyday 🤢
1279927721020153858,2020-07-05 23:58:43+00:00,am I the only one who wonders what movies will come from COVID if this is ever over
1279927719640391683,2020-07-05 23:58:42+00:00,"It is alarming how all these progressive leaders get on Twitter &amp; hypocritically tweet out earnest COVID messages about staying safe, vigilant, caring for each other, &amp; getting each other’s backs, all while ignoring the tens of thousands of people they cage &amp; allow to get COVID."
1279927710236708864,2020-07-05 23:58:40+00:00,"I have watched Hamilton 4 times now, and I have cried every time. I can't wait to see it live next year. I was days away from seeing it in NY before Covid happened."
1279927691995643904,2020-07-05 23:58:36+00:00,covid-19 is still a thing. please stay home. i know too many people who have had it. i know a few people who died from it. please stay home. and please wear a mask if you really need to go out.
1279927680700465152,2020-07-05 23:58:33+00:00,Hey @realDonaldTrump I heard that Covid will break down the statues can we fight the pandemic now 😁 save the statues Donald !
1279927675155632128,2020-07-05 23:58:32+00:00,I gotta get tf up outta this covid infested hospital 😭 my anxiety is through the roof
1279927650237263873,2020-07-05 23:58:26+00:00,Tested Negative for COVID 🙏🏻 I can go back to work 🤗
1279927609963339777,2020-07-05 23:58:16+00:00,To the tune of “Bette Davis Eyes”:  she’s got COVID 19 toes!
1279927595375575041,2020-07-05 23:58:13+00:00,Reading Maxwell does not have covid. Figured. I'll try to be more careful.
1279927570847457280,2020-07-05 23:58:07+00:00,"A COVID poem:

Put on your face mask.
After all, what do we love,
If not each other?

The whole world watches
As we struggle to answer. 
Who is free to live?

The vulnerable?
Or those who have what they need
but still demand more?"
1279927568934686720,2020-07-05 23:58:06+00:00,The people entertaining this Kanye stuff is why there’s COVID
1279927531160784896,2020-07-05 23:57:57+00:00,COVID test: honestly not that bad. The throat part was fine. The nostril part was definitely uncomfortable and almost stung a bit (??) but it was over in 5 seconds.
1279927527939735552,2020-07-05 23:57:57+00:00,"Hi, if your place of employment isn’t being honest about covid-19 cases in the workplace, RAT THEM OUT! TATTLE! 

PUBLIC HEALTH OVER BUSINESS WEATH!"
1279927526329135105,2020-07-05 23:57:56+00:00,i might have to take the covid test 😐
1279927514920448000,2020-07-05 23:57:54+00:00,There are Covid spikes everywhere in the world di lang sa Pilipinas. Natural dahil nag-open na ang mga ekonomiya at lumalabas na mga tao. Doble ingat na lang. Always wear face mask and face shield when going out. Wash hands often and practice physical distancing. #BeatCOVID19
1279927498541723648,2020-07-05 23:57:50+00:00,"I just got news that our office is still closed for tomorrow. We’ve been out of work since Thursday because someone in the office was positive of COVID-19. I’m a bit scared, sad, and anxious."
1279927487674363906,2020-07-05 23:57:47+00:00,people who didn't get covid are gonna look back on quarantine as a time when everything was shut down the same way people who didn't lose their lives or homes in hurricane sandy remember it as a week of no school
1279927479344431104,2020-07-05 23:57:45+00:00,"Having Covid really made me appreciate tasting food. Eating just to put food in ya body without being able to taste it was some trash! 0/5 stars, would not recommend"
1279927473585688576,2020-07-05 23:57:44+00:00,"Ate one less meal than planned today, which is certainly an anomaly and not just how I live exacerbated by COVID life."
1279927467038384129,2020-07-05 23:57:42+00:00,"Almost 130,000 Americans have died, who could’ve still been here today, if POTUS acted on intelligence about COVID, earlier this year, and took action, instead of calling it a hoax, then continuing to downplay it and playing doctor along the way."
1279927457890447360,2020-07-05 23:57:40+00:00,i swear to god if i’m getting covid and i have to reschedule my bottom surgery consult on tuesday
1279927452027011074,2020-07-05 23:57:39+00:00,a way to keep hospitals less crowded is to just not treat the ones who got COVID bc they didn’t wanna wear a mask. problem solved.
1279927451221704704,2020-07-05 23:57:38+00:00,wake me up when vacina pro covid estiver pronta
1279927444649238528,2020-07-05 23:57:37+00:00,#GhislaineMaxwell on earth as she contracted #covid ? I presume she’s been in hiding not leaving the house etc. BULLSHIT.  Be prepared victims you won’t get justice Epstein all over again but less bangers.
1279927438814953472,2020-07-05 23:57:35+00:00,I can’t even describe the frustration and helplessness I feel laying my young beautiful cousin to rest because of COVID. I’m hurt angry and sad all at one time
1279927437367873538,2020-07-05 23:57:35+00:00,Kind of glad i’m not scheduled to field base this fall semester since everyone is saying schools will most likely do online again because of covid
1279927434251509761,2020-07-05 23:57:34+00:00,"Please don’t assume sick people are staying home. I know someone who had a fever 3 days in a row, finally got tested for covid, and while waiting for her results she’s gone to a bowling alley and a public pool."
1279927414370557952,2020-07-05 23:57:30+00:00,After covid is over I want to go to either concert or a drag show
1279927409677144064,2020-07-05 23:57:29+00:00,America has just decided COVID-19 is here to stay and it’s infuriating.
1279927398423842817,2020-07-05 23:57:26+00:00,"I went to the beach today, and most humans were trying to physically distance themselves from one another. You know who wasn't? The seagulls. Those birds don't care about Covid. They just want your lunch. Savage. I didn't give them anything. I just yelled, ""6 feet, you creeps!"""
1279927396548972544,2020-07-05 23:57:25+00:00,COVID-19 FUCK YOU
1279927385643798528,2020-07-05 23:57:23+00:00,"All I’m hoping is that in the next 2 weeks these Covid cases don’t go back up, because I saw not 1 mask yesterday🥱."
1279927380539256832,2020-07-05 23:57:22+00:00,"MAKE NO MISTAKE ABOUT IT COVID IS DEADLY!!!
IN LESS THAN 2 MONTHS IT HAS KILLED 70% OF OUR FREEDOM!!!"
1279927376890208256,2020-07-05 23:57:21+00:00,Stop saying china virus. It’s called Coronavirus or COVID-19. Not wuhan flu. Not China virus. Doesn’t matter where it came from. It’s affecting everyone and it’s not funny.
1279927371672535040,2020-07-05 23:57:19+00:00,"I must admit, even though I didn’t do anything special, the July 4th Holiday was a welcome change of pace during the Ground Hog Day Covid-19 existence. I realize it’s just another hard day for those who are sick &amp; the medical folks trying to save lives. As always, I salute them."
1279927367348006912,2020-07-05 23:57:18+00:00,"as a former medical care worker/teacher i posted here months ago that covid is also an air borne virus. i suggested masks, sanitizing, air filters 4public spaces, air duct sanitizing. i got silence in return. there is going 2 b a run on medications this fall/winter with infection"
1279927338550124544,2020-07-05 23:57:12+00:00,reading that mottling is a rare-ish covid symptom and uuhhhhhh I'm noticing a rash on my chest and my left shoulder that's starting to look like that
1279927334745800705,2020-07-05 23:57:11+00:00,I wouldn’t be surprised if they try to say Ghislaine Maxwell has COVID or some dumb shit like that
1279927312172101632,2020-07-05 23:57:05+00:00,really if i knew covid was gonna last this long i woulda made some friends first ..
1279927301174673408,2020-07-05 23:57:03+00:00,This covid-19 got me sitting my ass down. Ehh...I’m just ready to not have to be soooooo cautious.
1279927299001942016,2020-07-05 23:57:02+00:00,"Celebrating in the COVID era: Did a socially distanced cookout for my daughter’s bday. My parents, daughter, &amp; brother (all of whom live together) on one side of the driveway. My wife &amp; I on the other. 2 grills. Condiments/sides on a center table that we took turns at as needed."
1279927286108696576,2020-07-05 23:56:59+00:00,Lmfaoooooo yah dead don’t think Covid is really real or what
1279927274251251712,2020-07-05 23:56:56+00:00,"Also, capitalism isn't a magic cure for Covid-19."
1279927265476915200,2020-07-05 23:56:54+00:00,"Just another thought about COVID: How long do you think that we can live like this? I mean not only social distancing etc, but people constantly getting tested, quarantining, contact-tracing. I am saying it in a sense that COVID will be here for quite some time. Maybe, years."
1279927260317810689,2020-07-05 23:56:53+00:00,Y’all weird for wishing covid on people going out to party and have fun
1279927234116022275,2020-07-05 23:56:47+00:00,"Words from Finley in 1983 which sum up the US and UK public's COVID responses: ""most people rely heavily on a truly literate minority for their information and judgments."" Even then, a considerable number don't pay attention to it..."
1279927227912773634,2020-07-05 23:56:45+00:00,Nothing prepared us for Covid living but the weird expectation is business as usual with some minor adjustments.
1279927225090007042,2020-07-05 23:56:45+00:00,"I suspect I won't live past 40. Dunno if it'll be a heart attack, suicide, covid, other diseases and afflictions, or the side effect of societal collapse, but I don't see myself having that long of time left. And there's a significant part of me that feels relief in that."
1279927210753658881,2020-07-05 23:56:41+00:00,"I think Todd Muller is projecting. He's just complained that Labour has ""no plan"" as a bad quote from the PM's speech on the weekend saying there was ""No playbook"" for Covid-19.

National doesn't have a plan.

#nzpol"
1279927193880211457,2020-07-05 23:56:37+00:00,Now that I know my aunt has lied to her friend's family at the gathering and said she got tested for COVID because everyone else did there (whether that's true or not?) means I asked her to get proof before she even thinks about threatening to come visit me.
1279927164037726208,2020-07-05 23:56:30+00:00,"SN I am VERY confused @ people who think COVID is a hoax....how do you explain away 100,000+ deaths?? I...my head hurts"
1279927160355139584,2020-07-05 23:56:29+00:00,"The US spends most in the world on healthcare. And yet COVID-19 cases are increasing. There is much more to explore in health, healthcare, process and money."
1279927150443933696,2020-07-05 23:56:27+00:00,"So I had a bad day at work... On the verge of just quiting, Called my dad to see how things are going on in Florida, My cousin's and her babies might be sick with covid, and sadly PO, our family dog might be dying.

This been a bad day. 😢😭😭😔"
1279927147839324160,2020-07-05 23:56:26+00:00,There is a tennis tournament going on right now sponsored by DraftKings and DraftKings doesn't even have any games for it. Not that it matters since it's been a total disaster with COVID-19 and withdraws and a player playing while COVID-19 positive
1279927136724246528,2020-07-05 23:56:23+00:00,if it wasn’t for covid I would’ve been in Hawaii this weekend blasting starships by Nicki Minaj
1279927133356331010,2020-07-05 23:56:23+00:00,"A3. By embedding  #sel &amp; #wellness in our plans-This should have been done before #covid Making sure u model w/ your fam, give them lots of tools 2 choose-Create safe space 4 fam 2!go when they need a break &amp; have tools there 4 them 2 use! Make sure each has a voice! #teachpos"
1279927117740982273,2020-07-05 23:56:19+00:00,"sick of these niggas, COVID-19 🤡"
1279927113471143939,2020-07-05 23:56:18+00:00,the Chinese party is sending our state-level party a hundred masks. Not very many but none of you posting jokers sent us any covid gear anyway
1279927111709573120,2020-07-05 23:56:17+00:00,I think everyone should get COVID tested even if you don’t have symptoms ... I’m gone go tomorrow
1279927104130482176,2020-07-05 23:56:16+00:00,"Covid did come from China.  It's definitely a function of their carelessness, crowding, dirty conditions - the fact you can't even tell on someone cause of the govt.  And...that means nothing.  We knew this in November.  Since then our federal govt has done nothing right."
1279927087844003840,2020-07-05 23:56:12+00:00,"A new week is starting and I am one of many in need of a job due to Covid. I know times are tough but I am putting good energy out there. I am looking for #marketing work, and would love a job within the #makeup and #cosmetics industry.  If anyone has leads, let me know please!!"
1279927077886705665,2020-07-05 23:56:09+00:00,"If I don't get covid on this trip, it'll be a goddamn miracle"
1279927057535959040,2020-07-05 23:56:05+00:00,Planning this wedding breaks my heart everyday. I wish most of my family who can’t be there due to COVID could be. This isn’t the wedding we planned for but I’m done waiting. It’s so selfish but I’m tired of being sad about it.
1279927048568557570,2020-07-05 23:56:02+00:00,I would personally like to thank all the fuckers who keep going out without masks and spreading COVID. Y’all are real fucking great
1279927043778588674,2020-07-05 23:56:01+00:00,"I want to plan something for my birthday but the way COVID is spreading, everything will be closed soon."
1279927039701716992,2020-07-05 23:56:00+00:00,"The coronavirus did NOT disappear. New coronavirus cases in the U.S. have topped the charts. Covid-19 doesn’t disappear just cause you got tired of it. PLEASE WEAR A MASK AND WASH YOUR HANDS. You are putting yourselves and others at risk. Be safe, I love you all ❤️"
1279927037029781504,2020-07-05 23:56:00+00:00,"National are poison, voters need to punish their nasty vindictive hateful behaviour. They have pinned their election hopes on our bad luck, COVID 19 or the economy worsening which will be a miracle it doesn't. The Gov't has done a marvellous job, NZ is the envy of the world."
1279927019585843200,2020-07-05 23:55:56+00:00,I refuse to shop with any other weed man bc of COVID .... sounds kinda silly but 😐
1279927019329867777,2020-07-05 23:55:55+00:00,"Forcing you to close your business 
Putting covid people into nursing homes to kill 50 k 
Trying to rig the election with fraudulent mail in ballots 
THESE ARE ACTS OF WAR @realDonaldTrump @RealCandaceO @w_terrence"
1279927004406722561,2020-07-05 23:55:52+00:00,I just got a positive COVID result and someone wished me “Good luck”💀🙃🙃🙃🙃🙃🙃🙃🙃🙃🙃🙃🙃
1279926992926720000,2020-07-05 23:55:49+00:00,Thinking about how in a few months we we will be dealing with both COVID and the regular flu season.
1279926966641188864,2020-07-05 23:55:43+00:00,ATTENTION ALL SMALL BUSINESS OWNERS. THERE IS FREE GRANT MONEY BEING GIVEN OUT FOR COVID RELIEF💯
1279926947854893056,2020-07-05 23:55:38+00:00,I'm on day 5 of being locked in my room because I came into contact with somebody with covid. Waiting on my results. But I care about the people around me so I'll do what I have to.
1279926932491005952,2020-07-05 23:55:35+00:00,My mum said that when there’s a covid vaccine she wants to go to Panera Bread
1279926931635367936,2020-07-05 23:55:35+00:00,"We know Demented Donnie Trump likes numbers. 
Here are some:
20 MILLION+ still out of work.
127,486 COVID deaths, 1/3 of world deaths with only 4% of population.
LOST last election by 3 MILLION votes+
Almost 20,000 LIES wrote/spoken in 3.5 yrs.
#45thRatedPresident
Next yr 46th."
1279926915764228098,2020-07-05 23:55:31+00:00,I want this covid thing to blow over some I can some guys to blow over
1279926882444722177,2020-07-05 23:55:23+00:00,"After careful consideration, due to COVID restrictions in NYS, we decided it is in the best interest for the health &amp; safety of all athletes &amp; coaches to cancel the John Audino football camps for 2020.  

Thank you for your support - I hope to see you next year.

Stay healthy!"
1279926878648905728,2020-07-05 23:55:22+00:00,"People who got the regular flu in December love to say, “Oh, I already had COVID back in December...”"
1279926842326220800,2020-07-05 23:55:13+00:00,How does Florida get away with not reporting COVID hospitalizations?
1279926841973891072,2020-07-05 23:55:13+00:00,Wanna start going back to the gym. Also don't wanna catch covid... Maybe people will be lazy and not go early...
1279926836370321408,2020-07-05 23:55:12+00:00,"If I got COVID im not sittin In the house im going to Tampa, Ca, Atl &amp; all the other places yall been going With no cares fuck it and with no mask 🚮"
1279926816640315392,2020-07-05 23:55:07+00:00,"After careful consideration, due to COVID restrictions in NYS, we decided it is in the best interest for the health &amp; safety of all athletes &amp; coaches to cancel the John Audino football camps for 2020.  

Thank you for your support - I hope to see you next year.

Stay healthy!"
1279926799477194753,2020-07-05 23:55:03+00:00,#PODover &amp; #POCalais Open for business running an optimised schedule due to CoVid-19 measures.
1279926799330246656,2020-07-05 23:55:03+00:00,"COVID-19 cases are skyrocketing. Trump is losing ground with seniors, which itself alone could kill him in FL, AZ, and WI. But pundits think Kanye “Mr. MAGA Hat” could peel away Black voters from Biden. You’re missing the headline here."
1279926797019348992,2020-07-05 23:55:02+00:00,"Can’t wait for my next month trip tho, &amp; hopefully this COVID shit don’t tweak wit the plans"
1279926783559831552,2020-07-05 23:54:59+00:00,"I’m really shocked at how many people don’t give care about Covid. Like who cares if it’s wicked deadly and contagious? People have it as the disease slowly spreads through their body, no symptoms yet, caught it from someone else who had no symptoms yet- but had to go to that bbq"
1279926771974979584,2020-07-05 23:54:56+00:00,"Serious question here for @jacindaardern: how many more ICU beds are there in NZ's hospitals now compared with the number prior to the covid outbreak? If a perceived inability to treat the infected was the primary reason for locking down in March, how have you addressed this?"
1279926744783491074,2020-07-05 23:54:50+00:00,I just want to do some retail therapy at the mall but... COVID 😒
1279926738403954689,2020-07-05 23:54:48+00:00,"Tomorrow at 1:30 PM I'm getting tested for COVID19. I've been having a little difficulty breathing and it could be because of an upper respiratory infection, but the nurse  found out I have MS so she wants to make sure I don't have COVID. #WearADamnMask!"
1279926728199155713,2020-07-05 23:54:46+00:00,"I guess DeSantis has figured out the massive COVID spike is not just more testing, and not the fault of migrant workers. Probably also figured out his victory speech over COVID shows him to be the fool his is. We have.
#floridacovid 
#DeSantisBetrayedFlorida #DeSantisResign"
1279926722721386496,2020-07-05 23:54:45+00:00,"India.

Traffic-related deaths: 150,000 (per year)
Covid-19: 19,000 (so far)"
1279926719915462656,2020-07-05 23:54:44+00:00,Bro everyday my heart gets heavier with all the death that is happening because of covid. 😔
1279926710268542978,2020-07-05 23:54:42+00:00,"Tomorrow at 1:30 PM I'm getting tested for COVID19. I've been having a little difficulty breathing and it could be because of an upper respiratory infection, but the nurse  found out I have MS so she wants to make sure I don't have COVID. #WearADamnMask!"
1279926681663426562,2020-07-05 23:54:35+00:00,The president needs to stop defending so much and let the covid-19 ride out for the next couple of weeks. Then speak when that time period has lapsed...
1279926671290912768,2020-07-05 23:54:32+00:00,"Not to pick on Missouri, but on my drive thru today I saw both a) a billboard with for a radio station with a picture of Uncle Sam rolling up his sleeves and copy that said something like ‘kicking covid’s ass’ and...."
1279926662302445568,2020-07-05 23:54:30+00:00,omg imagine reading someone’s post about their family dying from covid and asking ppl to wear masks and responding with sorry for you loss but masks don’t do anything. should’ve built your immune system 🤷🏻‍♀️
