id,date,tweet
1241877298145415169,2020-03-22 23:59:55+00:00,"So my mom told me yesterday that my cousin, who is an anesthesiologist in NYC, has no access to PPE. He was in close contact with a COVID patient during surgery with no protection. /1"
1241877297034145792,2020-03-22 23:59:55+00:00,anxiety is through the roof.  from someone who had legionnaires pneumonia a few years ago the thoughts of coming down with covid-19 is the same as playing russian roulette. 1/6  #prayforme
1241877295943516166,2020-03-22 23:59:54+00:00,"I'm seeing many people asking for COVID response to be 'federalized'. Do people even know what that means? As for me, I want to say thank you to @POTUS for respecting the states different needs, and also for centralized assistance instead of heavy handedness in federal response."
1241877290679701504,2020-03-22 23:59:53+00:00,Even though my underlying health issue isn’t on the list of high risk doesn’t mean COVID-19 isn’t affecting me.. stress triggers my seizures and COVID-19 is causing me stress.. do the maths and think about the millions of others suffering in this way and worse too... stay inside!
1241877287525588993,2020-03-22 23:59:52+00:00,"Democratic Illinois Governor J.B. Pritzker accused Donald Trump of failing to adequately address the coronavirus pandemic on Sunday, after the president lashed out at him and other state leaders for criticizing the federal government's response to COVID-19."
1241877279803752448,2020-03-22 23:59:51+00:00,Quite devastating to see COVID-19 having a massive impact on people from specific backgrounds.
1241877279707291650,2020-03-22 23:59:51+00:00,Spare a thought for the key workers who had to drag their children to school and risks exposing them to CoVid more than the rest of the population #howtheotherpeoplelive #StayAtHome
1241877266872713217,2020-03-22 23:59:48+00:00,"Time to send in R Kelly, he’s only in danger around COVID-14 and younger!"
1241877245825777674,2020-03-22 23:59:43+00:00,"Headlines: Coronavirus (COVID-19) could overwhelm the American healthcare system.

Plot Twist: America doesn’t -really- have a healthcare system and is nowhere near prepared for this pandemic."
1241877234316533760,2020-03-22 23:59:40+00:00,"The Covid-19 statistics are starlight. They are a reflection of the days-ago past. These are not the total of current cases, they are a glimpse back to the point of infection, captured at the moment of testing. Right now it's already worse.

#COVIDー19 #Shutdown #StayHome"
1241877212686700547,2020-03-22 23:59:35+00:00,"The next US administration must use the Covid-19 crisis as a teachable moment: pay attention to experts who tell you the #InconvenientTruth. #ClimateChange is now slow and will accelerate quickly and inexorably. (Alas, moron should know this slow/quick from his bankruptcies.)"
1241877207443701761,2020-03-22 23:59:33+00:00,"In our neighbour village one couple recently came from uk and they told security didn't  examine them neither stoped them even they are frequiently sneezing , caughing and have fever. How they directly came home ? This is how pakistan dealing to sort out Covid."
1241877207326302209,2020-03-22 23:59:33+00:00,"I was moved this morning listening to @AmaraCNN talk about covid 19 and pregnancy. While we need more research on vertical transmission of the virus, if mom is positive at birth follow @CDCgov guidlines. Limited studies show no virus in breastmilk. Pump if mother baby separation."
1241877200703545344,2020-03-22 23:59:32+00:00,honestly I can’t wait til this whole COVID-19 is over bc I can’t be home anymore .. I mean I know my friends are gonna invite me out and I’m going to be flaky but at least I know there’s something out there to do.
1241877193892007939,2020-03-22 23:59:30+00:00,"Daily reminder:
Covid-19 began in Wuhan China in late November 2019.
The Chinese Communist Party actively worked to cover up the ferocity of transmission of the virus.
The WHO assisted the CCP hiding the true extend of the virus from the rest of the world until January 2020."
1241877193120243715,2020-03-22 23:59:30+00:00,I don’t know who needs to hear this but you do not get infected with COVID-19 by drinking Corona
1241877175965569024,2020-03-22 23:59:26+00:00,"Not sure hard working Americans care how hard it is for rich people like Trump, who spent his open mic #KAG2020 mini-rally lamenting the billions being president has cost him, praising @RandPaul (who went to social events while awaiting positive Covid-19 test) and mocking Romney."
1241877174858076160,2020-03-22 23:59:26+00:00,Top Ryde Centrelink office has a queue of 60-80 people waiting to go in - not social distancing #Covid_19australia @abcnews @ausgov
1241877169317371905,2020-03-22 23:59:24+00:00,"Yeah so uhh... GOP needs to stop trying to force bailouts down the Dems’ throats if they want to pass this COVID stimulus bill. They want to give the treasury like half a trillion as a slush fund to bail out whoever they want, and Mnuchin has a history of horrible decisions. #nah"
1241877153530163204,2020-03-22 23:59:21+00:00,For what possible reason could Biden have gone so noticeably MIA other than him having COVID-19
1241877150585638913,2020-03-22 23:59:20+00:00,"Korea has recently been evaluated as a successful democracy due to the COVID-19  issue. But is it really a just society that neglects the weak and defends the criminals?
#nthroom
#nthroom_stop"
1241877141345710080,2020-03-22 23:59:18+00:00,"please remember 1 in 17 people has a rare condition, add those with cancer, MS, Cystic Fibrosis, COPD, asthma etc older folks &amp; key workers who need to keep going so we can get through this! All depending on healthy folks to take it seriously #IAmNumber17  #stayathome #covid_19"
1241877130981621760,2020-03-22 23:59:15+00:00,"10 years from now, ima be like remember when COVID cancelled 2020?"
1241877124979490822,2020-03-22 23:59:14+00:00,"Many people rushing to come back home because of COVID 19...
But wherever you are if God says you're going to be infected then so be it"
1241877114346967047,2020-03-22 23:59:11+00:00,what would it be like if gilbert gottfried had the covid
1241877112925061120,2020-03-22 23:59:11+00:00,"""If Public Health called and told you that you had tested positive for COVID-19, asked you to list all the places you had been &amp; all the people you had been in contact with for the last 14 days - would you be proud of yourself, or embarrassed by your actions?”
#SocialDistancing"
1241877110186053632,2020-03-22 23:59:10+00:00,"An economic impact from Covid-19: Central banks around the world will force their currencies onto digital platforms, as handling physical cash spreads the virus. 
Is this the immediate next step for our monetary systems?🦠🦠🦠"
1241877110056202240,2020-03-22 23:59:10+00:00,"#BREAKING:
There is an anti-malaria drug called Hydroxychloroquine that looks to be highly effective in treating #coronavirus.

Initial tests show that on a dose of 600mg, 90% of infected #COVID19 patients tested negative in just 6 days.

#Covid_19india"
1241877102707625986,2020-03-22 23:59:08+00:00,"When in California, do what the brats in Florida do on Spring Break. Spread COVID-19 at the beach!"
1241877094130307072,2020-03-22 23:59:06+00:00,ya I think this whole 'scrolling for more news on covid' is getting to me without even realizing lol.. temp. uninstalling/logging off on the mobile device &amp; gonna limit desktop usage
1241877064740827136,2020-03-22 23:58:59+00:00,LRT; oh thank god then what i most definitely have rn isn't covid-19 related
1241877057459621891,2020-03-22 23:58:58+00:00,"Need Netflix suggestions to avoid going crazy from social distancing combined + incessant COVID reading/preparations. 

I typically like action/crime/medical stuff. 

NCIS, Hawaii 50, macgyver, Murdoch, MASH, scrubs, suits, call the midwife, modern family, ER etc"
1241877048286732288,2020-03-22 23:58:55+00:00,Harvey Weinstein just tested positive for COVID-19. I guess there is some good coming from this whole pandemic. My only complaint is that if that piece of shit dies from this he gets out of his sentence early.
1241877045979820039,2020-03-22 23:58:55+00:00,"Serious question, because I don’t know if enough to know if my thoughts are valid or not: Would it be more productive to test everyone who is NOT showing severe COVID symptoms instead of people who are, to identify mild &amp; asymptomatic cases before they have a chance to spread it?"
1241877038144745472,2020-03-22 23:58:53+00:00,DIBS ON THE COVID-19 FUNKO POP
1241877037582651392,2020-03-22 23:58:53+00:00,"Ya know, I saw that Madonna vid posted a few hours ago, and it's been on my mind since. But, my thoughts are; It's very disingenuous. She says COVID-19 makes us all equal, and that just really makes me angry. Why should an infectious disease be the only thing /1"
1241877021699067909,2020-03-22 23:58:49+00:00,Government confirmed COVID on the island. So y’all supposed to be self quarantined or practicing social distancing. Tell me wah alllyuh doing killing one another at this time.
1241877021032099841,2020-03-22 23:58:49+00:00,"We have a lack of face masks and gloves because we bought the vast majority of medical supplies from Chinese companies. When Trump's tariffs went into effect, US companies stopped buying them. When Covid-19 emerged, our companies placed new orders but those companies were (more)"
1241877017638907905,2020-03-22 23:58:48+00:00,"Every single time I post anything positive about COVID-19 possibly not being anywhere near as deadly as we originally thought I will get a few Trump haters who show up and paint the worst picture possible. It’s not an exaggeration, they really want as much carnage as possible."
1241877016497909760,2020-03-22 23:58:48+00:00,"Trump has now declared himself a “war time president” on COVID-19. 

I am old enough to remember…

Jan 22: “It’s one person coming in from China. We have it under control”

Feb 26: “you have 15 people… within a couple of days is going to be down to close to zero”

God help us!"
1241877016191746048,2020-03-22 23:58:48+00:00,The senate only requires a majority of those present and voting to pass a bill.  How come none of the dems have Covid-19?
1241877013259902976,2020-03-22 23:58:47+00:00,Anyone else suspicious of Russia’s #covid numbers?
1241877012941361161,2020-03-22 23:58:47+00:00,"Ive decided everyone gets ONE warning or information dump on Covid. Im not going to argue with people. You wanna die or get your family killed, thats on you. Im gonna take care of mine and anyone who will listen but I am not gonna argue why ""taking temps at doors"" wont work w/ u"
1241877003290189833,2020-03-22 23:58:45+00:00,"Incarcerated people need to be FREED. In the interim they need  adequate healthcare, hygiene products, tests, free phone calls to contact their families, and accurate  information and updates about covid-19. Elderly people need to be released like yesterday @NYCMayor @NYGovCuomo"
1241876999909584896,2020-03-22 23:58:44+00:00,"I had an appt scheduled last week to keep my hip checked out again (cuz once again nobody can tell me what’s wrong w me) and it got cancelled cuz of covid, and today my hip is hurting so bad 😭"
1241876993400098817,2020-03-22 23:58:42+00:00,"Somehow the whole world is going on a long holiday, ppl over the world are frightened buh Nigerian joke about everything💔, this shit is real #covid-19"
1241876991294537728,2020-03-22 23:58:42+00:00,If my bitch catch me cheating I’m blaming Covid •
1241876977893740544,2020-03-22 23:58:39+00:00,How did I not know marble racing existed? Could it be because before Covid-19 I actually had a life?
1241876974445817856,2020-03-22 23:58:38+00:00,I was planning to stream yesterday but had work stuff come up again.  Resting today and hopefully this week will be easier.  Going to change my schedule to 2 or 3 days a week of streams until this COVID-19 thing calms down a little.  Hope to see you guys soon.
1241876959036137478,2020-03-22 23:58:34+00:00,The fear is not because people are getting infected but because we gat no health facilities if this #covid-19 could go out of control
1241876957077348353,2020-03-22 23:58:34+00:00,"Our Sunday, March 22, 2020 communication from the Village of Key Biscayne 

Navigating Through COVID-19--As a Village 

Good evening, Residents,

The Village of Key Biscayne would like to share with you some updates given recent developments over the weekend:"
1241876953889755138,2020-03-22 23:58:33+00:00,"Hey @journalsentinel how did @SenatorBaldwin vote on the COVID-19 stimulus. It was tweeted repeatedly and front page news when WI GOP voted no.

So, how did she vote?"
1241876952807505921,2020-03-22 23:58:33+00:00,Shame on you Sen. Rand Paul. You took the Covid 19 test and still went to the gym. Why? You're selfish and inconsiderate. I hope you are man enough to pay the salaries of all those who have to clean up after you. Stupid.
1241876934021328899,2020-03-22 23:58:28+00:00,"Help needed!

Need info on total number of COVID tests conducted in Georgia and Armenia."
1241876922566684672,2020-03-22 23:58:25+00:00,"#BREAKING: The Monroe County Coroner says a 56-year-old male from East Stroudsburg who tested positive for COVID-19 has died due to complications of the COVID-19 virus. The male died on Sunday March 22, 2020 at the Lehigh Valley Pocono Hospital. @WNEP"
1241876921253875713,2020-03-22 23:58:25+00:00,Yo did anyone tell the Amish about Covid-19
1241876920192495616,2020-03-22 23:58:25+00:00,"COVID-19 has sent The Current 
(but Old) System into a Frenzy."
1241876919047446529,2020-03-22 23:58:25+00:00,"So social distancing of 2m, gyms are closing yet hairdressers are open... ??  
Confused. #Covid_19australia #ShutAustraliaDown"
1241876900957630466,2020-03-22 23:58:20+00:00,"Is it safe to jog in the morning &amp; evening? 
#Covid_19SA"
1241876896926875651,2020-03-22 23:58:19+00:00,"Trump has been hyping hydroychloroquine as a cure for COVID-19 with scant evidence. It is prescribed to keep Lupus in check. Now some Lupus patients are unable to refill RX because of hoarding, says Propublica. Start treating the pandemic as a humanitarian -not a PR- problem."
1241876895974559744,2020-03-22 23:58:19+00:00,COVID-19 shows us a disadvantage of 'globalization' village.
1241876891918729221,2020-03-22 23:58:18+00:00,Some new events for the Olympics given it's still on. 1. Fastest Team to all get Covid.
1241876890757017601,2020-03-22 23:58:18+00:00,"I'm very disappointed that my Senator of my state, @LindseyGrahamSC, is pushing the EARN IT bill through the COVID-19 crisis to exploit children for political gains to end privacy. I do not want you to be my Senator this year. Slimy and sketchy. #EarnItAct"
1241876885845532673,2020-03-22 23:58:17+00:00,"19 years old and stressing to the point i can’t sleep because of work, COVID-19 you’ve had me by the balls here. Proud to work for the NHS&amp;Prison Service ❤️"
1241876882339106816,2020-03-22 23:58:16+00:00,The amount of pushups I have to do right now. Covid is a personal trainer in disguise owa?
1241876880401162240,2020-03-22 23:58:15+00:00,"I have not been posting my Get to Know my Neighbour for a few days. I had a migraine, but just a regular monthly glad to be a women hormonal migraine. Nothing related to Covid-19."
1241876872494870529,2020-03-22 23:58:14+00:00,"Human death rises, pollution decreases, climate change reduces, birds are chirping ,fishes r enjoying without any fear..do u still think THE #ENDGAME is only a fuckin fictional movie.Please stay home and be safe unless an #ironman(anti dote) arises..
#Covid_19india #JantaCurfew"
1241876871811342336,2020-03-22 23:58:13+00:00,Please take care to use paper or gloves when dispensing fuel to your Vehicle or Connecting to your EV. Covid stays live on hard surfaces.
1241876871199051776,2020-03-22 23:58:13+00:00,"Moron mayor of Vancouver wants fines for businesses for non compliance of covid-19 violations doesn't have the balls to go after the majority of offenders the general public violators. Playing politics for votes during the pandemic, typical ignorant NDP hack"
1241876870389325824,2020-03-22 23:58:13+00:00,Watch me be fluent in NZSL after watching all of these covid-19 news updates #lookatthebrightside
1241876868183347200,2020-03-22 23:58:12+00:00,I've recently landed back in Shanghai after seven weeks of school campus closure. China's covid timeline is about 8-10 weeks ahead of the West. This was the immigration process at Pudong airport on Friday 20 March 2020. [Thread] 1/n
1241876867885531138,2020-03-22 23:58:12+00:00,Boredom will kill some people before #covid-19 gets to them😂
1241876865264074760,2020-03-22 23:58:12+00:00,"Covid &amp; cuddle. Yup.

Coach points down the bench and points ""Hey you, it's your turn. Get in there and get some buckets"""
1241876858288799744,2020-03-22 23:58:10+00:00,"Great news that the positive test rate in NZ is between 1% and 2%. 

That suggests that we are doing enough testing, and we've gotten onto it early enough. 

#coronavirusnz #Covid_19nz"
1241876856686723074,2020-03-22 23:58:10+00:00,We should all hope to be as happy as @kairyssdal is introducing Marketplace even during the COVID crisis. 🤘
1241876846225973250,2020-03-22 23:58:07+00:00,Honestly I’m not ready to lose anyone in my life rn due to the Covid-19 issue especially my mum. This virus may looks simple for some people but not for me. Losing your family member/close friends is not easy to handle. I know how death is written but hopefully it’s not now for-
1241876825816600576,2020-03-22 23:58:02+00:00,Covid is no joke. Stay put. Stay safe.
1241876818698719233,2020-03-22 23:58:01+00:00,Fox News downplaying the threat of COVID-19 to its elderly viewers is like the Vampire Network reporting the dangers of sunlight are overblown. Just not a good business decision.
1241876814005334016,2020-03-22 23:58:00+00:00,"I need to head to the clinic today to get a refill on my thyroid medicine. I’ve been feeling okay otherwise, but what are the chances that my doctor would actually test me for COVID? I’m guessing not, but it can’t hurt to try..."
1241876798964719624,2020-03-22 23:57:56+00:00,Imagine getting rid of covid 19 and China release covid 19 plus.
1241876792149004289,2020-03-22 23:57:54+00:00,After Covid-19 starting a family is must ... Boredom can send someone into depression wtf!!!
1241876789800112134,2020-03-22 23:57:54+00:00,"NYT: harvey weinstein has covid
me: oh finally a win"
1241876788072132616,2020-03-22 23:57:53+00:00,"1. Have you travelled overseas in the past 8 weeks?
2. Do you have any symptoms of Covid- 19, even mild ones?
3. Have you been into contact with anyone with the symptoms of Covid-19?
4. Have you been advised by a healthcare professional or NHS 111 to self isolate?"
1241876782846001159,2020-03-22 23:57:52+00:00,"These kids are crazy, swimming in that covid soup water at the beach.. they should ban travel in and out of the state #shutdownflorida"
1241876780757274624,2020-03-22 23:57:52+00:00,"And again I remind everyone in the uk... 

DONT FUCKING GO OUT! 

#UKLockdownNow #COVIDIOTS #Covid_19"
1241876775350808576,2020-03-22 23:57:50+00:00,"I just watched the most recent press conference on COVID-19, and wow. That shit was strange, slow-moving, and significantly impeded by a completely unnecessary and slow-talking moderator."
1241876775052775424,2020-03-22 23:57:50+00:00,Any draconian measures introduced by this Govt due to #Covid_19australia - must be reversed as soon a possible. To me - this should be legislated. I’ve no trust this authoritarian Govt isn’t right now looking for opportunities to oppress opposition &amp; entrench its power #auspol
1241876771936579585,2020-03-22 23:57:50+00:00,With the way the FG is going about this Covid-19 awareness. I think it'll be better if they either develop the cure or pray some other country does cos we are too broke for this virus.
1241876768665022465,2020-03-22 23:57:49+00:00,Pretty sure @realDonaldTrump is already COVID-19 positive.
1241876762734231553,2020-03-22 23:57:47+00:00,"Can anyone say with a straight face that @realDonaldTrump exhibited leadership qualities during this most recent press briefing? 😳

Is anyone reassured by his psychotic rantings? 😳😳

Where is Fauci? 
#COVID"
1241876754928668672,2020-03-22 23:57:45+00:00,ok i think this is the beginning of the end for me my dad tested positive for COVID-19
1241876752949030913,2020-03-22 23:57:45+00:00,"IMPORTANT PSA!! 
My cousin in the CDC told me that if you contract Covid-19, you can cure it by going to a Trump rally and maintaining close contact with supporters. 
Please spread the message, save a life!"
1241876747072798726,2020-03-22 23:57:44+00:00,THEORY: The recession caused by COVID-19 will be what finally spurs the NYS legislature to legalize recreational marijuana
1241876742131744769,2020-03-22 23:57:42+00:00,Everything feels quite end of World-y. #COVID19nz #Covid_19nz
1241876737660723210,2020-03-22 23:57:41+00:00,Can mosquitoes carry the COVID-19 virus?
1241876730710761482,2020-03-22 23:57:40+00:00,"#Covid_19SA has taught the world the importance of technology. 

It has taught us online classes, online offices etc"
1241876722825465856,2020-03-22 23:57:38+00:00,Note to self: must stop reading new CoVid guidelines and stats before bedtime ! #internalscreaming #anothersleeplessnight
1241876710938816514,2020-03-22 23:57:35+00:00,"Whoever invented COVID-19, your moms a hoe"
1241876703745638401,2020-03-22 23:57:33+00:00,"The number of COVID-19 cases will continue to rise because more people will get tested.  We need to track the % of positive cases by the total test taken.  Hopefully, we see a downward trend in that number."
1241876698108477442,2020-03-22 23:57:32+00:00,Fuck Covid-19 I’m tweeting this everyday till it’s gone
1241876694828552195,2020-03-22 23:57:31+00:00,"C. RONALDO,L. MESSI dem all hide na you Kwame Bonsu waakye wura ba you playing sulia for beatings dey der #COVID_19"
1241876680471228416,2020-03-22 23:57:28+00:00,"Later today, we will begin process of closing gates and bathrooms in our parks in response to COVID-19. We cannot keep our bathrooms adequately clean, risking the health of public and our staff. Also, too many people not social distancing. @SnoHD @snocoparks @SnoCo_DEM"
1241876680269910016,2020-03-22 23:57:28+00:00,"Expanding triage tents and drive throughs in Idaho. They call them testing sites- but be prepared not to qualify.
You must meet criteria for drive-up COVID-19 testing sites in the Treasure Valley. Still little to no tests available making a devastation worse for citizens."
1241876679523516416,2020-03-22 23:57:28+00:00,All these people posting about Covid-19 but refuse to go inside and stay away from others lol
1241876672745332736,2020-03-22 23:57:26+00:00,With the ongoing situation with Covid-19 the 46th LDC is looking at the option of going online to ensure the learning experience for the students will continue. In a holding pattern for the next little while - stay tuned for updates.
1241876671453712387,2020-03-22 23:57:26+00:00,"One COVID-19 cased confirmed at work! I worked from home with some other folks last week though, so chances of exposure are still low."
1241876643167289345,2020-03-22 23:57:19+00:00,"Korea finished developing the 10 minute #COVID19 diagnostic kit and is now ramping up production. They plan to export 300.000 test-kits per week...

#CoronavirusPandemic 
#CoronaVirusUpdate
#Covid_19india"
1241876640008998912,2020-03-22 23:57:18+00:00,"Went outside just to take photos for my IG, but it turns out I saw many people walking outside despite the covid-19 stuff going around... Are y'all OK? Or maybe it's still not in my area?"
1241876632559730690,2020-03-22 23:57:16+00:00,All Covid-19 cases in NZ will be related to contact with someone from overseas because we are an island and the virus came from people overseas so is the fact that our increase is steep like Italy and NOT like Taiwan reason that we should be more concerned?
1241876620748697600,2020-03-22 23:57:13+00:00,kanye's been exposed as a manipulative liar &amp; harvey weinstein's been infected with covid-19??? the grocery stores may be empty but we're eating good ladies.
1241876620744540164,2020-03-22 23:57:13+00:00,It is going to be interesting to see how business norms will change after covid-19 and how businesses and people will innovate after this has passed.
1241876618550882305,2020-03-22 23:57:13+00:00,110 cases of covid in my county say sike
1241876600074964992,2020-03-22 23:57:09+00:00,We’re reaching out to North Korea and Iran to offer coronavirus tests and PPEs and I can’t get my directly-exposed-to-COVID-19 employees tested because the city and state health departments said they don’t have tests to give us?! #COVID19 #twill
1241876593850462208,2020-03-22 23:57:07+00:00,"Day 8 as a volunteer for Task Force COVID-19. Lord, you are my strength 🙏🏻"
1241876590595919872,2020-03-22 23:57:06+00:00,STOP MAKING COVID MEMES 😩👊🏽
1241876581926215684,2020-03-22 23:57:04+00:00,"CUSTOMER NOTICE

We have been carefully watching the development and media surrounding the spread of the Covid- 19 virus."
1241876571515830272,2020-03-22 23:57:02+00:00,"Absolutely horrified that people believe that Covid-19 can be cured by Vitamin C, or that there's a conspiracy going on for this. Goodness me."
1241876570660208640,2020-03-22 23:57:02+00:00,"A6. I haven’t gotten too many, but I did see an article about a Florida county commissioner who claimed blowing a hair dryer up your nose at the hottest setting would cure (or prevent?) COVID-19. The stupid and crazy...it’s out there.  #HRSocialHour"
