id,date,tweet
1349140248090058755,2021-01-12 23:44:35+00:00,Remember when covid was fairly new and folk were boycotting buying stuff from china or there local Chinese restaurant 😳🥴 fucking headcases
1349140240825417730,2021-01-12 23:44:33+00:00,Women accounted for 100% of lost jobs during covid-19 but in March I got a job offer while @EdgarRuizzz got furloughed. We gotta be the change we wish to see in the world 😤😤😤
1349140227596673026,2021-01-12 23:44:30+00:00,It’s the fact that we can’t even “sit around” because of COVID. So who was this really for
1349140187725451265,2021-01-12 23:44:21+00:00,there won't be any streams this week at all because i have been experiencing covid symptoms and had to get tested today
1349140179269795842,2021-01-12 23:44:19+00:00,"WASHINGTON (AP) - The Supreme Court ordered Tuesday that women must visit a doctor's office, hospital or clinic in person to obtain an abortion pill during the COVID-19 pandemic, though similar rules for other drugs have been suspended during the public health emergency."
1349140170688360450,2021-01-12 23:44:17+00:00,A Congressional covid outbreak is an interesting side effect of the Capitol riot. 2021 got me all paranoid wondering if it was part of the plan all along. Would be easy to have someone infected in that small room refusing to wear a mask.
1349140167781703680,2021-01-12 23:44:16+00:00,"My new favourite game to play is, asthma or covid? This could be easily solved by not running outside but that's too smart"
1349140162379472896,2021-01-12 23:44:15+00:00,"Counting down, one more week until I turn 35 =_=
Kinda wanted to do a larger party with my dad this year because we'd be a combined 100 together, but the covid situation means no big parties anymore :("
1349140156540973056,2021-01-12 23:44:13+00:00,Why are NHS COVID patients being released to hotels?Why are the Nightingale Hospitals not being used? #BBCYourQuestions
1349140154183725062,2021-01-12 23:44:13+00:00,Nobody seems concerned about that except my best friend who lives in Tampa and is TERRIFIED about the covid spread that is about to take over in a few weeks because of the Super Bowl and she works in healthcare. Florida is already bad enough. Why is this going ahead?!
1349140153122639873,2021-01-12 23:44:12+00:00,i can’t wait to go to school. covid is killing my fun!!
1349140148089450496,2021-01-12 23:44:11+00:00,Can you guys relax with the covid protocol infographic spewing. PLEASE??? The minister of finance literally getting corn rows done in Barbados rn😭
1349140139876835329,2021-01-12 23:44:09+00:00,My mom has her appointment for her first COVID vaccine!! Thank you @pati_walsh #COVIDVaccination #publichealth
1349140135904997376,2021-01-12 23:44:08+00:00,"yall i was in walmart &amp; i could NOT stop coughing , ik them people thought i had covid 😭."
1349140114853699585,2021-01-12 23:44:03+00:00,Just got my first covid test. I think a lobotomy would be more pleasant
1349140111787761664,2021-01-12 23:44:03+00:00,"there will be yearly covid vaccinations, you'll see"
1349140103197810690,2021-01-12 23:44:01+00:00,"#vaccinationCovid #COVIDVaccination #NurseTwitter #healthcareworkers   If you are offered a Covid-19 vaccine, f'ing take it!  Or you should STOP giving healthcare, because you are not smart enough. #DrHilleman #DrSalk #DrGraham #MedicalHeroes"
1349140094335279110,2021-01-12 23:43:58+00:00,"Got the news that my estranged mother died on Sunday due to COVID-related complications.

Dry January really turning into Nice Try January."
1349140085455937537,2021-01-12 23:43:56+00:00,i hate doing introductions in classes like nobody cares about my two truths and a lie or what I did before covid happened
1349140075670429702,2021-01-12 23:43:54+00:00,Considering I may actually have a future now my tentative plan for this year is 1) sign the contract 2) get the COVID vaccine 3) take the GRE 4)enroll in grad school online 5) complete my GID diagnosis 6) start HRT 7) prepare to move back to the US in 2022.
1349140074412306434,2021-01-12 23:43:54+00:00,"// So I went to the hospital today, I just got back from there. I spoke with the doctor, said everything I felt. The same gave me some medications and Thursday I will have to go to the hospital again to do the Covid-19 test for the symptoms I have."
1349140070821818369,2021-01-12 23:43:53+00:00,Stepping back for a moment. It's incredible how in Australia we're talking about 2-3 specific chains of transmissions with detailed time and locations. A sign of general success (so far) in dealing with covid.
1349140069764849665,2021-01-12 23:43:53+00:00,The U.S. is JUST now requiring you to prove your negative for Covid before boarding a flight 😂 this country slow af bruh
1349140063905574912,2021-01-12 23:43:51+00:00,"You know what's messed up? If Trump handled COVID properly, he would have got away with SOME MUCH stuff it's not even funny.  Hell, he may have even been re-elected!"
1349140063511142400,2021-01-12 23:43:51+00:00,i am getting covid tested for the first time for school on friday. is it really that bad???
1349140050735456261,2021-01-12 23:43:48+00:00,Reason why I posted those jewelry stores is because since COVID a lot of them lost money. Most stores are closing down and I can’t allow that.
1349140039540895745,2021-01-12 23:43:45+00:00,The corruption in this country is actually so exhausting. Like yes im recovering from covid but the corruption is more crippling
1349140036516683776,2021-01-12 23:43:45+00:00,I have to go back to work today after our covid scare and like that’s bullshit I just want to play Minecraft instead
1349140014878380033,2021-01-12 23:43:40+00:00,"3 people i know, 2 of which were good friends, died in the last 5 days from the covid. Scary shit."
1349140007441858563,2021-01-12 23:43:38+00:00,do yous know how happy it would make my inner emo if bring me the horizon came over after covid I’ll go see them on my own if I have to
1349139998197620736,2021-01-12 23:43:36+00:00,Gta 6 gone drop when covid over
1349139990324908035,2021-01-12 23:43:34+00:00,Covid really lasting like a Honda Civic kmt
1349139988324106242,2021-01-12 23:43:33+00:00,"""It's just as easy or easier to keep COVID cases at zero as it is to keep cases at any other target number""
Is this true or false? Why?"
1349139978606010370,2021-01-12 23:43:31+00:00,Nearly 1/1000 people have died from Covid in Scotland. What a shocking failure from scotgov
1349139969969942530,2021-01-12 23:43:29+00:00,Testando: Covid-19
1349139965939044353,2021-01-12 23:43:28+00:00,12 hours to COVID 💉
1349139962537549825,2021-01-12 23:43:27+00:00,i’m a LOT confused when i meet a HEALTHCARE PROFESSIONAL refusing their covid vaccine??
1349139944808345601,2021-01-12 23:43:23+00:00,I’m so damn tired of Covid and everything that comes with it. I never want to experience another pandemic ever again
1349139942488862721,2021-01-12 23:43:22+00:00,First dose of Covid done!!
1349139929754869760,2021-01-12 23:43:19+00:00,"Genomic testing has linked six cases of UK variant of COVID-19 to Brisbane’s Grand Chancellor Hotel, which is now being shut down with extra contact tracing under way. Two new cases of COVID-19 in Qld overnight, both in hotel quarantine. More than 20,000 tests in last 24 hours."
1349139927850573825,2021-01-12 23:43:19+00:00,"New way to make money:
Buy ticket to move to CA with CA airline company using UK credit card
Flight get cancelled due to COVID
Company takes &gt;9 months to refund you
£ goes up compared to CA $
Profit."
1349139925971554304,2021-01-12 23:43:18+00:00,"So the funeral will be next week. Round trip flight will be like $300. My mom said it's too expensive but like.. I need to be there. I just need to be. Also taking a covid test this weekend even tho I have antibodies, just to give people peace of mind."
1349139920594456576,2021-01-12 23:43:17+00:00,"Good news: the COVID vaccines are offered in Oxford 5 days a week so my elderly parents could get it.
Bad news: the @UMMCnews site is now slammed and I get an error every time I try to select an appointment time for them!"
1349139917675372544,2021-01-12 23:43:16+00:00,"Please @JoeBiden @Transition46 @KamalaHarris @SenSchumer and @SpeakerPelosi Please include $2400 SSI/SSDI Stimulus plan in next #stimuluspackage of $200 in addition to our monthly check for 2021 year for covid relief.
#PurplePower #LALATE #stimulus #StimulusChecks"
1349139913774571523,2021-01-12 23:43:15+00:00,at this point i can’t tell if i have covid or if i’m just paranoid
1349139906963058696,2021-01-12 23:43:14+00:00,"If you minimize the seriousness of #COVID19 or don't #WearAMask correctly, I'm unfriending you on Facebook &amp; IRL. I've made mental notes of celebrities, artists, actors, &amp; politicians who risk the lives of others through active defiance of mask mandates. You are toxic. #COVID"
1349139904782065664,2021-01-12 23:43:13+00:00,Damn! @ChrisCuomo killing the old people in nursing homes on the show “Greys Anatomy” too by ignorantly sending Covid patients!
1349139899904102407,2021-01-12 23:43:12+00:00,"Pinche covid, nomas arruinando mis planes"
1349139892182269952,2021-01-12 23:43:10+00:00,"you'll start to see a massive, but soft and gentle, global vaccination rollout because of the new data surrounding mutations; and the china data showing that nearly everyone who has had sars/covid-2 still has at least one symptom 9 months later.
@steeletalk @chapappay @jodyvance"
1349139885358157830,2021-01-12 23:43:09+00:00,The inconvenience of this covid thing is really starting to piss Glad off!
1349139884523532289,2021-01-12 23:43:08+00:00,Recovery@ks.gov The new Kansas Covid web site doesn't even mention vaccinations. Kansas is pathetic. I'm ashamed of my state.
1349139873240809472,2021-01-12 23:43:06+00:00,And got my 2nd dose of covid vaccine. Pretty sure I could lick a door handle at this point and be immune.
1349139869013053446,2021-01-12 23:43:05+00:00,Lockdown and new strain premier league should be restarted for covid no ?
1349139845990346752,2021-01-12 23:42:59+00:00,Covid test is done! Self swab is cool. I can go at my own pace instead of having a bitch poke my brain 🥴
1349139842702176257,2021-01-12 23:42:58+00:00,Got the covid vaccine today 🥳
1349139842396000257,2021-01-12 23:42:58+00:00,"So got expose to covid through my boss, just got rapid tested and waiting on results. Send off test is on Thursday.🙃 Made it this far in the pandemic with no scares."
1349139832191275008,2021-01-12 23:42:56+00:00,getting the day off work tomorrow for a covid test. epic freaking win 😎
1349139829968285696,2021-01-12 23:42:55+00:00,guess who just scheduled their Covid vaccine appointment 🤪🤪🤪
1349139822288334849,2021-01-12 23:42:54+00:00,"Coronavirus (COVID-19)
This is a cold
I'm scared of common cold
This virus is highly infectious"
1349139820585447424,2021-01-12 23:42:53+00:00,Is @sisolak hoarding all the Covid vaccines like he hoarded all the hydroxychloroquine? Why aren’t seniors getting it? They can go to AZ and get it. Just make an appointment.
1349139816424771584,2021-01-12 23:42:52+00:00,"Covid cases rises in Miri. My in law’s brother tested positive and her dad’s now PUI. To top it off, smlm air pasang besar and hujan lebat. Pagi ni our house was affected with flood and my dad is alone at home. I am so sad and pressured with whats happening."
1349139808589914115,2021-01-12 23:42:50+00:00,"I can't believe I really went from being sick with covid, to getting my period. Can't I catch a break D:"
1349139804546617344,2021-01-12 23:42:49+00:00,"CW COVID
.
.
.
.
Thinking about the time I witnessed fandom Tumblr writing Covid-19 headcanons for their fave fictional boys(tm)"
1349139793603670023,2021-01-12 23:42:47+00:00,The CDC has extended the COVID-19 vaccination guidelines to everyone over the age of 65 and plans to release all the doses held in the reserve. Is it too radical for vaccines that have not yet passed the Phase 3 clinical trial? #MAVORG
1349139776235065345,2021-01-12 23:42:43+00:00,What happens when a person wants to get sober but they are positive for covid? Bet no one has that answer.
1349139772112035840,2021-01-12 23:42:42+00:00,"COVID is serious and it’s spreading dangerously, only logical thing to do, is to end the premier league season now, almost played half the games, so table looks good. Let’s just give the medals out now! 😂😂😂"
1349139768840384513,2021-01-12 23:42:41+00:00,Can’t stand CBC so watching CTV’s Power + Politics. Sad show. Follows CBC playbook. First segment has panel doing their best to shove their heads up Trudeau’s behind. 2nd segment just a bunch of blah blah on Covid. 3rd segment about trashing Trump. Informative...not!
1349139765396791297,2021-01-12 23:42:40+00:00,covid made me comfortable being alone and now I don’t want to go back
1349139764755132418,2021-01-12 23:42:40+00:00,IF COVID RISK IS SO HIGH IN LA RN WHY ARE MALLS AND UNESSENTIAL STORES OPEN
1349139753967493121,2021-01-12 23:42:37+00:00,The NBA is a COVID-19 mess this season. But I respect the league for not trying to skip to the front of the vaccine line just to save their season.
1349139748258893825,2021-01-12 23:42:36+00:00,i wanna call in sick so bad but then i have to comeback with a covid negative test
1349139739425828872,2021-01-12 23:42:34+00:00,How much is Congress' impeachment theater costing Americans while they could be working to get much needed COVID relief to everyone?
1349139734291902464,2021-01-12 23:42:33+00:00,"Living in LA has to take years off your life expectancy...horrible pollution, sales tax is 10.25%, over populated so no parking...highest covid rates in US....I hate it here 🤮"
1349139727933349889,2021-01-12 23:42:31+00:00,"129 guests at the Hotel Grand Chancellor, where a Brisbane hotel cleaner tested positive to the UK strain of COVID, will be moved to other hotels and will be tested"
1349139720647946242,2021-01-12 23:42:29+00:00,My niece is 18 and I’m 23 and we feel like shit while the 60 and 64 year old feel fine. Covid is weird.
1349139716801748993,2021-01-12 23:42:28+00:00,One of my friends lost his dad today because of covid 😔
1349139716524961792,2021-01-12 23:42:28+00:00,"The Mississippi Covid Vaccine website is a joke.

#OhMississippi"
1349139706487971840,2021-01-12 23:42:26+00:00,Got COVID tested though a private testing service at my local pharmacy six days ago and they still have not returned my test results
1349139706211168257,2021-01-12 23:42:26+00:00,"With a unvaccinated 91 year old parent in a private care home the talk of discharges of Covid cases  to care homes is is scary .
Very scary . Have we not learned . ?"
1349139703514198022,2021-01-12 23:42:25+00:00,Just went to @Equinox E 92nd location and the Covid capacity situation is incredibly unsafe.  I was told they were only half way to their limit - I left after five minutes because it was appalling.  Dozens of people on top of each other.  Nearly 70 people on one floor exercising.
1349139693212938241,2021-01-12 23:42:23+00:00,i spent A LOT of time learning what brings me JOY. most of those things were taken away when COVID hit. most of them had to do with ME time.  i have to be intentional about how i spend my time these days and ensure that i fulfill my right to have joy. #ChasingJoy
1349139691745009664,2021-01-12 23:42:22+00:00,Oh shit. No travel into US without negative covid test documentation 3 days PRIOR to flight here.
1349139688574095364,2021-01-12 23:42:22+00:00,If I’m COVID-19 positive and I isolate for 10 days and then get a test and I’m still positive but without a temperature this time do I need isolate another 10 days or no?
1349139687420669954,2021-01-12 23:42:21+00:00,21 savage and his goons from the UK getting denied in the US if that covid test ain’t negatron
1349139684149096449,2021-01-12 23:42:21+00:00,Getting my COVID vaccine tomorrow.🥴
1349139683914219521,2021-01-12 23:42:21+00:00,"You can Tweet sympathy to someone whose mother is in hospital with Covid OR fill your Twitter timeline with posts about Covid being a hoax, but not both, all right?"
1349139670781865985,2021-01-12 23:42:17+00:00,covid no near me abeg
1349139666390319104,2021-01-12 23:42:16+00:00,"It's that time of day when the latest #COVID19 numbers are set to be released. 
It is just impossible to know whether they will come via press release, the province's COVID-19 dashboard, or an @AdrianDix tweet.
#COVID19BC"
1349139658916077570,2021-01-12 23:42:15+00:00,"From today, the remaining 129 guests at the Grand Chancellor will be moved to other hotels to be tested again for COVID @7NewsBrisbane"
1349139649411887104,2021-01-12 23:42:12+00:00,"I am sorry to announce that, due to COVID concerns, the Alumni Game has to be cancelled for the 2021 season.  If anything changes concerning this, I will post that immediately."
1349139649160220676,2021-01-12 23:42:12+00:00,Have you had COVID?
1349139634828181504,2021-01-12 23:42:09+00:00,"Mail from a 16-yo: ""Okay, so I know you don't know me, but I ... loved your article about how teens aren't acting up during covid-19. I loved very down-to-earth style you used and how realisticly fits in our world. On behalf of teens, ... thank you for how seen it makes us feel."""
1349139633410629633,2021-01-12 23:42:09+00:00,Just wish covid would go away ! It hurts seeing people you care fore hanging on by a thread ! So many friends and family not working at the moment.With no end in sight. These front line and essential workers are burnt out ! Still the selfish pricks continue on like it's a joke.🙏
1349139632462692353,2021-01-12 23:42:08+00:00,"A week ago my mom wanted to take my kids to see her sister (who lives her life as if Covid doesn’t exist) and got mad at me when I refused and lost my shit. Made me feel crazy and selfish and terrible for it. 

Said sister just tested positive for Covid. 

Eat my whole ass bitch"
1349139629203542016,2021-01-12 23:42:08+00:00,One of my sweet patients got the COVID vaccine!! 🥳
1349139625684697089,2021-01-12 23:42:07+00:00,remember when Trump got covid real bad lol
1349139617988096002,2021-01-12 23:42:05+00:00,Yikes! My friend in Miami-Dade WHO IS NOT A TEACHER but works in the school system has to work as a teacher starting tomorrow because COVID has wiped out the staff. #WearYourMask
1349139614519459844,2021-01-12 23:42:04+00:00,I want to go to main event but lol covid
1349139614011846656,2021-01-12 23:42:04+00:00,"// CW: Death, COVID //

Found out a friend (nurse) died of covid today. Am even more of a wad of depression than usual. Please send pet photos, memes or chat if you have any to spare."
1349139604918702088,2021-01-12 23:42:02+00:00,"Everything they've tried to do including ""Russia Collusion"" and impeachment didn't work. If not for Covid, Trump would've vanquished Biden ina. Landslide. They want this second impeachment in the history books lmao. He's not going to jail just like Hillary didn't. Money Talks."
1349139599881351169,2021-01-12 23:42:01+00:00,Y’all think this is bullshit and covid doesn’t matter? Imagine if you were only able to FaceTime your mother while she is having difficulty breathing and is in so much pain she can’t move to go and get the food we have to leave her at the door. Please help stop the spread 🥺🥺🥺
1349139597285060610,2021-01-12 23:42:00+00:00,My pops was telling me about all the covid patients he has to deal w on a daily &amp; bro this thing is getting scary
1349139595800227843,2021-01-12 23:42:00+00:00,"For my immunologists-31 weeks pregnant pt on Cimzia, just got Tdap last week, due to receive second COVID vaccine this week. 

Any issues? Way beyond my ER brain

#medtwitter #academictwitter #immunology"
1349139595544457216,2021-01-12 23:42:00+00:00,"Well from the looks of things my sister has covid 😢.  

Please put a mask on to protect others as well as yourself."
1349139595322159110,2021-01-12 23:41:59+00:00,phew may be getting the covid vaccine bc im in nursing
1349139591832461313,2021-01-12 23:41:59+00:00,"Practical ways to improve Ontarians health during lockdowns:
1. Ads: “wash your hands and...STAY ACTIVE”
2. Allow (the same) COVID (-) person to host movement classes in LTC homes
3. Feature 1 exercise story on the news per week
4. Safely open gyms
..
@celliottability @CTVLondon"
1349139566264012802,2021-01-12 23:41:53+00:00,"My mums covid symptoms have got bad she’s in a bad state, please can you keep her in your duas"
1349139558160494592,2021-01-12 23:41:51+00:00,WASHINGTON (@AP) — Supreme Court reimposes rule forcing women to obtain abortion pill in person during COVID-19 pandemic.
1349139551378264065,2021-01-12 23:41:49+00:00,Man what happened to my attention span? I'm trying to do some research for a project and did you know that squirrel fascist facebook COVID whiskey?
1349139525721849856,2021-01-12 23:41:43+00:00,Q. Please reply YES or NO to the following... have you or any of your family or friends been hospitalised and recovered or sadly died with Covid ?
1349139523729551366,2021-01-12 23:41:42+00:00,"The St. John's girls basketball game scheduled for Thursday against Parkway has been postponed due to Covid concerns.
No makeup date has been announced."
1349139518780297222,2021-01-12 23:41:41+00:00,The first flu vaccine was developed in 1930s. Mass vaccination started in the US in 1945. Efficacy of the vaccines have varied form year to year. The highest was in 2010 with 60%. In 2018 it was 29%. In 6 moths we have a vaccine for covid with 95%. and flu has been eradicated??!
1349139511528333313,2021-01-12 23:41:40+00:00,"Please. We implore you to do a Private (yet televised) Inauguration Ceremony. In addition to the threats out there, Covid spread is also a danger. Joe and Kamala have to bring it up, the others don't want to rain on your parade. @KamalaHarris @JoeBiden @SpeakerPelosi @SenSchumer"
1349139501101314055,2021-01-12 23:41:37+00:00,"As always with covid, late scratches, etc. look for any changes to be posted on my Twitter feed regarding our lineups👍"
1349139499385724930,2021-01-12 23:41:37+00:00,There’s really not many upsides to getting COVID but I have been able to sleep and watch basketball all day so there’s that
1349139495027929090,2021-01-12 23:41:36+00:00,"It may seem strange to suggest the uk gov is happy to see record deaths from covid. Yet no one would deny they support capitalism, and that system has been killing the less well for decades"
1349139493807390727,2021-01-12 23:41:35+00:00,"not only do they want you to get the covid vaccine , it’s a DOUBLE DOSE vaccine 🥲"
1349139474777718784,2021-01-12 23:41:31+00:00,I signed up for COVID Alert (federal) by using Saskatchewan. Close enough! If enough people do @jkenney will have to join the rest of Canada and get Alberta on-line. @shandro @DShepYEG @RachelNotley It is past time!!
1349139474039664645,2021-01-12 23:41:31+00:00,"Brits on Covid:
""We're not doing as bad as other countries"".
You're worse than Denmark
""But we're an island"".
You're worse than New Zealand.
""But we're bigger""
You're worse than Germany 
""But we have a more dense population""
You're worse than Japan
""But they don't speak English"""
1349139461813235712,2021-01-12 23:41:28+00:00,I am my friend’s personal hotline for all things COVID
1349139461456723969,2021-01-12 23:41:28+00:00,"In all this covid sniping and point scoring, I look at church parishioners, cleaning our pavements, providing meals and food, reaching out to needy and unwell; unheralded."
1349139457975447554,2021-01-12 23:41:27+00:00,"Don’t want your staff breaking social distancing rules? Don’t open a small ass fucking store.

Don’t want your staff getting covid? Don’t open a small ass fucking store.

Want people to follow lockdown? Don’t open unessential fucking places.

Fuck these capitalists and Tory cunts"
1349139453810536450,2021-01-12 23:41:26+00:00,Manifesting lasik and a covid vaccination in the first half of 2021
1349139449133862915,2021-01-12 23:41:25+00:00,New York State sign up for vaccine exclusively on internet. The demographic most afflicted with Covid has lower participation in internet... n.y. governor perpetuates the worst of discrimination..
1349139444801142789,2021-01-12 23:41:24+00:00,"Congress couldn't do Covid relief for months, but they're gonna do impeachment in a few days. LET. THAT. SINK. IN."
1349139443433811969,2021-01-12 23:41:23+00:00,Covid test came back negative😇
1349139442938818560,2021-01-12 23:41:23+00:00,Imagine u was meant to start a new job tomorrow but ur stepdad gets a positive covid test @ 11pm the night before :))
1349139422877519872,2021-01-12 23:41:18+00:00,Imagine you take the Covid vaccine and you end up turning into one of them zombies from Resident Evil
1349139410915373059,2021-01-12 23:41:16+00:00,"crazy day...
my parents are covid free! 🍾
my youngest has at least one inguinal hernia and needs surgery 😨
we've adopted two dogs and it's they first night at their new home 😍
we're going to lockdown again 😨"
1349139406284873729,2021-01-12 23:41:14+00:00,"As the virus death toll soars and are the worst since the war, police and public figures at last warn that Covid rule breakers face bigger fines and could be responsible for killing others. But these people still claim victims in hospital on TV, struggling for breath, are actors."
1349139399481700352,2021-01-12 23:41:13+00:00,How Y’all Let COVID Get Bigger Than Cancer.
1349139399255207937,2021-01-12 23:41:13+00:00,I’m sorry streams have been nonexistent. I took time off only to come back to three coworkers sick with covid and being super short handed at work. I’m working super long days and I have no energy when I am home.
