id,date,tweet
1305649677606350849,2020-09-14 23:28:35+00:00,someone i work with tested positive for Covid. they called me today at work. my job didn’t let me go home. they kept me and a couple others who got the same call. they told me they looked through the cameras and saw i wasn’t in close contact with her. happy bday to me ig.
1305649677539442689,2020-09-14 23:28:35+00:00,"Board member Jan Hammond moves that LR5 move forward with an Oct. 8 reopening date, which the board can reconsider if COVID-19 cases rise."
1305649651123589122,2020-09-14 23:28:29+00:00,"Sometimes I struggle with a mask on because I'm stupid and I don't regulate my breathing properly, so what do I do?
I still wear the mask, it's a few minutes of discomfort that I can live with. Covid-19 needs an entire machine to regulate your breathing."
1305649646354735105,2020-09-14 23:28:28+00:00,"T-minus 10 minutes to the first meeting of this fall’s The Science of Coping with COVID course, co-taught with @LisaShin16. Week 1 topic: thinking critically about COVID-19 data."
1305649626100445184,2020-09-14 23:28:23+00:00,2020 Covid Ridden FFL POWER RANKINGS:
1305649622774407168,2020-09-14 23:28:22+00:00,14/09/2020 19:28:22 Another American has died from COVID-19. #Every80Seconds
1305649619108388865,2020-09-14 23:28:21+00:00,".@ThomTillis takes pharma money, approves of rushing a #Covid_19 vaccine, and then accuses @CalforNC of undermining government process. 👀#Hypocrite"
1305649606030577665,2020-09-14 23:28:18+00:00,Covid test came back negative!✨
1305649585608519680,2020-09-14 23:28:13+00:00,"Four Horsemen of the #AmericanApocalypse:
Covid 19
Climate Change
Racial Injustice
Failed Economy

Who do you TRUST to take up the sword against them?
#BidenHarris2020Landslide"
1305649578159423488,2020-09-14 23:28:11+00:00,"Lol I remember when covid first started, mfs was out here mass purchasing toilet paper 😂 idiots"
1305649573789159425,2020-09-14 23:28:10+00:00,Horrible la vida con COVID
1305649569951133696,2020-09-14 23:28:09+00:00,"Well Farmers, be sure to vote for your president again! The one who’s complete lack of leadership fueled the fire that set us back in recovering from covid and led to the #WorldAgExpo being cancelled, cancelling lots of money for the Central Valley too. Great job!"
1305649568420229120,2020-09-14 23:28:09+00:00,Can you be my Covid.....and fuck my shit up
1305649554713464832,2020-09-14 23:28:06+00:00,"So let’s talk about “the mark of 2020” I got earlier. 🤦🏻‍♀️ As I was leaving work, we heard news that my supervisor tested positive for COVID-19. Sooo, here I go for the 4th time to get tested tomorrow. Positive thoughts/prayers are welcome. 🚫 🦠"
1305649526745624576,2020-09-14 23:27:59+00:00,Jill Biden’s Vote Boots Send a Strong Message. Biden will get out of the debates by claiming he tested positive for COVID-19 and need to be quarantined. Biden version of when caught LYING tell a BIGGER LIE. Verification testing by outside sources will NOT be allowed.
1305649525344800768,2020-09-14 23:27:59+00:00,"Maintaining friendships during covid, keeping up with a stream schedule &amp; having a full time job😱 shht is rough.

we just make it LOOK easy 😏👌🏼"
1305649508965969921,2020-09-14 23:27:55+00:00,Why doesn't Jason Wood MP spend some energy in trying to get his constituents in their hotspot to get tested and beat Covid-19 instead of bitching about the curfew while they are slowing everybody down? Because the Liberals are too busy gasbagging.
1305649501731016705,2020-09-14 23:27:53+00:00,"I have been going to a lot of protests as a way of protecting myself from covid infection. 
#endthelockdown #openschools #MAGA #POTUS"
1305649489961783296,2020-09-14 23:27:50+00:00,Not this white man driving by us test takers for COVID screaming “YOU ALL HAVE IT”. White people are truly the weakest link. Like how is that ever a joke?
1305649483888222208,2020-09-14 23:27:49+00:00,"planning an event for saturday that might be a total disaster. art in the age of covid, exciting times!"
1305649482990747649,2020-09-14 23:27:49+00:00,How do the government expect us to listen to and abide by their rules regarding covid when they literally JUST BROKE THE LAW I’m tired of this place
1305649479429877761,2020-09-14 23:27:48+00:00,Praying Randy Fichtner leaves New Jersey with some COVID-19 🙏🙏🙏
1305649470147883011,2020-09-14 23:27:46+00:00,"Monday's new cases of COVID-19 in DFW: Dallas County 139, Tarrant County 273, Collin County 238, Denton County 116"
1305649469342457858,2020-09-14 23:27:45+00:00,Had to close our bar because of smoke this weekend. First Covid closure now we’ve barely been open and smoke closures from the #OregonFires2020 #smallbusinessowners There’s no relief funds for small places. There’s no forgiveness on bills or loans. #SmallBusinesses
1305649453232160768,2020-09-14 23:27:42+00:00,"Climate change is attacking our western borders, covid-19 100's of mass murder level deaths across the country (#TrumpLiedAmericansDied),  Trump is absolutely useless. Our country needs a President to get the country together to do great things as a country. No more realTV"
1305649443472052227,2020-09-14 23:27:39+00:00,"Why do I keep hearing the Kamala Harris is the super spreader?

#COVID19 #Covid_19 #schoolsreopening #humor #FoxNews #CNN #realdonaldtrump  #Trump #virus #BidenRiots #BidenHarris2020ToSaveAmerica"
1305649433527414784,2020-09-14 23:27:37+00:00,We all just accepted the fact that nothing was ever disinfected until covid hit
1305649432860524545,2020-09-14 23:27:37+00:00,"Did you the crowd at trumps rally yesterday,those people standing there. It looked like a take from Village of the Damned.All of them standing there standing up&amp; clapping like seals at his every ridiculous word.pathetic.If they get covid lets see how much he gives a crap abt them"
1305649420332130304,2020-09-14 23:27:34+00:00,Im only a few videos in the contact tracing course by johns hopkins on coursera but this beginning part should seriously be what every student has to go through instead of the covid-19 training they gave us
1305649416297230336,2020-09-14 23:27:33+00:00,"Just learned of another death of someone I know. Can’t say anything specific until there’s an official announcement. Not due to COVID, but doesn’t matter. Too much death. Too much tragedy. Too much loss. Much much too close to home. It’s all so surreal. Sigh."
1305649412966940674,2020-09-14 23:27:32+00:00,".@ALPACanada #pilots know airlines need support now! Tens of thousands of aviation jobs are at risk of disappearing forever, as are the airlines Canadians depend on! What is your plan @JustinTrudeau @cafreeland? #COVID"
1305649409682743297,2020-09-14 23:27:31+00:00,"#CFISD Pre-K teacher my team has not been asked for its input since March. I have one student being referred for COVID-19 testing today. ""My partner is having to teach Zoom out of a closet. I can not protect my students from COVID under these situations."""
1305649403471048706,2020-09-14 23:27:30+00:00,"Passengers travelling to #Ghana will from Tuesday, September 15 be required to pay online for the mandatory COVID-19 test at Kotoka International Airport prior to boarding of their flight."
1305649381589364738,2020-09-14 23:27:25+00:00,no @ThomTillis wouldnt take the covid vaccine stop lying to north carolinians. we are not stupid
1305649381358669825,2020-09-14 23:27:24+00:00,"We know 180,000 deaths is a lie. We know, in reality, it is about 6% of that number.
🤔 🧐
2.2 million deaths were projected = 
Donald Trump’s Covid 19 response 
SAVED THE LIVES OF 2,189,200 people
You’re welcome."
1305649377202057221,2020-09-14 23:27:23+00:00,"When it comes to Covid, I listen to doctors. When it comes to climate change, I listen to scientists. When it comes to @realDonaldTrump, I just don't listen."
1305649367806889985,2020-09-14 23:27:21+00:00,"Some good news for your timeline!

Both of my grandparents, both being high risk (my grandfather at a much HIGHER high risk) are now fully recovered from Covid!

They're feeling great, &amp; back to their normal work days and fishing trips♥️"
1305649359019630592,2020-09-14 23:27:19+00:00,Cal Cunningham just told North Carolina he would not take the COVID vaccine if approved by the FDA.  #ncsen #ncpol
1305649353114165251,2020-09-14 23:27:18+00:00,"Cdn airlines have a $35B economic footprint and employ 50,000 people directly, including 5500 @ALPACanada pilots. @JustinTrudeau @cafreeland your lack of targeted support for Cdn aviation is putting ALL of these jobs at risk! #COVID"
1305649343995809792,2020-09-14 23:27:16+00:00,"I could be going to the events I most likely would’ve gone to before covid but I don’t because the only person I usually hang out with is immunocompromised, so I’m not about to risk affecting her health as I’d rather hang out with her than be around loads of people. She’s never +"
1305649338014740480,2020-09-14 23:27:14+00:00,"8 episodes into the Spurs doc and the first, the very FIRST mention of Arsenal is Arteta’s confirmed Covid case 🥴😭
Hate these man uno 🤣🤣"
1305649334562717697,2020-09-14 23:27:13+00:00,Honestly I’m so glad I get tested for covid for free at my job
1305649321396842496,2020-09-14 23:27:10+00:00,"Cal Cunningham says he'd be ""hesitant"" to take an FDA-approved COVID-19 vaccine. Cunningham was for the science before he was against it. He'll say anything to win, even if it's dangerous. #ncpol #ncsen"
1305649294167347200,2020-09-14 23:27:04+00:00,"2/2 “What I like most of all is you going here, there and everywhere, mixing with strangers whose health history you don’t know, and basically breathing in the same air and touching the same things, in confined spaces, so that I am at my superspreading best!” Love #Covid 🦠"
1305649287678898179,2020-09-14 23:27:02+00:00,14/09/2020 19:27:02 Another American has died from COVID-19. #Every80Seconds
1305649285782855681,2020-09-14 23:27:02+00:00,"Before covid, I do have a lot of plans for the future; traveling, making money, having a stable job, relationships, etc. But God reminded me to slow down, to focus on what truly matters...and that is my relationship with Him. God is saying, ""My Child, let me be your priority."""
1305649279407620096,2020-09-14 23:27:00+00:00,Could alcohol kill covid?
1305649273489575937,2020-09-14 23:26:59+00:00,Anyone who has had someone affected or died by COVID knows that 313 up from 200s daily previously is concerning!
1305649272914935809,2020-09-14 23:26:59+00:00,Covid has been going on for so long i lost weight and gained it all back
1305649263469162497,2020-09-14 23:26:56+00:00,Covid can chupa mis fatass webosssssss
1305649247799275520,2020-09-14 23:26:53+00:00,"In response to COVID-19, we have been putting together a strategic recovery plan. This plan aligns the local government, tourism industry, and residents around a shared vision for the future. Meetings like tonight help us reach a cohesive plan! #TownHallCC #CorpusChristi"
1305649227075260417,2020-09-14 23:26:48+00:00,cant wait till 20 years from now kids will be like XDD XDD XDD CORONAVIRUS and then we'll say NOOOOOOOOO DONT MAKE FUN OF COVID-19 IT WAS A SEERIUS THING &gt;:(((
1305649226337202180,2020-09-14 23:26:48+00:00,"Why is COVID-19 so hard to understand? Covid in Community = Bad. Covid in Care Homes = Bad. Covid in Schools = Bad. Prolonged periods in confined poorly ventilated rooms with lots of kids = Bad. Poor hand hygiene = Bad. So it’s 2m plus, Wear an n95 Mask, Wash Hands, Avoid Schools"
1305649222880952320,2020-09-14 23:26:47+00:00,"Can't interact inside bc of COVID, can't go outside bc of Wildfires. Great times had by all!!"
1305649211669700609,2020-09-14 23:26:44+00:00,I am asking for prayers for my friend Abel. Local restaurant owner. Just found out he is on a vent with COVID.
1305649198314983424,2020-09-14 23:26:41+00:00,I am angry my mother has tested positive for COVID all because @realDonaldTrump refused to use the pandemic plan to save American lives because it was made by a black man he hates. @SenateGOP your failure to remove Trump for his crimes has led to genocide and you don't care.
1305649198088495104,2020-09-14 23:26:41+00:00,"Democrat Senate candidate @CalforNC is casting doubts on any COVID-19 vaccine, including saying he would be hesitant to take it. I'm no fan of @ThomTillis but that was shameful.
#NCSenateDebate"
1305649183718879234,2020-09-14 23:26:37+00:00,"Like Covid-19, global warming has been conquered, not by science, but by royal decree. ""It'll start getting cooler, you just watch,” says the chosen one."
1305649181340639233,2020-09-14 23:26:37+00:00,my best friend has tested positive for covid and so not only am i going to be teaching while on ‘mental health’ watch i also have to be monitoring my body because since her husband is a cop and works i help with her kids all the time. my life is a joke.
1305649178291220480,2020-09-14 23:26:36+00:00,I think that all Americans that don’t want to wear a mask should receive the first round of covid vaccines. Hell knows I don’t want to be first. But by all means Karen you wanna be first in line 👋🏼
1305649167381991426,2020-09-14 23:26:33+00:00,"Pakistan 🇵🇰 is opening educational institution tomorrow,parents are requested to train their children against covid-19 (precautions) and its serious effects.

Schools must act responsibly to make sure children’s safety and health.
Best wishes !!"
1305649159580659715,2020-09-14 23:26:32+00:00,"“It’ll start getting cooler” as a way to fight the fires on the west coast is a rehashing of covid “with the heat, as the heat comes in, typically that will go away in April.”"
1305649153754771456,2020-09-14 23:26:30+00:00,If I die of covid people have permission to trebuchet my decaying corpse at a university dean's house.
1305649151825281025,2020-09-14 23:26:30+00:00,Stop using Covid-19 as an excuse for poor customer service
1305649148511752192,2020-09-14 23:26:29+00:00,Before covid I didnt have to make videos or take pictures of myself but now the 'normalizing' of distance communication is forcing us all to reckon with physical images of ourselves. Interesting.
1305649137799639046,2020-09-14 23:26:26+00:00,I’m so scared to see people man this COVID sh*t serious
1305649130950201344,2020-09-14 23:26:25+00:00,"And here is our COVID-19 report from the weekend, including a new fatality from Camarillo (6 in total from the county). Please stay safe, everyone."
1305649130224717824,2020-09-14 23:26:25+00:00,Some Trump supporters think Dr Fauci thinks America is doing well with Covid... no Dr Fauci doesn't think we have done well.  He has said we reopened many States too soon. Dr Fauci believes strongly in masks is totally against the large Campaign Rallies Trump is doing.
1305649129754951681,2020-09-14 23:26:24+00:00,"those “you will be missed” texts when you say no to indoor, unmasked, multiple person hang outs during a pandemic while people are still dying..
..you will also be missed when you get COVID"
1305649118543523840,2020-09-14 23:26:22+00:00,"Ugh I love Walmart Pickup so much, like being able to order what I need online and then picking it up is so convenient, especially with COVID-19. Plus I can use my EBT card also so I don't have to go inside and deal with annoying people haha."
1305649106153385984,2020-09-14 23:26:19+00:00,I wish that the us president WOULDVE DONE HIS JOB AND TAKE CARE OF THIS COUNTRY BY ACTUALLY CARING ABOUT PPL &amp; COVID AND MADE A MANDATORY LOCKDOWN SO WE COULD BE LIVING LIFE LIKE OTHER COUNTRIES I HATE IT HERE
1305649104505065472,2020-09-14 23:26:18+00:00,Welcome to 2020 when I have COVID and AirQuality dashboards open on my desktop
1305649102961532929,2020-09-14 23:26:18+00:00,"idc what y’all say , covid is REAL"
1305649096489828358,2020-09-14 23:26:17+00:00,"my dad says even if 1 million people were saved from dying of covid, it isn't worth the measures (masks, quarantine, etc) and i just cant explain it to him that no amount of money is worth 1 million human lives."
1305649081155350529,2020-09-14 23:26:13+00:00,"I wish Morrison would stop praising Victorians for the fantastic, difficult job they are doing to bring Covid numbers down.😜.  #hanginthereVics"
1305649073219751937,2020-09-14 23:26:11+00:00,For some wiiiiild reason i felt like running today ... but this air quality is probs worse than covid so ima jus stay on the couch
1305649058921541635,2020-09-14 23:26:08+00:00,Puto covid
1305649053242449927,2020-09-14 23:26:06+00:00,"I started in Texas 213 days ago, and that time flew past (mostly because COVID-19 feels weird) but now we only have 50 days before E-Day.

I don't want to wake up the day after the election wishing I could have done more, and I don't want you to feel that way either."
1305649048175751169,2020-09-14 23:26:05+00:00,i hope whatever’s happening at the shore house today is worth getting covid for 🥰
1305649047869497345,2020-09-14 23:26:05+00:00,Trump the false prophet: “It will get cooler” (no global warming); “one  day it will just go away” (COVID-19); “just take the forest floor” (California fires). #StableGenius
1305649014151483393,2020-09-14 23:25:57+00:00,In  the last 4 days  counting today there  have been about 400 fewer reported covid deaths than reported in  the previous 4 day period.  A tiny bit of good news.
1305648993624621056,2020-09-14 23:25:52+00:00,"Over 300 new cases of COVID-19 in Ontario today. These numbers are very concerning and are not far off what we experienced during our very difficult Spring. We can beat this thing again - however, please do your part #SocialDistance"
1305648972418162688,2020-09-14 23:25:47+00:00,.@CalforNC just inferred that a Covid vaccine will be rushed to market because @SenThomTillis took donations
1305648955070517249,2020-09-14 23:25:43+00:00,"BANNER STORIES (Tue • 15 Sept)

THE PHILIPPINE STAR
Task Force to review transport distancing

PHILIPPINE DAILY INQUIRER
Drilon sees overprice in gov't testing kits

MANILA BULLETIN
State of Calamity may be extended due to COVID"
1305648951698259969,2020-09-14 23:25:42+00:00,14/09/2020 19:25:42 Another American has died from COVID-19. #Every80Seconds
1305648941543940097,2020-09-14 23:25:40+00:00,Everyone claims they’re from Toronto till covid cases start to rise🧐
1305648940721876992,2020-09-14 23:25:39+00:00,covid has been around for months and yet im STILL not use to bringing a mask to the store i constantly forget and have to turn around back home to get one
1305648926113042432,2020-09-14 23:25:36+00:00,If you!! have symptoms!! of covid!!pls!! stay!!!! HOME!!!!!!
1305648915384078337,2020-09-14 23:25:33+00:00,"Many of the students &amp; families I work with are losing loved ones to COVID. So cherish the people you care about, tell them you love them, hug them a little tighter today, &amp; pray that God keeps them safe and healthy. 🥺❤️🙏🏾"
1305648909314748416,2020-09-14 23:25:32+00:00,Y/day I overheard some typical Covid ignorance.🙄 Today’s msge from #COVID19🦠: “I don’t care if you have the crappy ‘app’ or if you are in a cafe/bar/restaurant that tells you you’re ‘Covid safe’ bc you have left yr personal details exposed on a piece of paper on a counter.” 1/2
1305648861369839618,2020-09-14 23:25:20+00:00,"if Halloween was a thing this year (it most certainly will not be), I would dress as Paul Rudd in his ridiculous Covid-19 PSA video"
1305648858723123200,2020-09-14 23:25:20+00:00,Went on a @TUIUK flight today. If you are worried about covid then I would advise NOT to fly! No distancing. Most people with no mask on on the flight (not even eating) and then they insult the crew but nothing happens. I had this mad idea there would be rules people stuck to.
1305648857829830656,2020-09-14 23:25:20+00:00,"Medivac overhead, when I hear them now all I think is COVID"
1305648857787793408,2020-09-14 23:25:20+00:00,"Smart watches &amp; smart bands need to have thermometer, especially after covid 19.
If any brand did it in their last edition, it 'd be appreciated by people and many health agencies and it' d market itself without any effort."
1305648836019453952,2020-09-14 23:25:14+00:00,"A man who speaks in black and white - an administration always escalating the next confrontation -always breaking the glass. 

A person fit for the presidency would speak to COVID in the tone of every president has to alert and rally Americans to a common cause. @GOPChairwoman"
1305648832563359744,2020-09-14 23:25:14+00:00,My sat keeps getting cancelled bc covid but one of the schools I’m applying to requires sat w essay ??? ??
1305648812938022913,2020-09-14 23:25:09+00:00,Imagine if Covid is just the beginning............
1305648802003595272,2020-09-14 23:25:06+00:00,COVID results came back negative 🙌🏾
1305648797700075521,2020-09-14 23:25:05+00:00,Joe Biden Flip Flops on COVID-19 Prove He’s Incapable of Leading During the Pandemic
1305648792985890818,2020-09-14 23:25:04+00:00,.@MayorPtbo says there are ppl who like the new routes - it's not all dissatisfaction. And the route changes came from the need to be in compliance with provincial COVID legislation.
1305648789315706880,2020-09-14 23:25:03+00:00,this covid outbreak in my school....... if I have to go to school tomorrow🙄
1305648786253860864,2020-09-14 23:25:03+00:00,"100 days before CHRISTMAS, Covid-19 free world please."
1305648780327497728,2020-09-14 23:25:01+00:00,So many of my friends got the covid vaccine I’m like 👀
1305648775805972480,2020-09-14 23:25:00+00:00,Bro all these stupid uni kids who are going out and partying and school JUST started? Bro I HOPE you get covid. So freaking selfish and stupid. How did someone do dumb get into university? Like wooooow
1305648758340890625,2020-09-14 23:24:56+00:00,"So if you’ve been infected with Covid and your county calls you, answer it because they are trying to give you new information about you having Covid."
1305648746785656832,2020-09-14 23:24:53+00:00,Trump is just gong all over our country trying to kill more ppl with covid. Hasn’t he killed enough already???
1305648721020018688,2020-09-14 23:24:47+00:00,It’s really infuriating to hear the mayor refer to COVID as “a very temporary reality” when myself and so many others are still trying to process the death of loved ones who died from it. Trauma and grief are far from temporary.
1305648706192986112,2020-09-14 23:24:43+00:00,"I can never post on... Hey who are you HEY COVID STAY WAY BITC GET AWAY *dies*

The person you know as coio had died to me"
1305648703307472897,2020-09-14 23:24:43+00:00,and btw we literally shouldn’t be going to school at all idk what’s the issue with online classes like bae... spain’s been having its worst ever covid stats the past few days and like we’re still going to school ?!1!1??? make it make sense
1305648687364763648,2020-09-14 23:24:39+00:00,"Everytime I hear the word magical/magic, etc. now I think in the negative...you know magically Covid-19 will disappear"
1305648668578635779,2020-09-14 23:24:35+00:00,"Cunningham saying he won't take a vaccine for COVID-19?
Because Trump.

#NCSenateDebate #NCsen #NCpol"
1305648657690230791,2020-09-14 23:24:32+00:00,"1/ THREAD. Today I saw my pulmonologist for a follow-up on the state of my lungs, almost six months to the day when I got hospitalized with #COVID19 (3/16), and three months after my last check-up (6/8).

#COVID19 #COVID #Covid_19 #coronavirus"
1305648647820980227,2020-09-14 23:24:30+00:00,"if the government won't tell us what really happened at JFK's ""assassination"" what makes you think they'll tell the truth about COVID-19 in years to come or even now ???"
1305648646503960576,2020-09-14 23:24:29+00:00,"If you are going to base your support for Donald Trump on his science knowledge...Covid, wildfires, climate change, nuking hurricanes, wind turbines causing cancer...you are signing, not your death certificate, but your kids and their kids death certificates."
1305648643668668416,2020-09-14 23:24:29+00:00,"#mask perk = putting your mask back on is a great way to signal you’re ready for the check. 
#covid"
1305648643173691395,2020-09-14 23:24:28+00:00,"I feel so uncomfortable here I just want to leave,,,,,, it's really pulling me away j muss being in asia so much. It was already bad after I left china but ever since I left seoul and even more because of covid I feel so locked in and I just want to get away already"
1305648616200118278,2020-09-14 23:24:22+00:00,14/09/2020 19:24:22 Another American has died from COVID-19. #Every80Seconds
1305648608264454144,2020-09-14 23:24:20+00:00,Hamburglar instagramming Lucy's psychiatric advice stand. (with COVID-19).
1305648603520577536,2020-09-14 23:24:19+00:00,"Yes, the Earth will continue to orbit the sun. And yes, it will become fall in the Northern Hemisphere. And “It’ll start getting cooler.” But the seasons and climate change aren't the same thing, Mr. President. Denying the climate crises is a lot like denying COVID: It's deadly."
1305648603390783491,2020-09-14 23:24:19+00:00,Hi @BBCHughPym Have you done the Public Health story of how the @bbc is cutting the Scottish Government's excellent Covid briefings that many Scots rely on for clear info &amp; understanding WHY new rules &amp; give strong caring leadership which has engendered trust and high compliance?
1305648590690201601,2020-09-14 23:24:16+00:00,To all the anti lockdown people. Victoria has turned it around and had no deaths yesterday. I’m proud of our State. #Covid_19 #auspol
1305648587632791555,2020-09-14 23:24:15+00:00,"WHOA. @CalforNC expresses skepticism over a COVID vaccine. Dangerous conspiracy theories all over the place.

Incredibly irresponsible. #NCpol #NCsen"
