id,date,tweet
1318341133752217608,2020-10-19 23:59:54+00:00,Since covid start meen hear one of them cases went to a gym... Open up the gyms nah 🙄🙄
1318341070069977088,2020-10-19 23:59:39+00:00,What if I went to Tucson at 7am to get a covid test lol
1318341061023010816,2020-10-19 23:59:37+00:00,"Last 2 weeks, the Bills completely unprepared and flat. 100% on the coaches. They let the covid crap get to them and couldn't adjust. Very disappointing. But hey, we have the Jets so that can be boost"
1318341032560390144,2020-10-19 23:59:30+00:00,"This weather and my allergic rhinitis are not friends. I don't have covid, I'm just allergic to literally everything. 😭"
1318341031935545345,2020-10-19 23:59:30+00:00,"Trump's Covid response
Jan: Totally under control
Feb: Goes away by April
Mar: It will go away
Apr: Light at the end of the tunnel
May: We have prevailed
Jun: It's fading away
Jul: We're in a good place
Aug: It's under control
Sep: We're rounding the corner
Oct: *220,000 deaths*"
1318341007923085314,2020-10-19 23:59:24+00:00,Why do stores do resets during a pandemic? I don’t want to spend extra time in any store right now trying to shop for what I need. @AldiUSA could this have waited til COVID slowed down?  #IdiotsInCharge
1318341004261404672,2020-10-19 23:59:23+00:00,"So @SenTedCruz and 5 GOP Senators can spend time writing a Constitutional amendment that will never pass, but couldn’t lobby for a COVID relief package.  OK!"
1318340997491920900,2020-10-19 23:59:22+00:00,"Look, if you told me a month ago the #Bills would go 2-2 vs LAR, LV, TEN &amp; KC with two games rescheduled to random dates/times because of COVID-19—I’d be fine with it. Onto New Jersey. #BillsMafia"
1318340984602841088,2020-10-19 23:59:18+00:00,"Josh Allen hasn’t been the same since the COVID bye week. 

Conspiracy: The Titans contracted COVID to kill the Josh Allen 4 MVP movement."
1318340978206441472,2020-10-19 23:59:17+00:00,Christopher Cross is on @OutFrontCNN . Wonderful singer/songwriter. He had Covid and could have died. I love “Sailing”. So beautiful. 🎶. God bless.
1318340973819297798,2020-10-19 23:59:16+00:00,Bitch I Am COVID-19 ‼️
1318340936489967617,2020-10-19 23:59:07+00:00,"Donald trump keep minding your business oo if na the other fool now en go run go wish am speed recovery for covid-19 ""asan eniyan""
""nla fun ohunkohun""

Yahaya Bello"
1318340931918188544,2020-10-19 23:59:06+00:00,"Covid-19 status as of October 19, 2020 , Time : 05:29(Indian Standard Time)
Total Cases : 7,594,284 (+46,046)
Total Active Cases : 748,670
Total Deaths : 115,235 (+593)
Recovered Patients : 6,730,379 (+70,484)
Tests done till now : 95,083,976"
1318340926381592577,2020-10-19 23:59:05+00:00,Wala akong right mag shifting dullness. Hahah from covid areas to clean areas. Parang nalimutan ko na mag manage ng other cases aside from covid and its complications. 🤭 carry on
1318340925941112833,2020-10-19 23:59:04+00:00,puto covid
1318340913429557248,2020-10-19 23:59:02+00:00,Remember when your president had you guys thinking covid was only gonna last until July/August… pimpin ain’t fuckin easy  🎃
1318340912783699968,2020-10-19 23:59:01+00:00,"""In August the Lancet published an analysis of data from 50 countries. The researchers found that full lockdowns were 'not associated' with decreased mortality from Covid-19. These are hard outcome data; reality cannot be waved away with theories or projections."" Dr Matt Strauss"
1318340883905994753,2020-10-19 23:58:54+00:00,"Aye man, I was shaking my ass a little bit yesterday and ummm thang was muvin 👀. Its been too longgg, so thereforth I'm cutting up at the fifth function once covid let up.... gotta make sure its really gone ya know🥴🙂"
1318340875768852480,2020-10-19 23:58:53+00:00,"Hi! I have a job interview today and I’m so excited but scared cause I need this job so badddd. Cause of COVID I haven’t worked for like 6 months and I’m desperate. 

Pls pray for meee🥴💗"
1318340874158379009,2020-10-19 23:58:52+00:00,"I wonder how every sickness/cause of death has been near cured this year except COVID-19. 

Death by flu, heart attacks, aneurysms, strokes, accidents in general, are all low when compared to the years before. 

I’ll let you judge for yourself. 

#COVID19 #Trump #Trump2020 #KAG"
1318340866080210955,2020-10-19 23:58:50+00:00,"Derrick Henry had more total yards, than the Bills did. You still have to fee for #BillsMafia though. If the #Titans would have just found a cure for COVID, Allen wouldn’t have thrown a pick to end the game. Sad."
1318340859079917572,2020-10-19 23:58:49+00:00,"this christmas, the naughty list is canceled due to the COVID-19 pandemic"
1318340840578834432,2020-10-19 23:58:44+00:00,"Senate Republicans proposed a bold measure to address hunger in the wake of COVID.

They want to make business meals 100% tax-deductible instead of 50%."
1318340832928280577,2020-10-19 23:58:42+00:00,my parents said after covid i can babysit/dogsit hell yeah i get to hang out with dogs and kids a n d get paid
1318340826729205765,2020-10-19 23:58:41+00:00,yet another day of “is it allergies or is it covid?” fun fun fun
1318340818592321538,2020-10-19 23:58:39+00:00,Tired of dumbass people 🙄  do your research before you talk politics while we’re in a COVID crisis and y’all master is making a mockery out of it
1318340796681228290,2020-10-19 23:58:34+00:00,"Covid-19 update Oct 19

Closed cases 67.71 %   5,682,396  down .04 % first time ever !
Open cases   32.28 %   2,705,394  up .03  % 

daily # (total) : 
deaths                 441  (  2.6 %) 
recoveries       36,852  ( 96  %)  
closed             37,293
new                59,452"
1318340794915368961,2020-10-19 23:58:33+00:00,If you need a free Covid test Walgreens is doing them
1318340790062665728,2020-10-19 23:58:32+00:00,So glad my mom was able to come by and clip my ends . COVID got me doing my own hair 🥴
1318340788598734848,2020-10-19 23:58:32+00:00,"COVID-19 paralyzed Christopher Cross, but people are tired of hearing about it."
1318340788321804288,2020-10-19 23:58:32+00:00,Nimrod. I am all in on America. This is supporting America?? Deal in facts. Under @realDonaldTrump - COVID 220K dead going to 400K; 6.8 T more debt; tripled deficit; Deficit&gt; GDP for GDP; divided country; accelerated global warming. This whi I am voting for @joebiden
1318340755144966145,2020-10-19 23:58:24+00:00,"I have my reasons for not wanting to celebrate Halloween. 

Until this year, they all been based on me being an introvert and a kill-joy. Now, I can blame COVID-19."
1318340751353327616,2020-10-19 23:58:23+00:00,"Well it’s been a hell of a year at Central... from losing our best coworker, keeping hundreds of patients alive through Covid, our hurricane sleepovers &amp; weekly cook offs.. best job I’ve ever had hands down, sure gonna miss this hell hole 😕"
1318340722790195200,2020-10-19 23:58:16+00:00,Maybe we can get back into a rhythm now that the COVID scheduling carousel is *hopefully* over for a bit. Just have to play better. #BillsMafia
1318340721141813248,2020-10-19 23:58:16+00:00,"As @MeishaPorter eloquently points out, we are facing two pandemics, COVID-19 and systemic racism. COVID-19 is our current problem, but we can not forget to continue fighting against our persistent problem of systemic racism #MultiEdLeader @nancybgutierrez"
1318340703852822530,2020-10-19 23:58:12+00:00,#covid smovid....  the banned #babyitscoldoutside and the song of #2020 is #wap ???  Not like I dont vibe to wap but damn... baby it's cold outside.  #cardib #HipHop #
1318340699071291393,2020-10-19 23:58:10+00:00,"If  you pick the most disgusting person in the world right now, who would it be?

@realDonaldTrump Hands down winner.
220,000 dead by incompetence
Economy in the sh*tter
Covid rampant &amp; no plan
Panders to militia nutters, jerk
Crybaby Moron blames everyone else.
#MAGA @FoxNews"
1318340697272049664,2020-10-19 23:58:10+00:00,"Covid-19 cases U.S.Oct 19

California:878,141
Texas:875,582
Florida:756,727
New York:520,886
Illinois:350,748
Georgia:341,310
North Carolina: 247,172
Tennessee:232,061
Arizona:231,897 
New Jersey:224,980
Pennsylvania:188,409
Ohio:183,647
Louisiana:175,982
Wisconsin:173,891"
1318340693396496387,2020-10-19 23:58:09+00:00,"Caller now wants to know if school will pay for medical costs for sick COVID kids. Yes, sure...Just as they did when kids got the flu or the chicken pox or menigitis before. It will work just like that. 👌"
1318340670835261441,2020-10-19 23:58:04+00:00,"Even if homegirl was wrong about covid cases in Tulum, the US Embassy says it’s “level 4-do not travel to Mexico.” Then there’s a warning of heightened murders &amp; kidnapping. Now I can’t even lie...I was going too. But level 4, don’t travel was enough for me. Not homegirl’s tweet."
1318340666695450624,2020-10-19 23:58:03+00:00,i want a spooky day to go to the pumpkin patch but school and covid said no❤️
1318340665244229632,2020-10-19 23:58:02+00:00,Okay the Covid test I took today.. the nurse just shoved it down my throat 😭 it hurt
1318340658462138368,2020-10-19 23:58:01+00:00,"Do Your Politicians Understand The Real Health Threat?
What is your opinion about your current local administration and/or your central administration/government concerning the COVID pandemic? Have they understood the importance of COVID-19 for the citizens' health or"
1318340656914296832,2020-10-19 23:58:00+00:00,y’all realize that covid is gonna be around for so much longer bc the country decided to adapt to it instead of actually try to cure it ? embarrassing
1318340655123410944,2020-10-19 23:58:00+00:00,"#fcsdboardaction Approve hazard par for our food service individuals who served meals during the school closures due to COVID-19.  Total cost would be $17,735.55. Pass 7-0"
1318340654716669953,2020-10-19 23:58:00+00:00,"Undoubtedly, only hate exist in Trump and his supporter! He deliberately killed and led tens of thousands of people to positive COVID-19 infections. So heinous, barbaric &amp; unforgivable! No good lives in them; just sowing evil, yet karma dictates evil to come back around for them!"
1318340641991131137,2020-10-19 23:57:57+00:00,"So the masks are working? 🤔 😎

Arkansas COVID-19 numbers:

Total number of positive tests: 99,664
Total number of recovered cases: 88,450
Total number of deaths: 1,714
Total number of active cases: 7,621

#TheDateDoctor
@JimStipeDateDoc"
1318340641907068928,2020-10-19 23:57:57+00:00,"1/2 Are you ready for the last round? 
See you on Saturday, October 24 for the last part  of the 20th Annual Symposium Webinar Series, ""3Cs: Culture Collections and COVID-19"" from 1pm to 4:30pm with the topic “Establishment of the Virology Science and Technology"
1318340615831130112,2020-10-19 23:57:51+00:00,Covid prevented NE from being in 1st right now
1318340605425127424,2020-10-19 23:57:48+00:00,Has anyone been keeping track of how many registered Democrats vs. registered Republicans have died from covid in the US? Just curious if such data is available.
1318340593081307137,2020-10-19 23:57:45+00:00,The fact that I can’t go to a @steelers football game this year bc of covid &amp; limited seating breaks my heart in half ☹️☹️
1318340584696930305,2020-10-19 23:57:43+00:00,"Four Corners Health (Seward, York, Butler, Polk) reports 1,228 cumulative COVID-19 cases since March. 38% of those have been in the past 14 days; 23% in the past 7.#Nebraska"
1318340575058366466,2020-10-19 23:57:41+00:00,These pro Biden commercials are nauseating they lie. How can an educated Doctor equate control of Covid with any presidential candidate. How is Biden going to get Covid under control? He can’t just more democratic propaganda.
1318340572646572032,2020-10-19 23:57:40+00:00,"Hey @ASlavitt , what happened to the cheap and quick saliva COVID tests that seemed real-soon-now a month or two ago?"
1318340563591139329,2020-10-19 23:57:38+00:00,Covid is real! Praying for my sister!😥
1318340531731062789,2020-10-19 23:57:31+00:00,"The @CPC_HQ is really the COVID-Idiots Party of Canada, and the @UCPCaucus is the United COVID Pants 👖 party."
1318340528363155463,2020-10-19 23:57:30+00:00,Want to see the covid South Park
1318340520498909186,2020-10-19 23:57:28+00:00,Thanks Jamie from JRE for getting Covid and cancelling all of Rogans podcasts this week. I can only listen to the Mike Tython epithode so many times
1318340497945948160,2020-10-19 23:57:22+00:00,"#Louisiana
Hurrah! Thank you very much, President Trump!

The casualties of the atomic bombs by the end of 1945.
 Hiroshima  140,000
 Nagasaki    74,000
 The sum    214,000

The deaths of COVID-19 in the US  220,000 (Oct19)

We've revenged the A-bomb victims with your help."
1318340435576750081,2020-10-19 23:57:08+00:00,I've tested negative the past three COVID tests but I get more and more worried with how many people in Iowa act like this shit doesn't exist. I feel like it's only a matter of time because of it.
1318340425552400385,2020-10-19 23:57:05+00:00,"lol love 2 be trying to figure out pharmacy internships in the time of covid. idk where i’m gonna be living next semester and there are very limited options for places to intern whether i’m near campus or not, and only 1 of the 6 places near family is available!"
1318340399996506113,2020-10-19 23:56:59+00:00,"Remember when People sold £5 notes cause they were part of the first batch? That's why we have Covid, god is punishing everyone who was dumb enough to buy one"
1318340382489497601,2020-10-19 23:56:55+00:00,"As soon as I came home to be treated for my injury, COVID popped off in Morris. God always has a plan."
1318340380929236998,2020-10-19 23:56:55+00:00,Just got a notification saying I’ve been exposed to Covid but I literally haven’t left the house for 3 weeks and none of my household have had it I-
1318340309743366144,2020-10-19 23:56:38+00:00,"Please, if you’re still in denial about COVID19, talking about it’s a hoax or I don’t have to wear a mask, please, please visit your local hospital and ask for the covid ward and talk to any patient, without a mask of course. #ConspiracyTrump #COVID19 #vote #WearAMask #covid"
1318340296531378183,2020-10-19 23:56:34+00:00,"Lied about wealth
""Mexico will pay for it""
Longest Government Shutdown
NO Health Plan to replace ACA
Highest unemployment
Locking up kids
Impeached
Covid Response
Will not outright denounce white supremacy

#TrumpIsANationalDisgrace
#TrumpReminders
#Trumpisajoke"
1318340273785679872,2020-10-19 23:56:29+00:00,Always assuring to know Covid hasn’t gotten in the way of my upstairs neighbor’s nightly stomp-around.  Still jonesing for her to bust out the vaccuum tho...
1318340272665788418,2020-10-19 23:56:29+00:00,That COVID test ain’t it 😭
1318340257704718336,2020-10-19 23:56:25+00:00,i was 2 days away from seeing you before covid @zillakami @BaBySleezzz
1318340245088313349,2020-10-19 23:56:22+00:00,"The offices for the Chicago Fraternal Order of Police, the Chicago police’s largest union, has been closed after one of its officials tested positive for COVID-19, according to the FOP."
1318340215245864960,2020-10-19 23:56:15+00:00,"Driving the other night, window down, I was dreaming about a time in the future: COVID is over. American democracy has stabilized a bit. I’m outside at a bar at a conference... dancing, laughing, and hugging... ALL the political scientists. 
ALL OF YOU.
I cannot wait.
❤️❤️❤️❤️"
1318340206358036482,2020-10-19 23:56:13+00:00,How in the hell did GOP agree to same stupid topics for debate. I am SICK of Covid- it’s such a dimocrat  talking point
1318340196635738112,2020-10-19 23:56:11+00:00,Some dude in the steam room sneezed and told me “don’t worry it’s not Covid”
1318340186904952837,2020-10-19 23:56:08+00:00,Looking for advise how to help a quarantined friend sick with Covid single mom of 2 tweens in another state.
1318340184409296896,2020-10-19 23:56:08+00:00,"join us live @AuroraPrize_ event: 
beautiful tribute to the heroic frontline Covid-19 responders at Elmhurst Hospital in Queens. our very own @IlwadElman and our Executive director Fartuun Adan are also being honoured as winners of the 2020 #AuroraPrize."
1318340164356169728,2020-10-19 23:56:03+00:00,COVID-19 made me never take going outside for granted ever again. When this pandemic is over I’m going out with friends 24/7 and experiencing life to the fullest
1318340152792616961,2020-10-19 23:56:00+00:00,My boi rob had covid I’m glad he is good now
1318340143573618688,2020-10-19 23:55:58+00:00,"but did he really have COVID 

I'm just stuck there."
1318340142688600065,2020-10-19 23:55:58+00:00,This lady just went off of me because I told her she had to take a Covid test 😅 why is this my life
1318340119393349632,2020-10-19 23:55:52+00:00,Where are all y’all wearing your Halloween costumes this year? I’ve been pretty confused by the Halloween costume discussion in the midst of COVID. #covid19
1318340115203198976,2020-10-19 23:55:51+00:00,It’s such a frustrating thing having to start all over at the gym. Fuck Covid 😫
1318340090540773376,2020-10-19 23:55:45+00:00,"“You turn on CNN, that’s all they cover: COVID COVID pandemic COVID COVID that’s all they cover. You know why? They’re trying to talk everyone out of voting. People are not buying it CNN, you dumb bastards,"" @realDonaldTrump thoughts on #COVID19 
#BidenHarris2020"
1318340075445387264,2020-10-19 23:55:42+00:00,People are sick of Covid. Yep and we won’t get better unless we elect someone with a plan that doesn’t include 6million dead
1318340067920908288,2020-10-19 23:55:40+00:00,"i really just read ""influencer of healthy lifestyle who denied COVID dies from it""
m a n. i should feel bad but this person's words must have endangered more vulnerable and less privileged people"
1318340062258581507,2020-10-19 23:55:39+00:00,Happy to report my COVID test came back negative today. Guess it’s just some kick-ass allergies. #blessed
1318340059146440704,2020-10-19 23:55:38+00:00,looks ripe for spreading covid
1318340052783607811,2020-10-19 23:55:36+00:00,"People are tired of hearing about Covid? No,  people are tired of burying their loved ones"
1318340052724973568,2020-10-19 23:55:36+00:00,"Dad tested positive for COVID, fuck me I guess"
1318340036606238720,2020-10-19 23:55:32+00:00,3) So all 4 quarantined themselves in the house together and guess what? No one else got sick! Remember how you were false positive tested? Enough is Enough! The Covid numbers are a lie and I falsely inflated! @GovMikeDeWine @MikeDeWine
1318340034790100998,2020-10-19 23:55:32+00:00,"covid-19 has the most poorly managed health crisis in the history of the world, too late for lockdowns in most countries in Europe and the Americas, the virus has gotten out of hand, expect to have sequelae in a few months especially for asymptomatic@"
1318340032080584704,2020-10-19 23:55:31+00:00,"I'm working the school concession stand with two nurses who bragged that they didn't change their behavior at all in light of covid. 

Thor take the wheel. 😨"
1318340029467529216,2020-10-19 23:55:31+00:00,The only person responsible for the horrible covid response in the United States is Donald John Trump.   Even if he accepts no responsibility we can all hold him 100% responsible by voting him out !!
1318340029241085952,2020-10-19 23:55:31+00:00,"My opponent and I were asked what grade the State of Oklahoma gets for it’s COVID reaponse.

As an ICU nurse who has held COVID pts hands for their last moments on earth I have seen the failures of our State since March.

I gave our State an F. My opponent gave the State a B-."
1318340023993868288,2020-10-19 23:55:29+00:00,"covid 19 is fake 
you are going to get sued
they have all the evidence to prove it"
1318340004444135425,2020-10-19 23:55:25+00:00,"National media lied about an ER in Italy, said it was in NY.  Then they lied about ""covid mass graves"" that weren't. 

What else have they made up they haven't been caught for?"
1318340003857076226,2020-10-19 23:55:25+00:00,"i hate our president SO MUCH he has really said that not everyone has to take the covid-19 vaccine, you can choose it to take it or not.

what the hell is wrong with him???"
1318340002389151746,2020-10-19 23:55:24+00:00,"One of the most insidious things about how COVID has unfolded is that it has become impossible to hide your political alignment.

Simply by wearing a mask or keeping your children out of school, everyone assumes your a democrat. Really strains the social fabric."
1318339987453116418,2020-10-19 23:55:21+00:00,can’t tell if my anxiety is bad or if i have covid haha
1318339974400409600,2020-10-19 23:55:18+00:00,Britney Spears is being held captive and all anyone wants to talk about is “covid this” and “covid that”
1318339973502783488,2020-10-19 23:55:17+00:00,The NFL selling officially licensed face masks made of mesh is 100% a perfect metaphor for how they have been handling COVID.
1318339971921682433,2020-10-19 23:55:17+00:00,Christopher Cross had Covid 🥺
1318339935057883136,2020-10-19 23:55:08+00:00,Covid: Midday deadline for Greater Manchester coronavirus deal
1318339917303275522,2020-10-19 23:55:04+00:00,"I've never understood American elections - voters, electors, electoral colleges etc but if there's 1 thing COVID has shown us, the postal voting system where some states accept postal votes before, during &amp; after &amp; some don't, voting is as daft as it can be!"
1318339906264072192,2020-10-19 23:55:01+00:00,covid 19 ntm ma vie me manque
1318339902304563201,2020-10-19 23:55:00+00:00,Gas seeing everyone’s conspiracies about covid and lockdown🤣🤣🤣 take a day off ffs
1318339901277032450,2020-10-19 23:55:00+00:00,"Latest worldwide COVID-19 data: 40,612,487 cases, 1,122,254 deaths.

A 2.76% fatality rate."
1318339900018667527,2020-10-19 23:55:00+00:00,everyones tough until the nurse puts a swab all the way up your nostril while testing you for covid like holy shit i cried a little
1318339893244944385,2020-10-19 23:54:58+00:00,"COVID 19 = Mail-In Ballots

Any doubt why COVID is spiking? 

#Trump2020Landslide"
1318339881077190657,2020-10-19 23:54:55+00:00,"As a small business owner, I’m a big fan of folks that unplug and do their own thing!
Any information I find that can help during this Covid crisis, I share   
#MSC"
1318339838433656833,2020-10-19 23:54:45+00:00,"it's amazing this game is even being played it's a little tough to enjoy giving the pretenses that it is scheduled due to covid-19...

definitely big thank you to everybody that made this game go off especially players and fox"
1318339835065716737,2020-10-19 23:54:44+00:00,Now on day 5 of waiting for my COVID test results. Honestly think my isolation period will end before I find out at this point.
1318339829487292416,2020-10-19 23:54:43+00:00,"SUPERSPREADER: Is Pa House Rep. @RussDiamond a legislative Super Spreader? From anti-mask events, to the House Floor, Russ Diamond seems to be a common denominator in Covid-19 outbreaks &amp; today he’s maskless at work, again. It’s really hard to say for sure. #BeReal #Vote"
1318339811728478208,2020-10-19 23:54:39+00:00,"Just in case y’all missed it, Alberta is at the highest amount of covid cases ever.
#abpoli #COVID19AB"
1318339804552101893,2020-10-19 23:54:37+00:00,"While COVID-19 leads to theater closures and family separation, video and technology come in handy for entertainment and connectivity.

#Entertainment #Connectivity"
1318339804325679110,2020-10-19 23:54:37+00:00,"My neck is cold,  trying to shake off this??  flu,  covid.  Need my @NHLFlyers scarf."
1318339804090818560,2020-10-19 23:54:37+00:00,"Did some “comfort grocery” tonight. Guy in line comments about all the great food. I said, “I’m a teacher. Just trying to cope.”

Instant friends. #misery #covid #teacherlife"
1318339803449036805,2020-10-19 23:54:37+00:00,"Dr Scott Atlas is American Board certified in radiology, as I am in neurology. If even one Covid patient dies, or is harmed based on our medical advice to Trump, it would be imperative for the relatives to sue us for millions. Please retweet widely to reach affected USA families."
1318339800731062272,2020-10-19 23:54:36+00:00,October has probably been the funnest month since covid started lol
1318339788030660608,2020-10-19 23:54:33+00:00,What’s crazy about covid: about 4 months ago I went to get tested so I could have cataract surgery. I took the test on  a specific day and decided to go to another location to get another test that same day. One came back positive and the other negative. Like huh?????
1318339773011005440,2020-10-19 23:54:30+00:00,2)So the Ohio health Dept told the family they were labeling all 4 of them as having Covid. That is wrong in so many ways &amp; don’t care what they say! You now have 4 cases instead of 1 and that is a lie! This is why you’re seeing a rise in cases!  @GovMikeDeWine @MikeDeWine
1318339769227771904,2020-10-19 23:54:29+00:00,yall i think i have covid 👁👄👁
1318339759719079937,2020-10-19 23:54:26+00:00,I just jumped off a conference call to get a COVID-19 test. Pretty sure that's about the most 2020 thing I can do. #StaySafe
1318339755738828801,2020-10-19 23:54:25+00:00,"I wanted a baby show but between covid and everybody being so spread out from Louisiana to Texas, it's not gonna happen"
1318339749644558340,2020-10-19 23:54:24+00:00,are you taking the covid vaccination when it comes out?
1318339739737559042,2020-10-19 23:54:22+00:00,IF YOU HAVE COVID STAY THE FUCK HOME AND OUT OF PUBLIC BUSINESS’S YOU ASSHOLES
