id,date,tweet
1305287233289826304,2020-09-13 23:28:22+00:00,Just finished my week as the covid doctor. In a state with high positivity rate. Patients still getting sick and dying. Still not adequate PPE 7 mo later-still using same equipment from March. Still not enough testing unless you are an athlete or in congress or rich. I get that
1305287222304751616,2020-09-13 23:28:19+00:00,#springst #covid #VictoriaPolice Some media which usually backs police 100% when they assault protesters at demonstrations are now banging the drum about police brutality!! Let's hope the next time there is a climate change demo this new found critique of police holds!
1305287201912127495,2020-09-13 23:28:14+00:00,99.9% positive I have Covid and I feel like I’m dying. Someone help me.
1305287174699413505,2020-09-13 23:28:08+00:00,"lol the surveys from every single company very kindly &amp; very desperately asking me whether my spending &amp; saving habits have changed under Covid - they have - &amp; what I will spend on if I come into extra money - nothing...

EXCEPT FOR MUSIC.

Art forever you silly silly fools."
1305287165614657538,2020-09-13 23:28:06+00:00,Went to a @Walgreens today to get my flu shot in 🇺🇸. Pharmacist told me Covid was “population control” and gave thanks to Trump for his rallies. Disgusting. Going back to Canada SOON. WHAT HAPPENED TO MY COUNTRY?? Please #vote.
1305287165237231618,2020-09-13 23:28:05+00:00,"BC (before covid): should probably start steering away from the graphic tees

Now: Graphic masks?! 😩😷"
1305287155024113665,2020-09-13 23:28:03+00:00,I am very disappointed 😔 in the way the evaluation of my child Covid 19 possible contact from the first two days of school was conducted and so many errors to the infection date wrong to the follow up calls since the 4 sept and still waiting for a answers #COVID19
1305287136141344769,2020-09-13 23:27:58+00:00,On a wait list to be a lab rat for the covid vaccine let's goo
1305287123503902720,2020-09-13 23:27:55+00:00,Someone responded to my pie tweet but I cannot see it; so I guess I'm forever stuck with apple pie 🤦well until 2022 based on COVID projections.
1305287110921007104,2020-09-13 23:27:52+00:00,1 in 18 students at uiowa have covid &amp; workshop ppl r really trying to have in person talk art...
1305287109692059648,2020-09-13 23:27:52+00:00,COVID has really got the best of me .. I took quarantine too far .. isolation is not good for me and I’ve been doing it since February.. this is a HARD cycle to break 🥴🥺
1305287102892998661,2020-09-13 23:27:51+00:00,13/09/2020 19:27:50 Another American has died from COVID-19. #Every80Seconds
1305287102158995459,2020-09-13 23:27:50+00:00,Sick of u niggas COVID-19
1305287095326519299,2020-09-13 23:27:49+00:00,"Gintama the second movie is 
""Gintama featuring COVID-19"""
1305287092331782145,2020-09-13 23:27:48+00:00,"Have you experienced/are you experiencing any conflict within your own home due to a partner/spouse not exercising the same level of precaution as you regarding COVID-19? I’ve yet to see anyone talk about this, and I’m curious."
1305287083251040256,2020-09-13 23:27:46+00:00,Quick TIFF update: 76 DAYS is so brutal. Doc from the COVID frontlines in Wuhan. No idea how they made this. A popcorn classic
1305287068243750913,2020-09-13 23:27:42+00:00,Y’all out here with COVID secretly &amp; still won’t stay out of ppls face. That’s fcked up lol.
1305287058198593537,2020-09-13 23:27:40+00:00,"Scottie Scheffler has tested positive for COVID-19 and withdrawn from next week’s US Open. Counting 72-hole scores, he was coming off a 2nd-place finish at the Tour Championship."
1305287038896189440,2020-09-13 23:27:35+00:00,There are new COVID cases on our campus but we’re lazy so you’re finding out from the news and not us
1305287038648942599,2020-09-13 23:27:35+00:00,"To anyone who is qualifying #TheTrumpDepression because covid came out of the blue, other countries had the same problem and didn't utterly fuck up the response to the pandemic like Trump did. The current economic damage is way worse because of the #CovidiotInChief #VoteBlue2020"
1305287035931029504,2020-09-13 23:27:35+00:00,"Gramma had to call 911 and got admitted for low blood counts, grandpa had someone at his inpatient physical rehab facility test positive for Covid, know my little brothers going through one of the worst weeks of his life. Could my life please just be boring for a week please."
1305287014971879424,2020-09-13 23:27:30+00:00,Thought I might have to vote Labour to keep the COVID response safe but a lack of real action on Child Poverty has caused a rethink.
1305287010958020609,2020-09-13 23:27:29+00:00,"Israel is doing a second COVID closing, for three weeks. How in the world did the Democrats pull that off?"
1305286988308897799,2020-09-13 23:27:23+00:00,"The BBC World Service is doing this thing right now where relatives of people who've died from COVID-19 read little mini obituaries.
Long story short, had tears in my eyes while doing the dishes."
1305286969585524736,2020-09-13 23:27:19+00:00,The best thing in the world is to hug someone of your family who had COVID-19 but now is fine 💜💜💜
1305286963340234753,2020-09-13 23:27:17+00:00,As a Canadian it’s still f*cking mind-boggling to me that the President of the country with the most out-of-control COVID outbreak thinks it’s acceptable to hold indoor rallies with no masks or social distancing during a f*cking pandemic.
1305286953483595787,2020-09-13 23:27:15+00:00,"Maybe this is controversial, but I completely understand why London now has a COVID outbreak. 

I too am starting a new school year desperate to build community &amp; would love to have actual human interaction with others in my department. Fostering community online f-ing sucks."
1305286938027585536,2020-09-13 23:27:11+00:00,"Big news: Scottie Scheffler, who's finished top-five in three of his last four starts, including a T-4 at the PGA Championship, has WD'd from the upcoming U.S. Open due to a positive COVID-19 test."
1305286933048733696,2020-09-13 23:27:10+00:00,Lol ppl actually post their negative covid results like we care yall weird
1305286914212208640,2020-09-13 23:27:06+00:00,Had to go to the ER last night because I had an allergic reaction and my throat closed. The nurse shamed for taking up a bed in an EMPTY ER. So we’re just supposed to stop all care now except for Covid? Jeez 🤦🏽‍♀️
1305286894452838401,2020-09-13 23:27:01+00:00,WOW the price of my tobacco just got raised by $16.75. I guess we know how the government is getting there covid money back.... NOT HAPPY SCOMO
1305286889478422528,2020-09-13 23:27:00+00:00,Damn they really do be fuckin your brains with this swab for this Covid test 🥴
1305286886538252288,2020-09-13 23:26:59+00:00,Canada really did get $2k a month????? Anybody over here with dual citizenship better have gone home during covid 🤣
1305286880120967169,2020-09-13 23:26:57+00:00,"A COVID story:

Tufton tweets but MOHW also tweets: “PR to boost followers. Right after news. Info suppression. Post on personal 2 minute before. Election ploy. Campaign. GRRRRR”

Only MOHW: “Set time. Nuh care if humans. 10 am, 6 pm”

On Website: “Nah mek one click”

Hate unu"
1305286876719452160,2020-09-13 23:26:57+00:00,"Scottie Scheffler withdraws from the 120th U.S. Open. Is asymptomatic but has tested positive for COVID-19 

Will be replaced at Winged Foot by 1st alternate Branden Grace"
1305286865516335104,2020-09-13 23:26:54+00:00,Dear @GOPChairwoman: @JoeBiden does not have a record on responding to COVID. He has not held a position in government since nearly three years before the virus existed.
1305286862639190017,2020-09-13 23:26:53+00:00,During the height of COVID lockdown I learned that I'd been making toaster waffles wrong my whole life and that's why I thought they suck
1305286844242890752,2020-09-13 23:26:49+00:00,"Tried to buy dumbbells for home today.

There were none.

Thanks COVID."
1305286840375627776,2020-09-13 23:26:48+00:00,I should be in LA right now...fuck you Covid
1305286836013527041,2020-09-13 23:26:47+00:00,"2020 is the best. Every time I’ve taken PTO, something has happened to ruin plans. This time, it’s all of the smoke. It’s making breathing difficult, and I find myself short of breath. Which, awesome, because those are also COVID symptoms. Guess I won’t be going to the lake."
1305286830842023936,2020-09-13 23:26:46+00:00,"Literally dealing with mental health and COVID, it’s exhausting. In a position where my job be in jeopardy everyday‼️"
1305286822168207360,2020-09-13 23:26:44+00:00,"#StandWithUmarKhalid
Covid is not an issue
Economic crisis is not an issue
GDP fall is not an issue
Farmers Suicide is not an issue
Rape is not an issue
Unemployment is not an issue
Poverty is not an issue
Lynching is not an issue
Corruption is not an issue
The issue is Dissent"
1305286815717429249,2020-09-13 23:26:42+00:00,Lol okay Covid I need u to go dred. I miss taking trips. I need to explore the world before Nassau under the water
1305286796633403393,2020-09-13 23:26:38+00:00,So which NFL team do we think will be the first with a COVID breakout and why is it the Bucs?
1305286788404006913,2020-09-13 23:26:36+00:00,"Freakin MAGA Covid deniers are messing up my day by commenting on my posts. First it was the 99% survive, now it's the 6% is the ""true number"". 

I've seen it here in the hospital. It's NOT A JOKE!"
1305286787376582656,2020-09-13 23:26:35+00:00,"Hi @JustinTrudeau @cafreeland — COVID has killed over 800,000 and could push 71 million into extreme poverty. We need you to help #EndCovidEverywhere by dedicating at least 1% of Canada’s pandemic response funds to fight COVID-19 globally. No one is safe until everyone is safe."
1305286767088726022,2020-09-13 23:26:30+00:00,13/09/2020 19:26:30 Another American has died from COVID-19. #Every80Seconds
1305286757592821761,2020-09-13 23:26:28+00:00,UIowa isn’t informing students who live off campus when their housemates test positive for COVID-19. 73% of @uiowa students live off campus.
1305286754736287744,2020-09-13 23:26:28+00:00,COVID is just buggy.
1305286743554322432,2020-09-13 23:26:25+00:00,Busy afternoon on organizing in oc areas. Have tracked  key storues today. Trunp vs biden big story. Biden advantage is covid 19. La storu on compton is big story in la and southern California this weekend.
1305286740593307650,2020-09-13 23:26:24+00:00,Tom Dempsey and Toots Hibbert both killed by COVID-19 in the same week. as well as so many others. so sad and infuriating. fuck fucking COVID and fuck the mismanagement of the whole thing
1305286714005438465,2020-09-13 23:26:18+00:00,My mom travels a lot and hasn’t been able to because of COVID so I gave her my phone and she watched @bouta_nt and @martique75 videos for a while with a smile... I think she went home happy. Nothing like a lovely Irish farmer and a crazy Australia trucker to lift spirits.
1305286712399192065,2020-09-13 23:26:17+00:00,"Goodell just told Payton to put the mask on. But if he already had Covid, what’s the point?"
1305286690097987584,2020-09-13 23:26:12+00:00,But also I have me COVID swab on Tuesday and have to self isolate from then until Friday like 🥴🥴 Joanne says I have to do it in me bedroom can yi even be arsed 🙃🙃
1305286681835184128,2020-09-13 23:26:10+00:00,"People wanna talk about child trafficking?? What the fukk do you call trump DEPORTING 8,800 UNACCOMPANIED BROWN CHILDREN @ THE BORDER WHOM HE STOLE THEN LOST FROM PARENTS?! Ya he just deported 8800 kids here LEGALLY ON ASYLUM. Using “Covid worries” an excuse to strip their rights"
1305286681424261120,2020-09-13 23:26:10+00:00,"To be fair, Mr. Woodward is 77 years old &amp; COVID-19 is more deadly to his age group...so is he mad because Trump didn’t prioritize his needs?? 🤷🏻‍♀️"
1305286674226786304,2020-09-13 23:26:08+00:00,"Ha and all these bots or at best trump foamers that immediately all like any mention of covid being fake, ect."
1305286603795906561,2020-09-13 23:25:52+00:00,"Nearly 90 per cent candidates appeared in the medical entrance exam National Eligibility cum Entrance Test held at over 3,800 centres across the country on Sunday amid strict precautions in view of the COVID-19 pandemic. 
#NEET2020 #Exams"
1305286589422219265,2020-09-13 23:25:48+00:00,"as covid-19 continues 2 ravage r country we c no leadership at all from @POTUS - where is the federal response? What is being done now, rather than wait &amp; hope private companies come up with a vaccine? Why does covid-19 continues 2 kill Americans w/o any nationwide approach? SAD"
1305286577933910018,2020-09-13 23:25:45+00:00,"Is it just me or are all you tech ppl tweeting more pet pics since Covid?
I'm here to say I like this change in this particular soc media platform.
Keep em coming."
1305286577011163137,2020-09-13 23:25:45+00:00,"I tried so hard to prevent myself or my kids getting Covid. This shit is not a joke, I feel fucking horrible. My body hurts, fever &amp; no taste whatsoever 😭 can’t wait till this shit is over with."
1305286574486122497,2020-09-13 23:25:45+00:00,if anyone was wondering if covid is gonna end anytime soon it’s not some guy at albertsons was carrying his mask in his mouth 🤢
1305286571038519296,2020-09-13 23:25:44+00:00,Y’all do know Covid ain’t going away by New Years just because you want it to right?
1305286556664635392,2020-09-13 23:25:40+00:00,I want it on record that if my mam or i die from covid it’s 100% my school’s fault fuck them
1305286551585333249,2020-09-13 23:25:39+00:00,Brady struggles to be expected. 1) Saints are a good defense 2) his game is about precision and timing. There was not enough time build in-game chemistry with his teammates bc of COVID. Don't expect the whole year to be like this though
1305286522346889217,2020-09-13 23:25:32+00:00,"FOX news. CoVid could have killed MILLIONS. 
Seasonal flu ? What is the death rate? 
@realDonaldTrump saved Millions of lives!  #JoeHiden"
1305286516168679429,2020-09-13 23:25:31+00:00,I can’t believe I have to say it. I ain’t sharon no Gatorade bottle with my teammates. ESP during Covid 🤢🤢🤢🤢🤢🤢🤢
1305286514440507392,2020-09-13 23:25:30+00:00,Parang we are all just waiting for covid to hit us e ‘no? Wala ng disiplina. Some are taking this as petty. Scary.
1305286465400705024,2020-09-13 23:25:19+00:00,update: grandma is in the ER but cousin has reassured me at great length that it is PROBABLY not covid so I am mostly willing to believe it might not be covid
1305286462938714112,2020-09-13 23:25:18+00:00,Grimace planting a flower on a cigarette (with COVID-19).
1305286462909198336,2020-09-13 23:25:18+00:00,"185 quarantine days. It's like wala na Covid sa Pinas with the way things are going. I don't even see any posts on cases, deaths and recoveries anymore."
1305286455229657089,2020-09-13 23:25:16+00:00,If there is a confirmed case of Covid in my kids school they shut the bubble... but schools staying open when there are suspected cases but no tests available... making me nervous
1305286449797849089,2020-09-13 23:25:15+00:00,"Covid cases rose sharply after BLM protests, will the same happen in coming weeks? 🤔 #Covid19Victoria"
1305286443221344256,2020-09-13 23:25:13+00:00,"Someone please fucking explain this shit to me: 
A couple of girls on my sisters freshman volleyball team tested positive for COVID. The coaches sent SEVEN girls home to quarantine for 2 weeks. WHY ONLY SEVEN??? How is the whole team, who share and touch a volleyball, not"
1305286437420568578,2020-09-13 23:25:12+00:00,Does a parent of an autism child/adult have any advice on how to get an autism adult tolerate a Covid mask for long periods of time? Could a combination of a shield help?
1305286433842892800,2020-09-13 23:25:11+00:00,Perrysburg schools report another 41 students and staff put into isolation (114 total). 133 students and staff newly added to quarantine. #perrysburg #woodcounty #ohio #COVID19 #covid #coronavirus
1305286431540207616,2020-09-13 23:25:10+00:00,13/09/2020 19:25:10 Another American has died from COVID-19. #Every80Seconds
1305286425189986308,2020-09-13 23:25:09+00:00,Scottie Scheffler is a WD from the US Open after testing positive for COVID-19.
1305286417715810304,2020-09-13 23:25:07+00:00,ok like i realize that there is basically 0 covid in my province rn but it still KILLS me to see snap stories of people partying
1305286417506017283,2020-09-13 23:25:07+00:00,"Covid/2020 has been a serious cluster but not only is it bringing us a new Springsteen album but also the #PrincessBrideReunion tonight so... thank you modern technology!

(Also their hashtag is perfect ⬇️) 
#DumpTrumperdinck"
1305286400099655686,2020-09-13 23:25:03+00:00,79 cases only! naija covid sha
1305286399776763904,2020-09-13 23:25:03+00:00,"Total COVID-19 tests performed in Taiwan: 181,922. 498 cases, of those 0 today; 7 deaths, of those 0 today."
1305286371926568965,2020-09-13 23:24:56+00:00,"I saw my first movie at the cinema since COVID last night

Bill and Teds 3.

It was terrible. Most heinous.
💔💔💔💔💔💔
😖😖😖😖😫😫"
1305286344432787457,2020-09-13 23:24:50+00:00,People out here believing in religion but not covid numbers lol.
1305286326317711360,2020-09-13 23:24:45+00:00,ppl that say covid instead of corona bother me
1305286324363169793,2020-09-13 23:24:45+00:00,"Scottie Scheffler has tested positive for Covid-19 and has withdrawn from the U.S. Open. He is asymptomatic, the USGA says."
1305286320890064896,2020-09-13 23:24:44+00:00,I DONT HAVE COVID !
1305286310492614656,2020-09-13 23:24:42+00:00,oh imma go crazy when covid is over
1305286308621934592,2020-09-13 23:24:41+00:00,Ohh! Mi primer tweet en 2020! #covid #firsttime
1305286291551072257,2020-09-13 23:24:37+00:00,1 more week and we gonna have to go back in classes again. Which makes me afraid because the covid cases this last month just went up so much
1305286280314597376,2020-09-13 23:24:34+00:00,Speaking of it like seriously aint that much covid in the world 😒
1305286252787388416,2020-09-13 23:24:28+00:00,"My parents say the rosary every evening they asked me if I wanted to join this evening so I did, prayed for all those who have gone because of covid and those that left us (not because of covid)"
1305286243006152710,2020-09-13 23:24:26+00:00,"HumanDefenseINI: RT @HumanDefenseINI: NEED: Mama L's family is in dire need of help with groceries, diapers &amp; necessities since work has been extremely slow due to COVID-19. We know many are struggling right now &amp; wanted to rally to help this family while they get on their f…"
1305286238900027397,2020-09-13 23:24:25+00:00,So COVID-19 does not affect election and campaigns in Nigeria 🇳🇬 but it affects schools. That is why Obaseki is trending........ APC is hopeless
1305286233556353025,2020-09-13 23:24:23+00:00,"Love flying with @Delta and I understand it’s COVID times, but why am I paying for first class and getting garbage for snacks? If you’re serving beer and wine then you can have hard liquor and if you can have crappy wheat thins &amp; cheese then you can have food"
1305286216942866432,2020-09-13 23:24:19+00:00,Scott Scheffler out of US Open after testing positive for COVID. Damn
1305286215927697408,2020-09-13 23:24:19+00:00,Listening to the original Deus Ex soundtrack because that whole COVID-19 Nostalgia shit is no joke.
1305286211540574209,2020-09-13 23:24:18+00:00,"COVID-19 has at least made it easier to explain work:

To know which vaccine is effective, they run an RCT.

To know which program is effective, we run an RCT (or use other quasi-experimental designs, as needed)

Nope, still can't advice on stocks!"
1305286207501479936,2020-09-13 23:24:17+00:00,So how long will it take for a NFL game to get canceled because someone got Covid?
1305286166841884675,2020-09-13 23:24:07+00:00,"Does anyone think, Mr. Obama would have been as overwhelmed and clueless as tRump is, concerning the Covid virus?"
1305286157085933569,2020-09-13 23:24:05+00:00,"Lancaster county has 643 recorded Covid-19 cases reported, the largest number to date. Social distance y’all. Wear your masks. Be safe please."
1305286150186205184,2020-09-13 23:24:03+00:00,"Also on the COVID testing front, MIT reports 6 positives on 13,691 tests for its campus surveillance testing regime, now entering its fourth week."
1305286148084948992,2020-09-13 23:24:03+00:00,"Who am I? I am voting against socialism, defund the police, riot, green deal, raising taxes, government shutdown if Covid numbers spike...instead of voting for a candidate I like. Sound familiar @catturd2 @rightwingnative"
1305286142233903104,2020-09-13 23:24:02+00:00,"Trump
Stiffs contractors
Steals from charities
Cheats on wives
Riducules disabled. 
Sexually assaults. 
Only 5 new miles of border built (LOL)
Trade deficit at 12 yr high
Increased natl debt $5.3 TRILLION
Downplays COVID, 195,000 dead. World's worst."
1305286138173808640,2020-09-13 23:24:01+00:00,one of my teammates tested positive for covid so I’m on my way home to quarantine for a few weeks. maybe I’ll finally be able to write in my own room 😔
1305286132700045312,2020-09-13 23:23:59+00:00,"Wasn’t aware covid was over, but apparently working from home is."
1305286131622215681,2020-09-13 23:23:59+00:00,"If we would have less COVID-19 by not testing, stands to reason we would have less diabetes, hypertension, and cancer if we stopped screening. This is going to save a lot of lives."
1305286123460136961,2020-09-13 23:23:57+00:00,Officially post-covid era? 🤔
1305286112236232704,2020-09-13 23:23:54+00:00,"I have thrombosis, caused by covid. I need to be hospitalized. the situation is serious."
1305286111963512834,2020-09-13 23:23:54+00:00,"1. Trump knows how deadly Covid can be and still minimizes it publicly, which is killing people and which makes him a mass murderer. He also leaked classified information to Woodward. It's all there in the recordings."
1305286111560978434,2020-09-13 23:23:54+00:00,My favorite part about COVID is that we get to hear every single curse shouted by the players and coaches😂
1305286107106619392,2020-09-13 23:23:53+00:00,"Leading a parking lot full of cars to a car rally to celebrate a virtual wedding = the best exam pre-game activity. 
Creativity means we can stay safe and still show up and be connected. #covid is not ALL bad. 
#dontbumpmycar #socialdistancing"
1305286103868473344,2020-09-13 23:23:52+00:00,"At this point I’m just waiting for my family in my hometown to get COVID. They visit each other regularly, have indoor family parties, allow others to visit, and no one wears masks or socially distances. All 55+, and some have diabetes and health conditions."
1305286098730524674,2020-09-13 23:23:51+00:00,Hamstring injuries have taken out more NFL players than COVID this year. Ban HAMMY INJURIES!
1305286096113328128,2020-09-13 23:23:51+00:00,13/09/2020 19:23:50 Another American has died from COVID-19. #Every80Seconds
1305286093437308928,2020-09-13 23:23:50+00:00,"More than half of the 8,000+ people to die of Covid-19 in Illinois so far were in longterm-care facilities."
1305286090132135936,2020-09-13 23:23:49+00:00,"Knowing my COVID status is a nice respite from the stress, if only for a moment. On my way to go have an indoor visit with my parents. 🥰"
1305286061510230017,2020-09-13 23:23:42+00:00,"How's your #mentalhealth these days? 

A lot of bad stuff going on. No end in sight with Covid. It's depressing. 

My stress/anxiety levels ebb and flow. Holding onto all the good stuff I've got. 

Personal testimony: Do something nice for someone else. Get out of your head."
1305286056812539905,2020-09-13 23:23:41+00:00,Are grocery stores etc having to recirculate air due to smoke? curious if Covid risk increased
1305286050609115136,2020-09-13 23:23:40+00:00,I genuinely don’t care if people who attend Trump’s rallies catch COVID and die—but it’s obscene that they will take so many others down with them.
1305286048587620352,2020-09-13 23:23:39+00:00,"Someone in my section came in contact with someone that tested positive for covid so if he tests positive then the whole section needs to quarantine for 10 days
Fun"
1305286020326285312,2020-09-13 23:23:32+00:00,not trump having a rally in my state and breaking the covid requirements
1305286012466270209,2020-09-13 23:23:31+00:00,Is it interesting that the people who don't believe in evolution are exactly the same people whom COVID most easily removes from the gene pool? #Science #COVID19 #coronavirus #COVIDIOTS
1305286007684726784,2020-09-13 23:23:29+00:00,"How does one find a boyfriend these days? Don’t say dating apps bc I’ve tried them all and they just don’t work properly. Also, covid is not helping, is it? 🙃"
1305286000180998144,2020-09-13 23:23:28+00:00,"Listened to news today about Chapel street businesses going to the wall. Actually, if anybody saw my tweets from even couple years ago i have been saying every 3rd shop was emply even 3 to 4 years ago. Same at other strip centres. Trying to link this to Covid now is wrong."
1305285972867780608,2020-09-13 23:23:21+00:00,"Took time off to cough
Not covid or what you did
Here now to dump Trump.

#Haiku"
1305285954182283264,2020-09-13 23:23:17+00:00,"Not much new on 60 Minutes, except the voice of Donald Trump sounding like he has given up on Covid."
1305285944967196672,2020-09-13 23:23:14+00:00,I'm so confused by @nfl's #COVID-19 protocol. Andy Reid was wearing a fogged-up welder's mask outdoors Thursday night but today - indoors - Sean Payton is wearing only a smile?
