id,date,tweet
1318336077568954368,2020-10-19 23:39:49+00:00,"#Kentucky
Hurrah! Thank you very much, President Trump!

The casualties of the atomic bombs by the end of 1945.
 Hiroshima  140,000
 Nagasaki    74,000
 The sum    214,000

The deaths of COVID-19 in the US  220,000 (Oct19)

We've revenged the A-bomb victims with your help."
1318336068941418496,2020-10-19 23:39:46+00:00,"This has been one of the hardest election seasons to organize in. Not because of covid, but because people are tired of the lesser of two evils philosophy and any organization promising you they will deliver numbers are full of shit."
1318336048213221381,2020-10-19 23:39:42+00:00,"Just found out that my Uncle died of Covid. He'd been in a care home in IL since the first of the year with Parkinson's, but was doing okay with the quarantine they had set up - until last week. 18 people in the center now have Covid. #WearAMask  #SocialDistance  #WashYourHands"
1318336021205905408,2020-10-19 23:39:35+00:00,"Melbourne’s 14 day rolling average for Covid 19 cases is down to 6.4 surrrrrely we bring forward the November 1 date by a week, we are on track!!"
1318336015455735814,2020-10-19 23:39:34+00:00,"In #CA48 Harley Rouda has raised $5,072,960. Michelle Steel has raised $3,357,246 but she's also dumped $1.773M of her own money into the campaign. Harley out raised her $1.7M!

She self-funded after her family got upwards of $700k in taxpayer funded PPP COVID bailouts."
1318335977358684162,2020-10-19 23:39:25+00:00,my mom taking me to this (covid safe) tatreez workshop for girls aged 12-17 😀 let’s see if i pass for 17
1318335964352335872,2020-10-19 23:39:22+00:00,"National governments are neglecting the most effective and safe routes to discovery speedy cures for Covid-19 pandemic, by forgetting corporate profitability and intellectual property rights in favour of global cooperation through open and shared research."
1318335960095035399,2020-10-19 23:39:21+00:00,"Call me crazy but I like my presidents without COVID.

#TrumpHasCovid 
#DrFauci"
1318335953833000966,2020-10-19 23:39:19+00:00,"My 7yo just said “if only scientists could figure out how to fix covid then we could go more places”. I feel ya, buddy."
1318335947470229505,2020-10-19 23:39:18+00:00,Never fucked with flu shot never will y’all be safe cuz that shit got a covid sprinkle this year
1318335922992254977,2020-10-19 23:39:12+00:00,"i really did do first and second year the wrong way round, first year in relationships and spending time in my flat and now second year i’m single and wanna go out but i’m a) covid positive and b) drowning in fucking uni work"
1318335919666171904,2020-10-19 23:39:11+00:00,Covid gonna take all those “pure white” people out.
1318335919615746048,2020-10-19 23:39:11+00:00,wait so is covid like cleared up in canada?
1318335916465823744,2020-10-19 23:39:10+00:00,"COVID test was negative. So, my fever is most likely another infection. It keeps getting worse whenever my immunosuppressants ebb in my system. Husband is installing our third fridge for the week. Fingers crossed. Neighbors' destruction and paving noises ongoing."
1318335904436621312,2020-10-19 23:39:07+00:00,I’m going out this out there now but my boss is awaiting test results for covid.... if positive me and jordi are screwed! 🙏 because me jordi and the other clients have been in contact 😔
1318335883695841280,2020-10-19 23:39:02+00:00,I live above my complex’s pool and I hate it. I’m tempted to screen COVID-19 is still a thing out my window.
1318335877450522624,2020-10-19 23:39:01+00:00,"There was financial disbursement during covid outbreak from the govtment even though we no see am
How comes there isn't financial disbursement for #EndSARS Protest, is it fear?
#sorosoke247 #EndSARS #EndBadGoveranceInNigeria #EndPoliceBrutality"
1318335872379617283,2020-10-19 23:39:00+00:00,"The most serious threat to the USA is Donald TRUMP.
More American's died due to his inadequate response to COVID-19. 
More Americans will die because he still doesn't have a plan.
NATO is weaker now than since the fall of the Berlin wall due to TRUMP.
DUMP TRUMP"
1318335855111569408,2020-10-19 23:38:56+00:00,"Time is a flat circle in the era of COVID. 

Somehow it feels like Halloween &amp; the election and maybe even Thanksgiving have already happened, and yet all of it is still weeks or months away?

Like, I don’t have Halloween anticipation because it feels like it’s already happened?"
1318335842969157632,2020-10-19 23:38:53+00:00,Got that COVID cock
1318335840485998592,2020-10-19 23:38:52+00:00,legitimate question aside from the 2000$ stimulus did the federal government do anything about covid or was that all state government
1318335838846095361,2020-10-19 23:38:52+00:00,"Wow!! It’s so funny that this sitcom is making covid jokes! Glad these people are wearing masks at fake work

Why aren’t they wearing masks while film- WHY ARE THEY FILMING?"
1318335829270474753,2020-10-19 23:38:49+00:00,"We will NEVER forgive the @GOP for @realDonaldTrump and this covid f*cking FAILURE for our kids. We trust Fauci, not Trump. Thanks, enablers: @senatemajldr @LindseyGrahamSC @SenThomTillis @CoryGardner @SenMcSallyAZ @tedcruz @joniernst @marcorubio @SenatorCollins"
1318335812568862720,2020-10-19 23:38:45+00:00,"Just a friendly reminder that covid isn’t a joke, I’m literally breathless from simple daily tasks 🙃 take it seriously pls"
1318335809599070208,2020-10-19 23:38:45+00:00,"feeling reckless,,, should i try to get a tattoo in wisconsin,,, during covid???"
1318335806038224896,2020-10-19 23:38:44+00:00,I just don’t understand why IHSA won’t let Baseball play their regular season schedule. Baseball is one of the safest sports to play during Covid and the guys who play football can just come over after they finish their season to play the last month of the Baseball season.
1318335801802002433,2020-10-19 23:38:43+00:00,"Sooooooooo you want the debate &amp; the organizers to change the topics to foreign policy 😂😂😂🤣🤣🤣🤣 sooooooo u need topic that u can brag about ,but not topic that u have to get tied up with as COVID-19 &amp; the economy ,climate change ect ... pretty interesting"
1318335766020358146,2020-10-19 23:38:34+00:00,"Don’t know if u guys know this about me, but besides standing by @biden I am a HUGE @Mets &amp; #Broadway freak! Everything that kept me going was taken away from me this year! Work is non stop Covid! I just want to thank u all, that befriended me here on Twitter. Ur my sanity! 💙❤️"
1318335764875280385,2020-10-19 23:38:34+00:00,"I feel WHO says keeping borders shut to thwart COVID-19 not ""sustainable"""
1318335762803417089,2020-10-19 23:38:34+00:00,"if you even have a DOUBT of having covid and you dont even tell your flatmates that your getting a test, not self isolate in the meantime. YOU’RE A FUCKING IDIOT. you’re stupid. you’re disgusting to me. i literally hate you."
1318335754775502848,2020-10-19 23:38:32+00:00,I gotta rant. I’m suffering from the economic shutdown I was playing at different bars around Saint Pete then COVID hit. I’ve been barely scraping by. Please save the musicians and save the industry that we all love.
1318335754439983105,2020-10-19 23:38:32+00:00,"a teacher got covid at my school making 2 confirmed and 1 possible case at my tiny ass school lol they really emailed us ""don't be alarmed if you get a contact tracing call from DHHS"" LMFAOOOO I'll be pretty damn alarmed"
1318335740762259463,2020-10-19 23:38:28+00:00,Nothing like coaching unit that want it! Covid ain’t stopping us from getting this work! Virtual Workout A Success @SerraCatholicFB
1318335740477046784,2020-10-19 23:38:28+00:00,I just realised that I barely hear the word England unless someone is talking about crossing the Welsh or Scottish border into England. Our Parliament is called Westminster and is English are usually just called British. Covid has changed that now with the different rules.
1318335733468463110,2020-10-19 23:38:27+00:00,... the first case of covid was almost a year ago now what the hell
1318335723989336064,2020-10-19 23:38:24+00:00,"A6.) The University of Windsor can improve the in-class experience during the pandemic by following all proper COVID precautions, while also offering additional assistance to students as this time can be incredibly overwhelming and unpredictable. #UWinCourseIdeas"
1318335721984335873,2020-10-19 23:38:24+00:00,"The Panda Express I just had was so bland, I genuinely thought I had COVID and had lost my sense of taste"
1318335698357817344,2020-10-19 23:38:18+00:00,"Copper Hills football wins it's first round play off game!!!!!!!!

(Note: Fremont will have to forfeit due to COVID. See, CHHS, timing is everything.)"
1318335697154043904,2020-10-19 23:38:18+00:00,dont want to get too political but if you believe covid started bc of a bat soup gtfo my tl or if you call covid china virus. rot in hell whores... as an ASIAN AMERICAN WHO HAS WITNESSED AND BEEN A VICTIM OF RACISM get off my page/tl get out of my life.
1318335686592921600,2020-10-19 23:38:15+00:00,One of my cousin's has to isolate for 2 weeks cuz one of his classmates got covid omg
1318335655198457856,2020-10-19 23:38:08+00:00,"Btw, if I'm not mistaken, Trump is still contagious with Covid."
1318335649280270336,2020-10-19 23:38:06+00:00,covid can't stop un celebration in chonghua. sana all ☺
1318335647678070785,2020-10-19 23:38:06+00:00,i miss the feeling i had the first time i heard he had covid.
1318335645056630790,2020-10-19 23:38:05+00:00,Covid or no covid we ending the year strong
1318335619433680896,2020-10-19 23:37:59+00:00,"CNN:
“Every I don’t like that got covid did because of their reckless behavior. Everyone I like also got covid because of the reckless behavior of the people I don’t like”"
1318335617483313152,2020-10-19 23:37:59+00:00,"With covid-19 it’s says it can last a day, weeks, and maybe even months."
1318335615373660160,2020-10-19 23:37:58+00:00,The COVID-19 quarantine is officially over for my wife and I. No Ohio winery is safe. WE ARE BACK!
1318335607563833345,2020-10-19 23:37:56+00:00,I wish we didn’t have an incompetent president and a selfish culture. Covid would have been gone. I hate seeing service workers have to wear masks all day.
1318335605470879751,2020-10-19 23:37:56+00:00,if covid takes dan i swear i’m swinging
1318335598168604672,2020-10-19 23:37:54+00:00,"tw // panic attacks , covid

i told my therapist that i had a panic attack before my first covid test and this man really looked at me and said, well how was your anxiety when you got it? SIR, I WAS PANICKING????? IT WAS HIGH????"
1318335589595348994,2020-10-19 23:37:52+00:00,cant tell if my chest pain is covid or the bag of hot Cheetos I ate today
1318335589016653825,2020-10-19 23:37:52+00:00,"If i want to fly, internationally, and i am asked to undertake covid test before boarding, is there a way i can avoid it?

@Charlotte3003G @NeilClark66"
1318335585833132032,2020-10-19 23:37:51+00:00,ok COVID you win
1318335579881353216,2020-10-19 23:37:50+00:00,"I know I was busy with homework on Saturday but it felt like Saban got a pass for being an absolute asshole and coaching with COVID. 
Or did I just miss the convo?"
1318335567763963904,2020-10-19 23:37:47+00:00,"Im out here thinking I haven’t gotten COVID, but the rest of my family has... you know why CUZ MY ASS STAYS INSIDE. But I be knowing I’ve probably have had it cuz these damn bitches be going out....."
1318335564035379200,2020-10-19 23:37:46+00:00,".@realDonaldTrump my aunt just died of COVID-19 because your fucking fat orange whore-mongering, lying, deceitful, racist ass. Can't wait to see you rot in jail before moving on to hell."
1318335563703922689,2020-10-19 23:37:46+00:00,"Covid-19 status as of October 19, 2020 , Time : 05:07(Indian Standard Time)
Total Cases : 7,594,284 (+46,046)
Total Active Cases : 748,670
Total Deaths : 115,235 (+593)
Recovered Patients : 6,730,379 (+70,484)
Tests done till now : 95,083,976"
1318335562672197638,2020-10-19 23:37:46+00:00,“no covid” is gonna be replace “no homo”
1318335557311909888,2020-10-19 23:37:45+00:00,Damn @PlanetFitness I hadn’t been there since Covid.. but this is the 3rd time you charge my card... smh
1318335553637580800,2020-10-19 23:37:44+00:00,Ricketts wrote an op-ed for The Hill in which he comes out strongly against bailouts and further stimulus and portrays Nebraska as a state barely touched by Covid.
1318335507504504845,2020-10-19 23:37:33+00:00,"Tweeting into the Pandemic: More thoughts on #COMLEX and COVID

Personal Opinion: The #pandemic is going to continue, but will occur unevenly.  Some places will be seriously affected 
 
#COVID will continue to cause #obstacles to #assessment as we know it.

1/9"
1318335489406083072,2020-10-19 23:37:28+00:00,imagine if covid happened in 2003 like imagine playing snake on your nokia brick for months inside
1318335481764024321,2020-10-19 23:37:26+00:00,Fxck Covid man
1318335478068858883,2020-10-19 23:37:26+00:00,A friend messaged me and let me know she’s having to postpone her wedding 2 months because her and her fiancé got COVID. I can only imagine what they’re going through!   I know things will look up for them and they will be okay🙏
1318335465066500107,2020-10-19 23:37:23+00:00,Last night when I got home I sat outside on the little terrace to have a cigar. Someone complained from 2 stories above that my cigar smoke could be carrying Covid. The person from the management office told me about it this morning and winked.  She apologized for bringing it up
1318335443759345664,2020-10-19 23:37:17+00:00,Today I learned I have Mantle Cell Lymphoma. That means my immune system is already severely compromised (I received half a dozen units of blood in the hospital last week.) I can hardly afford to get CoViD as I go through chemo treatments. Vote for science! Vote for Joe Biden!
1318335431641976834,2020-10-19 23:37:15+00:00,Up in San Fran tomorrow for a property tour! $20MM non recourse bridge financing assignment we are pitching on.  First flight post covid! Pretty excited about this! Anyone up in SF and want to meet for a coffee?
1318335407000588290,2020-10-19 23:37:09+00:00,"What #Trump is currently doing,is trying to #divert_attention from his many, many failures, by #LYING TO HIS  SUPPORTERS,by #LYING about Dr. Fauci,by lying about #HunterBiden,by #LYING about #COVID-19,by #LYING about what he temporarily accomplished; he's made NO LASTING CHANGES."
1318335395831140353,2020-10-19 23:37:06+00:00,"Trump now trying to make Fauci, the one voice of reason, the scapegoat for his own failures in handling COVID, costing 225,000 American lives so far. #Republicans, it doesn't mean you're no longer a conservative if you vote for Biden. It means you are a moral person with a brain."
1318335391678795782,2020-10-19 23:37:05+00:00,"Trump team demands debate focus on foreign policy- he doesn't want to talk about Covid or American families, not his strengths. But it seemed obvious that Trump would find some pretext to get out of the #Debates2020 ."
1318335376256339968,2020-10-19 23:37:01+00:00,45 really went to my college town and said his son was cured of covid in 12 seconds
1318335374276595713,2020-10-19 23:37:01+00:00,I feel sick 😷 pls not covid 🙏😩
1318335369201537027,2020-10-19 23:37:00+00:00,The father of a college friend passed away from Covid today.
1318335362067025920,2020-10-19 23:36:58+00:00,The number of so-called progressives who are willing to believe that Republicans will pass Covid relief if they just get their nazi appointed to SCOTUS for a lifetime appointment is disappointing.
1318335353661652993,2020-10-19 23:36:56+00:00,Another case of Covid at my brother's facility.  We can't visit until after Nov. 9.  Last quarantine was just about up.  Indiana is out of control.
1318335348657713153,2020-10-19 23:36:55+00:00,Lol did I end my emails with “let’s become a well-oiled Covid-19 communicating machine”....yes...yes I did. 🤣🤣 thank God I survived Monday 🥴🥴🥴
1318335337069006850,2020-10-19 23:36:52+00:00,Just got back to Milwaukee and I'm greeted by the news that Wisconsin is leading the nation in COVID-19...congrats to all those who played such a big role in getting us to number one.
1318335318484017153,2020-10-19 23:36:48+00:00,"Hubs just sent a horrible three word text from his shift: so much covid.  I’m so angry at the depths of our country’s failings and selfishness. Wear a mask, wash your hands, and stay home."
1318335312762867713,2020-10-19 23:36:46+00:00,"Australasia stubbornly keeps proving that full lockdowns work and that Covid-19 has no plan B in the case of communities not transmitting it for a month or two.

Congratulations Melbourne on the excellent albeit ever-so-slightly-circuitous result."
1318335310061850625,2020-10-19 23:36:46+00:00,"Awhile back ago we lost a client to covid and now his son has abandoned his dogs at our clinic. we are trying to find a place for them. We have Athena a 12y Doberman pin. 
Rosie a 6y min pin
And misty a 9y min schnauzer 
If you or someone you know would like them please HMU."
1318335305892524032,2020-10-19 23:36:45+00:00,Animals must not be loaded onto the livestock freight ship in WA given Covid cases. @MarkMcGowanMP @rspcawa @AnimalsAus
1318335301492887552,2020-10-19 23:36:44+00:00,I tested positive for covid 19
1318335290830811136,2020-10-19 23:36:41+00:00,"Found out one of my softball teammates tested positive for COVID today and was sick all weekend. I was in close contact with him for over an hour on Thursday. 

This shit is getting so old."
1318335280382869504,2020-10-19 23:36:38+00:00,The Netherlands PROVED COVID-19 is a B.S. MINOR virus!! Announce it worldwide! Democrats LIED AGAIN! FALSE FLAG in an election year HOAX!😡
1318335267955040256,2020-10-19 23:36:36+00:00,"Wow, great job on the economy @realDonaldTrump!  China’s economy is projected to grow over 4% by year’s end while the US economy is projected to shrink by over 4%. Well done.  Way to handle the economy and COVID-19.  Idiot!"
1318335260984213507,2020-10-19 23:36:34+00:00,"So Donnie is just gonna run on the ""we are bored with COVID"" platform now?"
1318335256785686529,2020-10-19 23:36:33+00:00,i remember when covid first hit they came out in hazmat suits telling us it was just a cold
1318335254797508608,2020-10-19 23:36:32+00:00,my latest development in the Covid stay at home era is getting really into egg punk somehow
1318335254780907523,2020-10-19 23:36:32+00:00,"Sununu's take on COVID-19: We're fine, don't worry about it.
Feltes' take on COVID-19: People matter. Frontline workers matter. Healthcare matters. 
@GovChrisSununu Just because NH is doing well compared to other states doesn't mean we're not in a crisis.
#NHpolitics #VetoSununu"
1318335243103981568,2020-10-19 23:36:30+00:00,Lately I’ve been feeling like it’s a bit difficult to breathe and every single time I think it’s covid coming for me
1318335225101996032,2020-10-19 23:36:25+00:00,Will be interesting to see the Covid Christmas advert from John Lewis.  Any news on when it’s released? @jlandpartners
1318335186036281345,2020-10-19 23:36:16+00:00,If they hadn’t killed Pop Smoke covid wouldn’t have become a pandemic.
1318335181636456448,2020-10-19 23:36:15+00:00,"I already live in a Covid 19 screwy state. Its a highlight of the news broadcast. In they're same breath launching children to schools. ?
To bring home homework and a virus to boot. Opending a state more to have better opportunity to get sick. Just dumb."
1318335180973682688,2020-10-19 23:36:15+00:00,one of my best friends has covid... so i have to stay in quarantine until i can get tested and then i’ll see with the results🥺
1318335170190168064,2020-10-19 23:36:12+00:00,Trump has accused Joe Biden of listening to science in regards to COVID-19. What. An. Outrage.
1318335160052482048,2020-10-19 23:36:10+00:00,"President @JoeBiden is going to have to go back to the basics on COVID-19 info and prevention. People have been so misinformed. If we are going to be doing this for another year, he’s gotta make up for so much lost time and nonsense"
1318335157049458690,2020-10-19 23:36:09+00:00,Please say a prayer for my sister in law ... she was diagnosed with covid last week and is not feeling well at all :/ on her way to the hospital now.
1318335154553868288,2020-10-19 23:36:08+00:00,A perk of Covid~being able to get ahead at work at home with a white claw plus There’s Something About Mary
1318335130042236930,2020-10-19 23:36:03+00:00,"Because I have to play hashtag games by myself bc over 200+ friends are dead from Covid-19

#DeportCurrentWhiteHouseResidents"
1318335128595275776,2020-10-19 23:36:02+00:00,"Been off work for a week. Its been anything but quiet: redecorating,covid scares,broken bones,furniture construction,hospital visits,cake baking,youtube video filming,roof leaks.

But even with all the chaos, I'm still not looking forward to going back to work in like 8 hours."
1318335121536274432,2020-10-19 23:36:01+00:00,"If you’re looking down on people for not being fully behind lockdown, give your head a wobble. Yes, Covid-19 is bad, but there’s lots of scientific data out there showing the downsides of being skint and isolated. Read it before quoting ‘the science’ which you also haven’t read."
1318335117828423681,2020-10-19 23:36:00+00:00,"PSA: The virus doesn’t care if you have COVID fatigue. 

Mask up. Distance. Wash your hands."
1318335109989163008,2020-10-19 23:35:58+00:00,"Been sippin on that lean, need the promethazine.
She said I got a cough, no covid-19."
1318335093027475457,2020-10-19 23:35:54+00:00,y'all I'm getting a covid test done so I can stay overnight tomorrow night with my brother in hospital so I'll be back soonish
1318335088875212804,2020-10-19 23:35:53+00:00,I’ve just watched someone argue that child protection via the courts is not competing with GAA for covid related social space. Not an ounce of empathy. Catholicism for 21st century ireland. Unfollowed and goodnight.
1318335088820563973,2020-10-19 23:35:53+00:00,Is Trump's doubling down on covid misinformation really going to help him at this point?
1318335058089005059,2020-10-19 23:35:45+00:00,First of my congregants contracted COVID today. We were just putting together our reopening plan...
1318335051164086272,2020-10-19 23:35:44+00:00,Covid took flash mobs from me
1318335046378491904,2020-10-19 23:35:43+00:00,"Got tested for Covid 

Came back negative"
1318335037549457408,2020-10-19 23:35:41+00:00,I have these waves where I think covid must be fake the way people are still out here enjoying life but I know I’m not crazy...👀
1318335022865305600,2020-10-19 23:35:37+00:00,My little cousins in Little Rock got Covid from school 😤
1318335019849494529,2020-10-19 23:35:36+00:00,As soon as Covid is gone I’m going to CiCi’s
1318334991491866626,2020-10-19 23:35:30+00:00,I hate Covid. 😩
1318334982268407808,2020-10-19 23:35:27+00:00,Shoutout to all you musicians out there who have to practice at home due to Covid-19. I swear my roommates think I’m crazy playing the same arpeggio over and over again lol
1318334957102813185,2020-10-19 23:35:21+00:00,"My sister’s father-in-law, isn’t going to make it through the night his organs are shutting down, him and 14 members caught Covid 19 while attending Church, and 5 are in ICU. I am sure they are not thinking it was a blessing they caught it Mr. President!"
1318334948701593600,2020-10-19 23:35:19+00:00,"COVID-19 you've had your time, done the damage.. now move on so I can get some investigating done!"
1318334912915787776,2020-10-19 23:35:11+00:00,Joe Rogan cancelled all his podcasts this week because his producer tested positive for COVID.   I hope he gets better obviously but THIS WAS THE WEEK KANYE WAS GOING ON.   Dammit 2020 strikes again!
1318334909409316864,2020-10-19 23:35:10+00:00,"I legit had a customer say to me tonight, ""I don't wear a mask because more people that do wear a mask end up with covid!""

This is without a doubt the dumbest individual I've ever met. Like just put  on the freaking mask so we can actually help stop the spread of the virus!!!"
1318334874563022848,2020-10-19 23:35:02+00:00,Nokia only putting 4G on the moon because we don't want to infect the mooninites with COVID.
1318334846817755136,2020-10-19 23:34:55+00:00,the term precovid suggests the term post-covid and at this point. I don't think that's realistic
1318334846079479811,2020-10-19 23:34:55+00:00,Told some nigga i got Covid and he replies “me too that’s why I’m trynna talk to you “ 😭
1318334823463866370,2020-10-19 23:34:50+00:00,"There is a picture floating around twitter with the covid disease superimposed on trump's face with only his eyes and mouth visible. 
It is hideous. 
I will never picture him any other way."
1318334821316386824,2020-10-19 23:34:49+00:00,Dotard needs to STFU about Dr.Fauci. He’s a hero who has been protecting America’s health for long before COVID. #ImWithFauci
1318334811254214657,2020-10-19 23:34:47+00:00,COVID-19 has really messed things up.
1318334787283832832,2020-10-19 23:34:41+00:00,"Hoping my COVID test comes back positive so I don't have to go to work at a high school with a contagious sickness but also get to afford health insurance next month. WIshful, entitled thinking, I know."
1318334768941953024,2020-10-19 23:34:37+00:00,I really just want a job where I can be safe from covid and wear diapers all day
1318334764323991552,2020-10-19 23:34:35+00:00,COVID free!! Who wanna make out??
